title,body,link,author,created,upvotes,num_comments
Badly need an affordable therapist specializing in traumas around romantic relationships and sexual assault/harassment,"I struggle with dealing with very deep-seated traumas from the past around romantic love and sexual assault and harassment. It has badly affected my own relationship as well as my self-esteem, view of people, particularly men and sex. It has made me very depressed and terrified for so long that I believe its impact on my life needs serious intervention. I have been seeing therapists for years but none specialize in these specific traumas. Currently, I am a client under a trauma specialist but I find it difficult to be comfortable around them. I am also seeing a psychiatrist but I believe that a therapist specialized in these issues is something I am more in need of to save myself.

If anyone here knows one that is affordable (below ₱3,000), please let me know.

Thank you very much",https://www.reddit.com/r/MentalHealthPH/comments/1btwhdq/badly_need_an_affordable_therapist_specializing/,t2_3ag5npfo,2024-04-02 19:36:32,2,11
Trauma after Trauma.,"I was sexually harassed at my old job. The perpetrator was my general manager. After the said incidents I vented all out on my friend. I cried at him via phone call released all the rage, sadness, fear and despair that I was feeling. He knows I’m mentally diagnosed with Bipolar II. The incident really took a mental health toll on me. Imagine the pain, the depression, the trauma I experienced at work. After our call this friend of my mine said “Mahina kasi mental health mo, kaya nangyari sayo yan” and I don’t know what to say since I just vented out yung trauma ko tapos natraumatized pa ako sa sinabi ng friend ko. I mean is it my fault just because I have mental health issues kaya ko deserve yung nangyari sa akin? ",https://www.reddit.com/r/MentalHealthPH/comments/1baj19f/trauma_after_trauma/,t2_cme9bdys0,2024-03-09 22:32:26,12,9
"TW: If I'm gonna kill the person who wronged me and caused my PTSD, I think that's okay and oks lang if yun ang reason to be in jail.","I'm diagnosed with PTSD and recently, Bipolar I.   
Commonwealth and Taxi are my tiggers. I experienced sexual harassment sa co-worker ko.   
While nasa byahe naisip ko, what If I kill him? What are the methods na maganda lol? (then I smiled) If I'm going to jail because of that I think that's fine with me.   


Idk if ako paba to or what. Just sharing my thoughts lol.",https://www.reddit.com/r/MentalHealthPH/comments/15n2m7d/tw_if_im_gonna_kill_the_person_who_wronged_me_and/,t2_mw7bz6y6,2023-08-10 13:00:31,5,1
I reported him,"I reported my co-worker for sexual harassment. Do I need to seek professional help? Or Please convince me to seek professional help.

I really cannot explain why I feel this way.

Recurring symptoms:
- Panicking when I know we’ll have interactions
- Messed up sleep patterns( I wake up atleast 3 times because of uneasiness)
- Constant stomachache 
- Breaking down so easily when asked about the topic
- Losing appetite because of stress

For context, I work night shifts so my sleep can be affected by that but I’m not sure. I just know that I cannot fully focus on work because of the incident and I’m exhausted after having a good cry. 
I’m scared with my own feelings. I don’t know if I can handle this on my own.",https://www.reddit.com/r/MentalHealthPH/comments/14w22b2/i_reported_him/,t2_grqdh798,2023-07-11 02:30:02,3,7
"To anyone second guessing going to Psychiatrist/Psychologist, please take the leap. This is your sign.","I am glad that I took my meds (antidepressants and antipsychotics) and currently on psychotherapy for Bipolar Disorder and PTSD. 

Right now, I am working my way on addressing my intimacy and vulnerability issues, childhood traumas and sexual harassment traumas. 

Psychotherapy and medications work. 
Just please keep an open mind and heart and be patient with yourself.

Saglit lang to. Kaya natin 'to.",https://www.reddit.com/r/MentalHealthPH/comments/x5prwc/to_anyone_second_guessing_going_to/,t2_c8fuf8q5,2022-09-04 23:32:08,35,4
Thinking of ending it all,"Hi, I don't know what to do or who to talk with, pero all this started when i worked with a call center na may logo na Q, i was inappropriately touched by a trans coworker and was also being bullied because i was hitting the daily quota, beating some of my wave mates na kasabayan ko i tried helping them naman, pero for some reason sales really vibed with me and i found it easy pero no matter how good i am at work i always felt like an outcast and when i brought this up to HR, they never made an action, so i resigned and i brought a med cert from a psychiatrist, since the bullting and the harassment by the trans woman really fucked me up, i went to get another job but after a month, the client decided to let go of some workers kasi we were receiving a small amount of calls only and i was one of those who were let go kasi baguhan pa lang, now it's been 2 days palang na I'm jobless pero shit, i feel so bad not to mention i found out na my submission na artwork in a local museum was accepted but i found out na di pala siya dinisplay during the duration of the exhibit because apparently i wasn't good enough and they had favorites from other organizations that submitted artworks, masaklap pa, ako lang yung may artwork na di dinisplay, and one ex co worker na alam yung nireport ko sa hr ng old call center that i worked for told me that trans pala yung head ng hr namin kaya possible na di daw sineryoso yung sexual harassment case na nireport ko. I feel so fucking powerless, I don't know what to fucking do anymore, i feel like giving up, isa nalang rason ko to continue, it's my girlfriend, for some reason she's still here pero I'm afraid na baka iwan niya din ako because parang downward spiral ngayon ang buhay ko tang ina.",https://www.reddit.com/r/MentalHealthPH/comments/162kgjx/thinking_of_ending_it_all/,t2_8h5hstng,2023-08-27 16:11:03,8,2
Iba pala talaga kapag sayo na nangyare,"Been thinking of things to do when an instance happen. One of this is when being sexually harassed or rap*d.

But then it happened to me. I didn't violently confronted it like what I always imagined. He was forcing himself to me multiple times, I kept pushing him off, and telling him to just sleep... but luckily, he didn't have enough strength to keep me restrained.

Both of us got drunk from a small get together.

I didn't scream nor ask for help because I tried to be rational and thought that he was just too drunk and I still am in the right mind somehow to escape the situation. 

Writing this now, I should've known better and just kicked him in the balls or elbowed him when he was being too touchy during the drink.

I didn't go to the Police Station to file a report because I don't what this to be engraved to people's memory of me. 

*TLDR*: I'm a man, this happened to me for the first time, and I don't know how to handle this situation. 

Are there materials for men to use or a group wherein we could cope up with this? I dunno, I just want to forget this but I don't want to be pathetic if this happens again.",https://www.reddit.com/r/MentalHealthPH/comments/18vncr3/iba_pala_talaga_kapag_sayo_na_nangyare/,t2_7argdm9q,2024-01-01 10:45:55,10,3
"nahihirapan ako umadjust sa buhay ko, ang bigat.","I am a minor and a Grade 10 Student from Taguig.

My life is too unfair and I am still needy fair treatment because I think I deserve it. I can't figure out what's up with my Mental Health but I am traumatized since Grade 2 pa lang. That's why since Grade 2, I thought about death.

I had friends before but they left me behind, betrayed me and made me look like a bad person. I am a victim of bullying and sexual harassment by fourth grade sa province ko. My parents didn't believed me and that's why I never told them ever again. 

I tried to commit su*c*de too many times and I failed because I am scared of me hurting myself and my family. But now, I think it was the best choice to end my life even if I'll rot in hell. 

I gave everything I can just to make my image good. Everyone told me that I am a kind person.

Even though they told me that, I am still receiving fair and unfair treatments to everyone I love.

I am so hopeless. 

What should I do?",https://www.reddit.com/r/MentalHealthPH/comments/12ttp57/nahihirapan_ako_umadjust_sa_buhay_ko_ang_bigat/,t2_gghcrxmx,2023-04-21 15:17:16,1,1
It’s my birthday,"Hello reddit friends. Yeah it will be my birthday in about 10 minutes as I am writing this down. 

There are some thoughts going on my mind these past few days. I know there are some people who wants to celebrate their birthday like a normal day. But I am still struggling if I should celebrate it or not although I experienced not celebrating it before. This year is different for me. I have no friends to celebrate this with. When I celebrated before, I am going out with my friends. It was fun yeah but this year I realized something. I realized they are not my friends. Two of them sexually harassed me while I am sleeping and drunk. My best friend since high school betrayed me with my ex. The rest of them were not in my vibe anymore. I cut them off on all my social medias except my best-friend. It was difficult for me to cut her off. I loved her really and she’s supportive of me. However, I still cannot forget what she had done with my ex before. We talked about that. She said sorry and cried. I forgave her but damn it still hurts though the situation happened before pandemic.

I am not a family-oriented person. So when celebrations like this comes I don’t participate. Family issues name it. I just hang-out with my friends and go on. Maybe that’s the reason I brushed off  those issues with my friends before. Because I don’t want to lose them. I hate this side of me for letting those people hurt me and not confronting them about it.

Is this okay for cutting them off? And I don’t really know what to do to my best-friend. What should I do? 

I am thinking whether to treat myself in the mall and go to a resto bar and drink to this endless loneliness and void. Or just lay down 

Thanks for reading and sorry for the long post. I wish you all the best in your lives.",https://www.reddit.com/r/MentalHealthPH/comments/14u8gt1/its_my_birthday/,t2_abhreth0,2023-07-09 00:20:53,3,12
I have PTSD and depression and graduated cum laude," \[TW: Sexual harassment/rape, suicide\]

I am diagnosed with PTSD and Persistent Depressive Disorder.

I find it difficult to start since most people would be surprised when I tell them this. How did I, the loud, jolly, and smiling classmate, had these diagnoses? I had everything I needed: I grew up with my family, lived a comfortable life, studied in a prestigious school, and achieved high marks. All I had to do was go to school and study, right?

When I was in elementary, I experienced sexual harassment which caused my trauma. The details will not be shared for my privacy, but people often think that after a traumatic experience, everything becomes okay again, right? For the abuser, it was just an ordinary day. For other people, it is just a small sin that can be easily forgotten (“forgive and forget”). But for the victim, we would always remember. Our body holds their sins and it weighs us down.

My childhood flew by and before I knew it, I was in high school. I was aware of my past, and it did hurt, but I tried my best to move on. That’s what everybody says, right? Just move on.

But what people don’t know is how we experience our trauma and grief. They don’t know the times we asked ourselves what we did wrong - what did I, a five-year-old at that time, do? People don’t understand how much we blame ourselves and how difficult it is to speak up and how to forget everything because everything is overwhelming everything keeps moving so fast fast fast and we have to smile we can’t speak about it people don’t believe us we have to be okay we have to move on we have to move move move. 

And so, I tried. I went to school everyday, did my homework diligently, and remained a loving daughter. I took care of my physical health by minding my nutrition, working out, and even doing yoga. On the outside, really, everyone could see how I had an easy life.

I hope you never get to experience 10:00PM in your room feeling afraid, feeling the closing of your throat, feeling dizzy and afraid and nervous and scared because you know you’re safe in your house but you don’t feel because you feel hand hands hands touching you. You feel and see and remember the event happening again and again he’s here he’s touching you and I can’t do anything I scrub my body and wash my body but I still feel his hands imprinted on me. So I cry in silence and hope the pain will go away, and yet it never does. Praying didn’t make it go away. Smiling didn’t make it go away. Studying didn’t make it go away. 

It was particularly difficult during the pandemic because I spent my days in our house, seeing the same four walls for two years. The nightmares got worse and repeated again and again the fear remained and sometimes would leave but would come right back. I don’t understand why does it hurt why does it hurt WHY DOES IT STILL HURT I AM 21 YEARS OLD AND IT HAPPENED WHEN I WAS 5 WHY DOES IT MATTER I didn’t understand I was so lost, afraid, week, and sad. I still see it I still feel it I feel so afraid, so small, so sad. Why am I not happy why does it still hurt why am I like this? During panic attacks my hands were numb, my brain heavy and dizzy, I was smiling and laughing with other people but my chest hurt, my chest feels heavy, my hands are shaking, I feel my heart palpitate but I smile and I nod. Ultimately, the pain was too much to bear. The flashbacks and fear were so intense that I wanted to overdose and just sleep so I won’t feel it again. When I was in my third year, just before laboratory and clinicals, I was hospitalized because of a suicide attempt of overdosing my dormmate's sleeping pills

I asked for help. It was the first time my parents and brother knew what I was going through. It felt new telling other people my experience. It was my first time when I didn’t need to hide the nightmares, the flashbacks, and panic attacks. I remember how difficult it was for me to see my family cry, especially to see how Mama sobbed and wished she could carry my pain. It was also difficult to get used to the side effects of the medications. It took months of medications and therapy to process my trauma. 

Don't get me wrong: I still have flashbacks. I still cry. I am still on medications and therapy. But I also graduated as a cum laude. I had a scholarship for the review center I was looking at. I am preparing for boards. And I am actually in love with living. Sure, there are times when I feel heavy and depressed, but there are also brighter days - lighter days when I can really smile.

I hope that our generation will know that mental health is important, and people with mental illnesses can achieve their dreams. I want people to know that I am depressed and I made it. I had a serious mental illness and I graduated as a cum laude. To you, who are reading this, who doubt yourself, and who have experienced these as well, it is still possible to dream. Yes, you are depressed, you are a victim, but you are so much more than that.

Mental health is a serious issue. I encourage everyone to support their family members and friends who are going through a rough time.

If you are looking for a sign, this is your sign. You matter. You deserve to be in this world. Seek help, especially professional help to process the things that bring you down. It is okay to feel pain. It is okay to feel sad. You are still worthy. Time will tell how amazing you will be.

You deserve to be alive. ",https://www.reddit.com/r/MentalHealthPH/comments/15pu2qb/i_have_ptsd_and_depression_and_graduated_cum_laude/,t2_3srzd7vc,2023-08-13 17:06:45,33,1
Am I right to be upset about what my friend did to me?,"Hi. Im am 17 and I am in sixth form. Last night i attended a 18th birthday party. A lot of my schools friends were there including this boy. This boy is in my drama class and he has a girlfriend who is a friend of mine and she is also in my drama class. This guy is rather touchy but he is like this with everyone so I thought it was purely in his nature to be touchy. Recently me and his girlfriend got into a bit of an argument but it was kept very civil and I was very nice to her during the party. And the boy and me were also on good terms. He was dancing with me, talking to me and it was all ok. A few of my friends including him and me had gone out into the garden to get some fresh air. I took my shoes off because I was wearing heels and they were uncomfortable. I then gave my phone to this guy so I could put my shoes again. He walked away to talk some of my other friends. When I put my shoes back on I went to get my phone from him. He turned to me and held the top of my tank top, pulled it and dropped the phone in my bra. I was shocked and had nothing to say I remember saying something like “oh ok?” And walked away just feeling a bit violated. I went to my friend and she clearly new that something was wrong and she asked me what happened. I told her and she said that it wants okay. I was quite distressed for the rest of the evening and was crying. I avoided him the rest of the night and some of my friends were trying to help me feel better. Im not sure if what he did is considered sexual harassment or he purely didn’t realise what he did and had no bad intentions. Maybe he just thought it would be a good way to make sure I didn’t loose my phone. Im really not sure, all ik is I was uncomfortable Im starting to question of im just being dramatic and overthinking what happened. Maybe I should forget it and move one. 

Do I confront him about what happened? I have to be in the same class with him for the next year and there are only 5 students in my drama class so I’m not sure if it would just make things worse if I talk to him. Im really confused. This is clearly affecting me and iv been feeling very panicky but a part of me feels like I shouldn’t be affected and he didn’t mean to do it. Im really not sure how I should feel or what I should do about it.",https://www.reddit.com/r/MentalHealthPH/comments/16qwu5j/am_i_right_to_be_upset_about_what_my_friend_did/,t2_jsl7g2nnx,2023-09-24 20:42:10,1,1
Why do I have to suffer from someone else's sexual pleasure,"Ever since this monster came in to my life, my crappy life turned worse. This demon won't leave me alone, it all started at the first month of 2021. I was already almost dying from covid and then this thing entered my life.

It first came in sexually assaulted me then it harassed and molested me up until this day, my private area hurts and always forced to pleasure every single day. It fucking hurts and this thing never stops touching me. Unfortunately I couldn't handle it anymore, I think I will die. 

Why? did this monster want from me, I just want to be loved, this parasite keeps making me worse each day, its bad enough this fucking thing made it worser. Fucking piece of shit, took advantage of my emotional weakness. Unfortunately I don't think anyone will believe me, even so I just want to say it here, to get this pain off a bit.

My mind is getting worse, it might get twisted. But thankfully it was maintained enough.

I just want to live, if I happen to die early, hopefully I can be a comic artist in next life. I always admired stories, they helped me a lot especially in troubled times. Stories that can help me improve but I don't think I can continue anymore.",https://www.reddit.com/r/MentalHealthPH/comments/z316p4/why_do_i_have_to_suffer_from_someone_elses_sexual/,t2_2sy1zirl,2022-11-24 05:31:23,21,7
my family is so unfair and it’s making me depressed,"I just want to rant on here because to be honest I don’t have someone to vent these feelings with. Since the pandemic up until now, my family has been heavily relying on me with everything. They even forced me to have a job after graduating high schoo. Now I initially didn’t have a problem with this because I genuinely want to help them even though hindi na ako nakaproceed ng college. Like I said I was okay with it, but when I had a problem with my job because I was mistreated and sexually harassed by my coworkers for being trans, I quit. Now with my savings I tried going back to school but I also applied for a scholarship and I passed so I thought everything was going better. Fast forward now, the school year ended. We had another crisis and I had to stop school. I was thinking of getting a WFH job because I live in a small city and we barely have opportunities. It was not easy for me to find a remote job because I really don’t have the skills for it or maybe I have but it’s only limited so I was getting depressed. Now my mom is getting agitated kasi daw I didn’t find any opportunities and mind you I have to fund for my laptop that I was going to use. She kept guilt tripping me to earn more money even though I am contributing half the bills with my side hustles online and this maybe isnt that bad if I didn’t have a 24 year old brother who doesn’t do anything but play computer games on his pc 24/7 and doesn’t even help with chores or anything like that, verbally abusive pa to me and my mom, but the confusing thing was she kept defending him like he was angel even though he does nothing but abuse us and our resources. He’s also very demanding with the food and everything else but she kept defending him but gets mad at me for every little thing. I’m so sick of it and I don’t know what to do and I can’t escape them or else they’ll call me selfish or possibly disown me and I don’t have a family. It’s just so unfair lang cause she also defended my sister who got pregnant nung teenager palang siya and she was even spoiled cause we were at a good place financially at the time. Yet she acts like she’s also an angel even though my sister stole our appliances and lied about something to get money from my parents just to go to Siargao with her boyfriend and bragged about it on social media, but when she had a problem with her kidneys, my parents were so quick to sell our car and everything else but yes she didn’t do anything wrong and that she’s an angel. She’s 26 now and I’m thr youngest in the family (21). This is so mentally draining and to be honest I already attempted to off myself but I managed to stop. I just want others opinion about this and how can I make my situation better. I feel so lost and exhausted. It’s getting very painful. I might give up soon…I have nowhere to go and I can’t trust anyone",https://www.reddit.com/r/MentalHealthPH/comments/16e7xcx/my_family_is_so_unfair_and_its_making_me_depressed/,t2_vklkhq01,2023-09-09 23:02:53,5,5
i feel so numb and its so draining,"tw: this will contain mention of suicide 


for the past year and a half i have been unable to connect with people on the same level that i used to. at first i thought it was cause i have trust issues, but i also made the connection that its hard for me to find lovers/ actually love and care for someone. 

a handful of things triggered me to be this way. a friend, a while back, had ended her life and in her suicide note she blamed me for it. i dont know where she was buried but even if i did i dont think id have the guts to go visit. i lost friends and lovers over the mere fact that they saw me as broken. i had saved a couple of friends from committing but i no longer speak to them nor do i know if they tried again (and possibly succeeded). and a while back i transferred schools because ig i pissed someone off and rumors spread that i was having a sexual relationship with a teacher, and later i got harassed and called names. the term “teacher fucker” being the popular one. after a while i became destructive, i started to hurt people out of anger which put more of a strain on my mental health. i gave up on everything and later attempted suicide a handful of times.

after that had happened everything changed, something inside me just snapped. i became angry, and just mentally drained in general. i was able to make friends and went through a relationship but i cant bring myself to feel anything significant towards them. i care about them in the sense that ik they have emotions and that they can feel things but i cant understand their emotions and feelings in the same way they may understand. i view them as place holders, ppl that i speak to, but not friends. not people that i can create a bond with, i see them as a threat. nothing more. 

i do feel guilty that they are getting the most broken version of me. that my friends and potential future partners will have to deal with such emotional withdrawal.

is there any way to fix this, or am i a lost cause?",https://www.reddit.com/r/MentalHealthPH/comments/18ncnar/i_feel_so_numb_and_its_so_draining/,t2_cc513yh4,2023-12-21 10:59:02,3,2
