title,body,link,author,created,upvotes,num_comments
I'm almost flipping out,"I am 30M. I will tell you about my story briefly. I grew up in an environment full of women. My parents were together, but you know on paper only. I have a father who loves me so much, and he has been physically there with me, but he left my mother with all the responsibilities and emotional needs that should have been a guide for a son and he lived his own life.

I have always been bullied by boys around me just because I had not been swearing, not speaking inappropriately about girls, or objectifying them. They considered me gay, incomplete, or ""less than a man"". I suffered a long period of abuse in childhood. When I started middle school, I was in a relationship with the most beautiful girl in the school and we stayed in a relationship for 2.5 years, but even then I kept hearing all those insults. At some point, I started to question if they might be right, why I couldn't convince them, and why I couldn't be a ""real man"", just like one of them.

My perspective shifted and I went into a great darkness, I had no idea who I was anymore and I lived almost my whole life in this darkness. I had girlfriends, and I had long-lasting relationships, but I was never able to surrender to a woman, I never let myself go, I never allowed myself to let anyone love me, and I never allowed myself to really love anyone.

On the other hand, I lived my whole life observing the other men around me. On streets, on a bus, in the sauna or gym, etc. Those men became an object for me and I started to compare myself with them by seeing their more masculine side than mine such as being hairier, having sharper features, being more muscular, having a bigger penis, appearing more fearless, having more possessive attitudes, and so on... So, I started to humiliate myself and believe me, this humiliation started to give me pleasure somehow. I was trapped in a cycle where I created situations to humiliate myself and then I suffered.

Then something happened. I met a man 2.5 years ago and he was exactly the perfect example of the object of my self-abasement. But things turned out the way I didn't expect. He didn't humiliate me, he didn't belittle me, he didn't harass me, he wasn't rude to me. He saw me, my inner pain, he showed me his own wounds. He was there for me, he supported me when I cried.

Here's what I can't figure out right now. That man has been so good to me that I have become so attached to him, I can say that I'm co-dependent now. I don't want to live without him, I want to go with him wherever he goes, I want to do what he does. We have been spending so much time together for the last 2.5 years. He has become the center of my life. It's kind of a bromance-like relationship or sometimes I call it ""philia"", he is straight and he is not a sexual object for me, BUT I'm so confused. I really have a hard time understanding if I'm in love with this man, if I'm really gay, or if something else is going on, like after all these years of experience, I was shocked to meet such a person or something.

I have been in therapy for 2.5 years. EMDR has helped me a lot to get rid of my childhood traumas, but unfortunately, I feel too frozen to move now. Where have all my emotions gone, where are my sexual urges, where have my positive emotions gone, who am I, what do I want? I am completely in the unknown and my depression is getting deeper and deeper each day.

I really need someone to talk to me, even if you can't offer a solution. I want to hear something.",https://www.reddit.com/r/MentalHealthPH/comments/17prlq9/im_almost_flipping_out/,t2_ncugab1vv,2023-11-07 18:48:30,7,2
the country does not have MH resources for my condition. kuwento na rin.,"Hopeless case nga talaga ako. I've been to the best hospitals and therapists/doctors in the NCR area. One of which told my mom that I will never be happy, so they will just focus on giving me things to do. Unfortunately I heard that, but it happens to be true.

\[long story, pasensya na po\]

I have autism that went undiagnosed until I was 20something because of the stigma. Even though all the signs were there. Pinabayaan ako. Looking back, kahit magkasakit ako o mainjure sa school walang may paki. Nung grade one ako, nadapa ako sa semento nung may sack race at dumugo ang siko ko. Pumasok lang ako sa klase na nagdudugo sa panyo ko, walang pumansin kahit pag-uwi ko. And I was clueless kaya di rin ako pumunta sa clinic. Tiniis ko lang kung anong sakit ng tiyan o lagnat o bali natamo ko noong bata ako up to high school or college. Nanakawan ako ng wallet sa unang college ko at parang wala lang. I had no friends and thought it was my fault so I made extra efforts, joined clubs. Wala pa rin. Kapag may problema ako nawawala lahat ng akala ko friends ko.

I probably did and said a lot of weird things too but I did not mean bad and nobody corrected me. Was just ostracized for the most part, not actually bullied. I even went on a date with a stranger one night and I was so proud of myself for being brave. Buti nalang sinabihan ako ng kabatch ko na creepy ang nangyari at wag nang makipagkita dun. At least that friend saved me in that case kasi the guy was stroking my thigh during the trip and took me back to the dorm so he knew where I stayed. Creepy nga in hindsight pero sobrang tanga ko. I was 16 and living far from home. I never told my family about this. It was shortly after that incident that my wallet was stolen. Nung nadepress ako nung taon na yun, my family just assumed it was because of the lost wallet. But actually it was a lot of things, including losing the friend who gave the advice as well as the creepy guy. Even now I wonder, what if I didn't listen to her and went with him?

Suggestion ng friends ko online na tumawag ako sa suicide hotline. The problem is I have severe sensory and processing issues. In short di ko kaya tumawag sa phone. I can type a lot of text because I'm only focusing on one thing. Pero pag live conversation overwhelmed na ako. I can't even VC with my own friends, how can I talk to a stranger? Lahat ng suicide hotline sa Pinas walang chat support haha, nagmessage ako sa FB nila. Mamatay nalang kaya ako hahahaha.

Lahat ng mga resources dito for autism ay para sa mga bata at early interventions. Nung bata ako wala pa yung asperger's o high functioning autism kaya walang maitulong sa akin. Now it's too late. Ibuhos ko nalang lahat dito at baka sakali magkatapang akong tapusin buhay ko. Nobody takes my disability seriously anyway. I can't go for online therapy because of the talking problem. Walang combination ng meds na gumana sa akin. Worse, lumala yung health ko. I became obese and developed asthma. Sirang-sira rin ang sleeping patterns ko. All those health problems didn't exist before I took psych meds. Kasi nga nagdoble effort ako nung una, sumali ako sa sports clubs, tried to live healthy and be social.

Pag may nangyaring incident o may problema ako, ako ang sinisisi. Kahit nung nagwowork ako at unfair ang mga boss ko. They would talk behind my back about me and my coworkers. It got so bad na dalawa ang nagquit kaya in the end ginagawa ko trabaho ng tatlong tao, three different offices pinupuntahan ko. And they also accused me of something I would never do, that is to badmouth them to a higher authority. Kasi, not to name names pero working student ako nun. Sa state university ako nagtatrabaho pero sa city college ako nag-aaral. Sinisiraan nila sa work yung city college ko. To the point na mas gusto pa nilang mag-aral sa private school and mga bata na hindi nakapasa sa kanila kaysa mag-aral sa public din. Sabi-sabi na aagawin daw ng city college ang pondo ng state uni. At naniwala naman ang mga bata. Bakit ko naman sila isusumbong sa city eh hindi naman ako close sa mga boss dun? Pero ang masakit talaga ay yung mga accusation sa amin ng mga coworkers ko. Panay ang siraan nila sa isa, slow at bobo daw (pero college grad, paano nangyari yun?), yun pala PWD din siya, mahina ang tenga. Nagkaroon ng incident at kailangan magleave nung taong yun pero nung babalik na, ayaw tanggapin. At the time I was already doing the work of three so we really needed the help. Actually anim ang nirerequest namin na staff. Kahit sino pa yan, sana kinuha na nila.

I had been begging my mom to help me transfer to a different department because it was getting toxic. Twice kinausap namin ng mga kawork ko si mama ko at once we consulted with the HR pero di nila kami nilipat. And then came the almost sexual harassment incident. May three days na Lakbay Aral at sumama doon lahat ng admin pati karamihan ng prof. May isa akong kaclose na male prof, parang tatay ko na yun na naiwan sa campus. Mag-isa lang ako sa admin office noon at sinubukan niya akong halikan sa labi. Natakot ako at sinabi ko sa mama ko at sa immediate superior ko. Kinausap ni mama yung boss ko at sinabing wag akong iiwan mag-isa sa office. Hindi ko siya kinasuhan ng sexual harassment kasi mawawalan ng pension yung prof kung may kaso siya.

Later on gusto ko na talagang umalis sa work ko dahil nga sa hindi nila pagtanggap sa kawork ko. As in gusto kong patayin ang boss ko dahil sa discrimination nila against PWDs. Nalaman nila yun at nagsecret meeting yung admin at mom ko. Edi ang resulta, mag-isa nanaman ako sa admin office at walang maisagot sa mga clients. Ayos, diba? Nakatanggap ako ng angry call from parents saka mga special visitors at wala akong masabi, walang bilin kahit kay kuya guard man lang. We didn't know if the admins will be back and when. Nakakahiya sobra. My mom betrayed me and sided with the bosses who were abusing us PWDs and accusing us of things we didn't do. Nagkaroon kasi ng nakawan sa school kaya lahat kaming staff suspect. Pero yung job orders ang pinag-initan. Pagbalik nila, kinausap ako ng campus director kunwari friendly, yun pala pinapagleave ako. Pero nung sinabi ko problema ko tinawanan lang ako. He mocked me. Sabi joke lang daw yung sinabi sa faculty meeting na baka ako daw nagsabi sa city admin na nilalabanan nila yung city college. Joke? May tumawa ba? May nagdepensa ba sa akin, iclear man lang pangalan ko? Wala. Nagwala ko and the next thing I know, I was being pinned down by two men sa labas ng opisina. Bisita lang yung isa at hawak niya leeg ko. Parang gusto pang higpitan sa leeg para takutin ako. As if. I wanted to kill and be killed, suicidal na ako noon kaya walang masama kung tuluyan nila ako. Ganyan sila mga normie/neurotypical, lahat ng problema kasalanan ng may mental illness. Ngayon alam ko nang wala akong kakampi kahit saan man ako magpunta. Isisisi lang sa akin lahat ng aberya. Kaming mga PWD at may mental issues ang laging nilalaglag. Sinisira nila ang mga pagkatao at buhay namin.

Pero di pa din nagtapos kalbaryo ko. Nawalan na nga ako ng trabaho pero tuloy pa rin paninira nila sa akin. May estudyante kasi na scholar, bagong graduate na kaibigan naming mga staff at crush ko. He had financial problems, self-supporting at mukhang on the spectrum din. Pinahiraman ko ng reviewer for CPA. Nanakawan siya ng pera na supposed to be para sa grad fee. Pag-graduate niya ay binigyan ko siya ng konting pera at graduation gift. Nagkataong nanakawan ulit siya after kong matanggal sa trabaho, at nahuli niya yung magnanakaw. Yung ka-staff ko na nagquit pero di pinilit bumalik. Akala namin kaibigan siya but she was manipulating us to think she was sympathetic tapos ganoon nga. Ninakawan mga scholars na gipit na nga sa pera. Tapos bibigay siyang konting tulong para mukha siyang mabait. Inutangan pa ako para mapakita lang na di siya magnanakaw. Unfortunately ang alam nitong scholar-graduate ay kakutsaba din ako. He wrote a long post on FB accusing both the thief and myself of manipulating and stealing from him, and at the same time, blocked me so I can't explain my side. As far as I know, nobody corrected him for my sake.

Pasensya na po sa mahabang story time/rant. Nabubuwisit na ako sa hopeless kong kalagyan. Kung tutuusin nga ay delikado kung maghanap pa ako ng trabaho, considering how easy it is for people to manipulate me baka next time ma-r\*pe ako o mawalan ng malaking halaga o maligaw sa Manila - and then I will still be the one to blame oh diba ang saya?

Kung mukhang familiar itong kuwento at narerecognize mo sarili mo sa incidents, CONGRATS, SINIRA MO BUHAY KO. CONGRATULATIONS ON BEING NORMAL. YOU WIN.",https://www.reddit.com/r/MentalHealthPH/comments/11jvz0r/the_country_does_not_have_mh_resources_for_my/,t2_f81f4p4m,2023-03-06 19:12:26,6,1
Sooooooo Lost on my life path,"Hello mga ka reddit. I'm a 26F full time bpo worker. Feel ko reddit lang yung way ko na makapag vent out anonymously. 

Came from a very dysfunctional family. Long story short, I have a tita na ang tawag ko ay mommy dahil since birth siya na ang nag alaga sa akin, kinda adopted setup. Kapatid siya ng biological father ko. No comms ako sa biological parents except sa isang kuya ko na anak ng biological mom with a different man.

Before nag ka anak si mommy, ako lang yung meron siya and may kaya kami. She even have a taxi business so lahat ng luho like jb birthday parties and everything na experience ko. When she had her own children, dun nag bago trato niya sakin. Nung nagkaroon siya ng partner which I used to call Daddy everything went downhill. Tho happy naman siya ng light pa. Nung pinanganak niya na yung first daughter nia dun na nagbago yung trato niya sakin. I guess I was a child na ubod ng kulit but hurtful things were said na sana hindi na lang niya ako kinuha and the way na I discovered na hindi niya ako anak is yung sinabi niya na hindi ko kapatid yung baby niya. That young me suddenly changed from a happy go lucky and pala study na bata, I lost all interest for those things. After nun, lagi na pinapatawag ng mga teachers ko sila mommy. Tuwing may meeting sa school, walang na attend ng student parent meeting, if meron man hindi si mommy. As time goes by, palala ng palala yung panunumbat niya and pambubugbog. There was even one time na nakipag laro lang ako sa school mate ko and when I went home, hinambalos niya ako ng makapal na kahoy sa leg and knee area ko which caused me to have difficulties on walking the following day. My school mate even asked me if I was ok kasi nakita pala niya paano ako nabugbog nun. Tumagal yung ganyang setup namin hanggang sa grumaduate ako ng elementary.

2nd heartbreak is Graduation Day ko, I was hoping na maybe pupunta sia but boy I was so wrong, pinakiusapan niya yung bantay ng sari sari store namin na samahan ko sa graduation ko. Inintindi ko na lng din na mas priority nia ung business nia. During that, I can't help it but I cried nung may segment where students will approach their parents kasi inggit na inggit at the same time sobrang lungkot ko kasi I felt so alone that time. Same scenario din nung ALS Graduation ko hindi rin sia pumunta pero bestfriend ko ang sumama sakin which I was really grateful for her.

When I was in college, nagkaroon ng incident na I got sexually harassed and molested none other than the person whom I trusted and tinuring kong father figure which was her partner. Nung nagsumbong ako kay MOMMY, I already expected her reaction na hindi siya maniniwala na kayang gawin yun ng partner niya kasi all this time ang nakikita niya sakin is nothing but a good for nothing liar. That was my 3rd heartbreak na kung sino pa ang kamag anak ko siya pa ang hindi maniniwala. That incident still haunts me up until this day and might be the main cause of me developing Bipolar Disorder with Anxiety and Post Traumatic Disorder. Clinically diagnosed.

Ngayong 26 na ako, even ganun nangyari sakin di ko magawang iwanan si mommy and ang mga kinilala kong kapatid which is mga anak niya na pinsan ko. Up to this day never pa din nawawala panunumbat niya everytime na may bad day siya. I had several scde attempts before because of being verbally abused and everytime na nag brebreak down ako. All I want now is to help my 2 cousins na makatapos ng studies nila. Tinitiis ko na lang lahat ng masasakit na sumbat ng mom nila because I love those two as my own sibs.

Right now mga ka reddit, I'm so lost na hindi ko alam ano bang purpose ko. Hindi ko alam if lalaban pa ba ako. I may sound a cry baby pero pagod na pagod na ako. Everytime na mag brebreak down ako di lang siya masakit emotionally buong katawan ko sumasakit. Maybe meron kayong mashashare na tips how to fight this?. Sessions with my psychiatrist is only helping a little but nothing more than that",https://www.reddit.com/r/MentalHealthPH/comments/153ph5z/sooooooo_lost_on_my_life_path/,t2_h0ayahq7,2023-07-19 16:55:42,2,1
Interpersonal Issues,"So basically I'm feeling terrible today, and I think I have every right to feel this way (no one will validate me so I'll validate myself Haha).

I am right where I began. The quicksand that I have always been trying to escape caught me right in the middle of it. Maybe I am just this dumb.

This quicksand that I am talking about is the idea of being a passive-aggressive bully or harasser. I mean it's the idea where you make 'parinig' to a certain person without admitting that you were pertaining to that person. This may sound like a children's normal teasing games but when adults do it, the possibilities are unlimited. It can exploit your weaknesses and insecurities, cause emotionally distress or simply subtly hurt someone WITHOUT them being responsible for their own words because hey, they weren't pertaining to you right (gaslighting)? Them being allowed to do things with impunity make their bullying transcend from simply teasing someone's physical appearance to extreme measures as to attack your sexual preferences, traumatic experiences, question your very existence and even provoke you to do unthinkable things. Basically though blades cut the skin, it is actually words that cut and scar the soul. Basically I am almost experiencing this on a regular basis, I am starting to accept that fact maybe this is really the world we live in. But still, it affects me in times when I feel vulnerable.

But my issue is not that. It's just that, whenever I speak or post or voice out my opinion or just be myself I feel like people actually think that it was I (the passive-aggressive bully) that was verbally attacking them. That makes me think that the only way to live is to shut my mouth, play dead and not to do anything just to offend nobody. But the idea is, although I think and I know that I don't do it to them, they feel like I am doing it to them. The very idea of what I hate about people is probably the very idea of what they hate about me. I have always been prone to being misunderstood. That was the quicksand that I was talking about, being in the position where because you didn't do anything even if you seemingly understand everything, you will end up being the reservoir of those tensions, to put it lightly. The reason why I try my best not to resort to these, even if it's seemingly normal, is that it is prone to misinterpretation, like as if I am not misinterpreted already just by being my normal self.

I kinda don't care now if I sound confusing, Haha.

So to prevent that from happening again what I did is that in my few circle of friends I always clarify that I am NOT trying to bully them or some sort, but even with this disclaimer I feel like they still get offended by everything I do, albeit unintentional. Matalim nga lang siguro tabas ng dila ko, but it was never malicious nor intentional. But guess what, they no longer trust me. Haha. They actually think that I am lying.

I am just tired of how my brain work. Yung tipong overactive ang brain ko to the point that I overthink what people might overthink about, as if overthinking my own problems wouldn't suffice. Lmao.",https://www.reddit.com/r/MentalHealthPH/comments/plg3i2/interpersonal_issues/,t2_b7hpdh8x,2021-09-10 15:11:46,25,12
