title,body,link,author,created,upvotes,num_comments
My mother got her karma,"I've (20M )experienced my mother's rage and mistreatment all my life because she had married my father whom she doesn't really love. Hilig nya manumbat samin na she should've went to law school this and that but she didn't because my dad told her to take care of me and my sister whos 14 now because my dad was an architect abroad. Often times she'd yell at us when shes tired from work, doesn't cook dinner so I had to learn how to cook dinner, she has these dogs but doesn't feed them so I take care of that, I basicslly clean and man the house because she doesn't bother to do anything, all she does really is just go on the washing machine and wash our clothes and she thinks that it's enough household work for her. 
She's not a great mom and it took me quite a while to notice because I think she's using us as a way to get her accomplishments because she wants me to become a doctor and my sister to become a lawyer, she also hits us for doing bad at school like getting a 70% in an exam for me in College. Me and my sister basically faced all kinds of physical and verbal abuse from her, most notable was when she let me do a squat plank the whole night when I was 7 and even tho I wanted to pee she said she would beat the life out of me if I moved out of the plank so I ended up pissing myself, every time my sister and I tried to talk back or justify my actions she would force feed us chili peppers to shut us up and she doesn't care if she makes us cry or hurt us because dad doesn't know. There's many more but some are a bit private because they feel humiliating to tell even anonymously.
Just earlier this year I've told my dad about it and they're going through a separation, I also noticed that since december last year my mom has only been yelling and not hitting hs because she's gone weaker. 
The thing is she didn't get weaker from age, she got leaukemia, I felt like that was the karma she got for doing a bang up job as a parent. I feel guilty because I smiled when I heard her talking to a relative about it on the phone because that's my mother, but she's also been long dead to me because the thing's I've experienced as a kid.
I don't know if it's karma but I feel like my mom won't be living for long because she is really weak now, I just hope she has it in her to apologize, but even know in her weakened state she still talks to us like we're not her kids, still too much pride in her to apologize, frankly I'm just partially excited because I'll be having peace in my life for once soon enough.
I know I might seem like a bad child for saying this, I think I do care about my mother, but only because I don't want to get hurt when I don't follow her instructions immediately.
I guess I'm just happy that even though I have a shit mom, I have my dad that truly cares and listens to me and my sister.

TLDR:
My mother who physically and verbally abused all my life is facing annulment with my father and was diagnosed with Leaukemia ",https://www.reddit.com/r/OffMyChestPH/comments/1boz4ec/my_mother_got_her_karma/,t2_95v71am6,2024-03-27 19:02:40,143,34
Husband messages other girls and asks them out,"And sees nothing wrong with it. Asked him if he knows it's wrong he said yes. Tapos had the nerve to tell me, ""di pa ba kita tinatrato ng tama?"" Dafak??? So you're telling me na just because you're treating me right meron kna karapatan na mag cheat on me????? 

Messaging other girls means you are not treating me right. Sobrang asshole mo. 

How do I expose this man? I'm so tired. I want to be out. But everyone tells me I should keep the family whole. I'm overly abused, mentally, emotionally and physically. 

Pakyu lahat ng cheaters! Karmahin sana kayo",https://www.reddit.com/r/OffMyChestPH/comments/1agey02/husband_messages_other_girls_and_asks_them_out/,t2_4hp7ie3pd,2024-02-02 00:26:53,41,18
Nauulol ako every time dominant yung bf ko,"My boyfriend is a very soft person. Very golden retriever energy, sunod sa gusto ko most of the time, napakalambing, napakahina ng boses, napakamahinahon, naiiyak over the littlest of things (like pag namimiss nya ako or hindi kami nagkausap for a huge chunk of the day kasi busy kami both) — overall, a big baby.

But sometimes, when he's being protective over the people he loves, he becomes dominant. Just like nung time na naging physically and verbally abusive yung LIP ng younger sister nya, tinrashtalk nya yung lalaki tapos hinamon nya pa sa suntukan. He made sure pa na his younger sister was safely removed immediately from the house they were living in. Sobrang touched ko noon kahit hindi naman para saken yung ginawa nya.

Today, nagalit siya kasi binabastos ako ng isang friend ko (let's call him P) but I didn't know how to respond to P kasi he's a VERY close friend of mine and sanay na ako na bastos talaga siya na tao kahit kanino. Parang part ng personality nya maging bastos. Sasabihan lang ako na, ""Joke lang yun"" when I respond with seriousness. In the past week, mas lumala yung kabastusan niya maybe because tinotolerate ko din tsaka dinidismiss ko yung inappropriate jokes nya as being part of his raunchy personality. I already expressed kay bf na ayaw kong ginaganon ako pero di ko alam how to respond properly talaga without harming our friendship. Sabi nya na siya na daw kakausap kay P, pero sabi ko na wag kasi I want to deal with it on my own.

Sinabihan ako ni bf today na, ""Wala kayong pag-uusapan this week or some time soon,"" tapos sinundan nya ng, ""I'm not asking."" If hindi daw titigil, siya na daw talaga kakausap. Sabi nya pa na 'wag daw talaga magpapakita sa kanya ulit si P (they've met several times before) kasi baka mabugbog nya daw. Ewan, naulol ako sa pag-command nya saken. Gusto ko nalang sabihin, ""Yes daddy,"" tapos lumuhod sa harap nya or kumandong sa kanya pero alam kong sobrang inappropriate non for that conversation kasi serious na usapan yon. I know I can do that on my own naman talaga kahit hindi nya sabihin, pero my feeling of not wanting to talk to P anymore was validated nung sinabi nya yon, kaya mas na-empower ako to stop communicating with P.

As someone who's been very dominant and independent all her life, nanibago ako sa feeling na 'to. Kasi all this time I thought I wanted someone na submissive saken, pero nakakabaliw pala when someone's being dominant over me. Ang sarap pala sa feeling na ikaw naman yung inaalagaan, hindi yung ikaw lang nag-aalaga palagi.",https://www.reddit.com/r/OffMyChestPH/comments/13oo6e3/nauulol_ako_every_time_dominant_yung_bf_ko/,t2_9tsta101,2023-05-22 19:26:33,1390,214
To the moms who can't protect their kids from their husband,"My sibs and I are not SAed or physically abused but our dad is a narcissist. Imbento kwento ganon. If napanood niyo yung nanay ni Klay sa Maria Clara at Ibarra, ganon na ganon tatay ko minus the bugbog part but hurts us with words. I still blame her for not doing her part of breaking up with our father, but I feel guilty also kasi I know she is just a victim. And tomorrow, i am forced to say sorry to my father just so my and siblings could survive as I am close to getting kicked out. Nasa abroad mother ko so mahirap pag nawala ako dito dahil kawawa siblings ko  Sobrang nakakademoralize for me pero wala pa ako means to earn money as I am still a student. If you experienced the same thing before please do share I you coped and how to heal from this pain. :(",https://www.reddit.com/r/OffMyChestPH/comments/ytizbk/to_the_moms_who_cant_protect_their_kids_from/,t2_k6td5khe,2022-11-13 05:32:25,85,24
toxic household,"punyeta. 

punyetang buhay to, wala na kaming ginawang tama. gusto ko nalang mag suicide, gusto na namin mag suicide para lang maparamdam sa kanila na sumosobra na sila. kaso ang unfair bakit kailangan pa namin kunin at i sacrifice buhay namin just so they can realize na hindi na tama ginagawa nila? 

verbal abuse araw araw. naturingan kayong honor student pero sa mga simpleng gawaing bahay ang bobo niyo. napaka baboy nyo. laging over the belt. 7 years na kaming ganto, wala pa ring bago, gusto na naming sumagot at lumayas kaso mahirap lang kami, hindi pa namin kaya mabuhay mag isa. napaka unfair kasi lahat nalang sinusumbat samin, kami nagpapa aral sainyo, puro utang na loob putangina, kapalit naman unstable mental health at suicidal thoughts. 

kapatid ko nagbabayad ng kuryente, wifi, at tubig, pension naman ni mama sa renta ng bahay. pero kung makaasta sila parang wala talaga kaming ambag ni singko. 

nagbigay sila ng gadgets sa mga kapatid ko only to restrict them from using it. kailangan mo pang magmakaawa para lang makuha mo or magamit mo cellphone mo, sana hindi nalang sila nag bigay jusko. kasi ang gusto nila lagi silang may power over us, it has always been like this for 7 years na. nagka trabaho na kapatid ko which is good pero hindi pa rin nila ma appreciate kasi feeling nila nag mamalaki na, kapag hindi naman nag treat o tumulong sa gastusin sa bahay sasabihin nagsasarili. ganito kami lagi, hindi namin alam saan kami lulugar. lahat ng gagawin namin may nasasabi sila, nakaka drain na sa totoo lang. 

isang mali lang dito o isang sagot lang sa kanila, nagtthreat na sila agad na lumayas na kami. napaka manipulative and controlling. 

simpleng bagay lang na kinuha yung cellphone para magamit sa paggawa ng assignment sa school,  muntikan nang ma physical abuse. hindi mo alam kung mag aaral ka pa ba o ano. ayaw naman namin mag rebelde sa school kasi alam namin na kami rin ang mahihirapan in the future. kaya kahit ang hirap mag aral, tinitiis namin dahil ayaw naming ma jeopardize future namin, ganiyan kami ka practical. 

grabe pano pa ba namin titiisin tong gantong ka toxic na household, sa totoo lang gusto ko nang lumayas kaso alam kong hindi ko rin kakayanin at kawawa mga kapatid kong maiiwan. 

hindi kaya nila narerealize na yung mga verbal abuse na ginagawa nila sa amin atsaka pang gagaslight nakaka apekto sa mental health namin? kailangan pa ba talagang umabot sa itthreaten ko sila na bawiin buhay ko para lang magising sila na tao rin kami? may nararamdam rin kami? 

punyeta talaga sana mamatay nalang sila.",https://www.reddit.com/r/OffMyChestPH/comments/195gjz9/toxic_household/,t2_oz1xlct9n,2024-01-13 13:27:04,4,0
Im tired of being a nice guy.,"So many relationship ended up with me being second. I've met and dated many women, took most to dancing, courted and been in a relationship with a select few. Unfortunately all ended up leaving me(some even cheated). Gave them everything i could and loved them like their the only woman in the world. Learned how to do hair and makeup so i can relate. But sadly i learned the hard way that the phrase good guys always end up last is definitely true. Its hard to trust and go out there again. Sometimes i think it would be best for me to just be alone. They prefer someone that would just use and abuse them emotionally and physically. Now i wonder is there still a place for nice guys to get the girl and end up first.",https://www.reddit.com/r/OffMyChestPH/comments/162yq2d/im_tired_of_being_a_nice_guy/,t2_dx7mzir0w,2023-08-28 02:57:23,94,53
I wish my sister an early death,"Pagod na pagod nako sa ate ko. I used to have a love-hate relationship with her pero now it’s just pure hatred. She was my first bully. Bata pa lang kami alam na ng lahat na malala talaga ugali nya, she used to be very physically abusive and now she’s more verbal but her being physical with me never stopped. I remember back then nung hindi ko na kinaya yung mga pananakit nya sakin nag sumbong ako sa my trusted adult pero nothing changed, instead she threatened me and called me “sumbungera”. The “trusted” adult didn’t even do much kasi miski sila mismo walang magawa sa ugali nya. She started providing for us kaya ngayon mas lumala na lalo ugali nya kasi whenever di nasusunod mga gusto nya, isusumbat nya lahat sakin. And the saddest part is i idolized her. I wish i could be as cool as her growing up kasi i guess you could say na i felt inferior besides her, i was insecure growing up because of her. She can carry herself to the point na pati mga matatanda kaya nyang sagutin and she’s an angel sa mga mata ng mga kaibigan nya or strangers. She was prettier than i was and mas matalino sya kesa sakin. That’s why i couldn’t stop myself from wanting to be like her. Kaya despite of endless abuse, i always defended her against the elders. Ang daming nag sasabi sakin na “close kayo ng ate mo naiinggit kamo ako” and i wish na sana ganyan nga yung case kasi for me, mas better na na hindi close kesa sa yung kapatid mo mismo yung bully mo. She always finds a way para ipahiya ako or to invalidate me and never even thought about apologizing. Never nya akong cinompliment for something that i worked hard for. Pero recently, i think i’m reaching my breaking point. I guess i’m not as submissive as i was tulad nung dati kasi the way she’s been treating me lately is more hostile than how it used too. She drove me to the point na yung suicide thoughts are being applied sa real life. Have tried many ways of ending myself pero would always wake up in bed alone, still in hell. Gustong gusto ko na umalis but i can’t kasi i’m a minor and tama nga sya, she’s my provider and wala ako ngayon kung wala sya. I’ve tried many things like asking for help and finding a job for myself pero nothing works. I’ll just have to live as her shadow for the rest of my life.",https://www.reddit.com/r/OffMyChestPH/comments/1alqu5y/i_wish_my_sister_an_early_death/,t2_es6xmannx,2024-02-08 16:12:10,4,4
Contemplating on leaving my deadbeat husband.,"We have 1 kid, (a toddler), and I a have a WFH job. My husband is unemployed. He has a business before but it went under. He has no experience working for a company because he said he doesn’t like having a boss. He hasn’t done anything to bring in money to the household eversince I got pregnant 2 years ago. This, and his attitude is causing me to feel resentment towards him to the point that I am contemplating on leaving him now.

I pay for all of our bills (food, groceries, electricity, water, internet, gas, baby needs). Heck, even car maintenance sa akin pinapa-sagot. Ang kinakainis ko ay lagi niya akong kinekwestyon saan napupunta ang sahod ko, kasi pag nagpapabili siya ng luho niya, hindi napapagbigyan. Mahilig mang-gaslight kapag di nasusunod gusto, silent treatment for a week, minumura ako kapag nagagalit. Wala na ngang ambag sa needs ng pamilya namin, may gana pang mag-request ng kung ano ano. Nito lang, gusto niya kong kumuha ng hulugan na motor na di naman kailangan. Di ako pumayag, at nagalit na naman nung sinabi kong ako na nagbabayad lahat ng bills, wag niya nang dagdagan ang gastos.

Sa akin niya inaasa pag-aalaga ng baby namin kahit nagwo-work ako. Siya, tulog hanggang tanghali. Galit pa pag ginising kasi naka-meeting ako at umiiyak yung baby. Minura ako kasi natutulog daw siya, istorbo raw ako. 

Ang ambag lang niya sa chores ay mamalengke at magluto. May work ako so di ko magawang umalis mamalengke at magluto. Lahat ng ibang gawaing bahay, ako gumagawa. 

Laging may masakit sa katawan araw-araw, literal. Pero walang ibang ginawa kundi mag-phone at magpuyat kaka-scroll. Naiinis ako kasi parang siya lang gumagawa ng problema niya. Pwede naman niya alagaan health niya. Pag sinabihan pa-check up, ayaw kahit may HMO naman dahil dependent ko sila. Pag di sinamahan, magtatampo, di raw siya marunong magpa-check up mag-isa. Feeling di inaasikaso. Pero ang sa akin, dapat mga ganung bagay kaya niya na gawing mag-isa. Almost 30 years old na siya, di pa rin kaya mag-isa?

Alam ko kasalanan ko rin kasi pumayag ako na magpa-kasal kahit may mga red flag. Mali ba ako kung pipiliin kong iwan siya at buhayin mag-isa yung anak ko?

Iniisip ko baka sabihin ng iba ang OA ko kung iiwan agad, hindi naman physically abusive. Pero hihintayin ko pa bang umabot don? Verbally abusive na siya sa akin. At nagsasawa na ako maging cash cow at yaya niya. Nag-asawa ako para may katuwang pero pakiramdam ko single mom ako dahil ako naman gumagawa ng lahat. 

Nagsabi na ako sa mom ko kasi lately hindi ko na kaya yung iniisip ko. Na-trigger to nung naospital anak namin at di ko maramdaman na pwede siyang maasahan kahit sa pagbabantay. Di niya raw kasi kayang makita anak namin na tinutusok, nahihirapan etc. Pakiramdam ko ako lang yung malakas para sa anak namin.

Gusto ko nang umalis pero hindi ko alam paano sasabihin sa kanya.",https://www.reddit.com/r/OffMyChestPH/comments/1c5xhmv/contemplating_on_leaving_my_deadbeat_husband/,t2_ygij6r7e8,2024-04-17 09:35:18,143,12
My older sibs are all migrating abroad and I’m left to care for my abusive dad,"I find it unfair na lahat ng kapatid ko are living abroad na and I am left to care for my abusive dad(58) who’s having a hard time walking pati na din sa 6 dogs namin. I’m the youngest of 6 and ung mga kapatid ko nagsipag asawa na ng foreigner. So dun na sila maninirahan lahat. And here I am, juggling my life with my work and small business making ends meet.

I’m not bitter or what, I’m glad they’re successful in their own ways but I am scared na di ko magawa ung gusto ko sa buhay. I want to move out of the house permanently kasi the house is a living nightmare for me. I remember my dad verbally and physically abusing me on that house ever since I was a kid. 

My dad haven’t worked since I was still a kid kasi umaasa sya sa grandparents namin and he’s an alcoholic. Every time na malasing sya, he would sometimes punch me and he even threw a chair to me. There was a time na iniintindi ko sya kasi baka dahil sad sya na wala ung mom namin. (My mom died when I was a kid due to cardiac arrest days after she gave birth to me. Pinagsabihan na kasi na di na sya pwede mag anak ayun). But I developed to not care sa kanya.

Now, I feel like wala akong choice. I’m left with an abusive dad na walang retirement plan, can barely walk and I feel trapped.",https://www.reddit.com/r/OffMyChestPH/comments/12jrzvt/my_older_sibs_are_all_migrating_abroad_and_im/,t2_63b4n9pz,2023-04-13 00:43:41,10,10
I hate my boyfriend's fraternity. So. Much.,"I love my boyfriend so much but lately I can't stand his behaviour. His org, his fraternity, takes pride in their application process which involves psychologically hazing and hurling emotional abuse to its applicants. It also interferes with their acads which is already mentally draining to begin with. The whole idea is to break their applicants down psychologically, emotionally, and mentally so that they can see who can withstand pressure and will be worthy of joining their org. There's no physical abuse, but they are made to do physically draining tasks and military-like exercises. I know a lot of orgs do these kind of application processes, but that doesn't make it okay at all and his seems to be longer in duration and stronger in intensity than the average org. It's all so unnecessarily cruel. 

I hated this org when he applied, as I felt like it was putting so much pressure on him when he already had a lot of change to deal with. I hated to think that he was being shouted at, humiliated, forced to do tasks that he would normally be embarrassed to do; plus there was so much to do that it took away a substantial time that could have been used for rest or to study for acads. To the point that he would get physically sick from exhaustion. All in the guise of creating a support system and friends. 

Now that he's no longer an applicant, but a facilitator,  it's all so much worse. How could he be okay with shouting at his juniors? Making them do embarrassing, tiring, menial, and at the same time physically and emotionally draining tasks. To the point that some of the applicants break down or self harm themselves to cope with the pressure. How could he not see the hypocrisy of wanting to be each other's ""family"" but the same time hazing these people? I hate it. I hate knowing that he is capable of bullying, and worse that he can't see that it's bullying. He is justifying all of it; that it is necessary, effective. I hate the self righteousness of it all.

I can't hide my emotions (no poker face at all) so he can always tell that I am not thrilled when he tells me about his org activities. I am trying to be supportive and understanding so as to avoid possible arguments but I just can't yet control my emotions. Yet I can't be open about it as much as I would like,  how much I hate this org, because he LOVES this org. He LOVES this org so much. It is his support system and barkada. How could I possibly take that away from him?? 

So I am left to swallow my comments, my thoughts, and my judgement as often as I can stand, so we won't fight about it. 

Tonight however I feel like I might explode from frustration so let me get this off my chest, PH.",https://www.reddit.com/r/OffMyChestPH/comments/162u822/i_hate_my_boyfriends_fraternity_so_much/,t2_i1n45wjls,2023-08-28 00:00:56,13,6
my bf is still seeing his ex gf behind my back,"I'm 19(F). May boyfriend ako, bago pa lang kami ng boyfriend. Mag one month pa lang kami next week. But, a few days ago may nag chat sa akin thru pm. She introduced herself as the friend of my boyfriend's ex. They told me that I should not tell my boyfriend about it. I asked her what's the problem. She told me that my boyfriend used to physically abuse her friend which is my boyfriend's ex. Hindi agad ako naniwala. I ask for proof first. So they created a group chat. Doon inamin sa akin nung ex niya na they still seeing each other. She sent me proofs, such as their pictures together and conversations screenshot. But the screenshots are a bit sketchy since all of it was cropped. When I ask her about the physical abuse, she immediately changed the conversation and told me that she is not ready to share about it. I respected that. She is very pushy with me, gusto niya malaman kung ilang beses kami mag meet up nung boyfriend ko. And when I told her that I don't wanna tell her anything. She got pissed off. Doon na nila ako inaway nung friend niya sa gc na they created. They keep on telling me that I should not believe my boyfriend. They are mad that I don't want to believe them. I confronted my boyfriend about it. He send me proof that the pictures are from last year. And he said sorry and that he loves me. When we had our first date my boyfriend warned me about her ex. That her ex girlfriend used to that everytime he is with a new girl. But ever since that day, I cannot fully trust my boyfriend. I don't want to break up with him, because I am already attached. I am convincing myself that maybe this was just a test to our realtionship. I've been crying myself to sleep these past few days because I am overthinking everything. I am starting to get paranoid and I hate that. I don't wanna be like that. I don't know what to do anymore.",https://www.reddit.com/r/OffMyChestPH/comments/15f3g1n/my_bf_is_still_seeing_his_ex_gf_behind_my_back/,t2_8x50zry24,2023-08-01 13:41:54,4,1
Told a student that it's okay if he does not come to school anymore,"
I'm a teacher. Now, I had a Grade 5 student named ""Nico"" (not his real name) na sobrang disruptive sa klase. Parang little version ng mga siga sa kanto. Mahilig maghamon ng away, mahilig gumawa ng mga kalokohan during class, and mag - ingay.  

So you could imagined how stressful he is during classes for teachers. Madalas ko siyang masaway at mapagsabihan.

Then kanina, while ihahatid ko na yung Grade 5 students ko sa gate ng school to be fetch by their guardian, he was being rowdy again sa classroom pati sa pagpila. 

I am stressed and tired kanina but I know it's not an excuse why I said these words, ""Alam mo, okay lang sa akin kahit hindi ka na pumasok sa school"".

Then Nico replied, ""Ayaw mo na sa akin teacher?""

Maybe it's my imagination but I could hear some sadness in his voice when we he replied to me. 

Then I suddenly realized the meaning behind my words that I said without thinking. And I thought to myself, what the hell am I saying sa isang 11 years old na bata? To think, I even know his history. 

Nico has been the problem of the teachers ever since pumasok siya sa school namin so I already knew him kahit hindi ko pa siya nahahawakan. His father is in prison for being a drug pusher and as a young child, he was exposed to verbal, physical, and mental abuse from his father according to his previous adviser. I've even heard that he was abandoned by his mother.

Kaya I really regret my words but I was not able to retract it or played it as a joke kasi talagang nablangko ako and the next thing I knew nasa gate na kami.

Maybe he'll forget the words I've said to him kanina, maybe it's really my imagination when I heard the sadness in his voice and he doesn't think it's a big deal. Nevertheless, I will assume he is hurt by it and I need to make amends with him on Monday.",https://www.reddit.com/r/OffMyChestPH/comments/12kp24c/told_a_student_that_its_okay_if_he_does_not_come/,t2_vpj5hn4v,2023-04-13 21:22:59,267,83
