title,body,link,author,created,upvotes,num_comments
I don't get it!!!!,"I don't get why people seem to EASILY throw their relationships away despite the shallowness of the fight/problem. Gets ko yung mga malalaking problema like cheating or physical abuse, ayun, talagang hindi katanggap tanggap yun.







Pero yung mababaw na away lang na kaya pa naman sana ayusin o pag usapan, sabay itatapon nalang yung relasyon bigla at maghahanap ng bago... yun ang di ko ma-gets. Pagdadaanan at pagdadaanan mo din naman sa ibang babae/lalaki yan. Lahat naman talaga ng relasyon may misunderstandings, eh. Ngayon, nasa sa inyong dalawa nalang ng partner mo kung gusto nyo patagalin o ipaglaban.







Natritrigger ako. My last relationship ended because of shallowness and selfishness. I didn't want to end it but what can I do? Gusto na itapon e. AYUS AYUSIN NYO MAKIPAG RELASYON PARANG AWA NYO NA. 







Para sakin, nakikipag date ka sa isang tao kasi potential syang asawa. Ano yun, pag kasal na kayo, onting away, hiwalay agad? Napaka hihina ng quality ng relationships ngayon. Otherwise, if you don't have a plan to marry that person, then just fuck him/her. Make sure lang na PAREHO kayong nagkakaintindihan sa set up nyo. GIGIGIL AKO!!!!




EDIT: I didn't expect that this post will have a different POVs and versions. When all I'm trying to say is that the relationship nowadays are so easily to end. Seems like everything became so fast paced. Others will break up without even trying to fix it. Everybody's patience became low. Some married people are here as well. Na imbis ayusin problema nila sa mga asawa nila, maghahanap ng landi sa reddit at sa ibang platforms. But who knows, baka nga talagang malala na. Thank you for sharing your POVs. I've learned something new. Also I was not trying to invalidate anything or anyone, never my intention. Was just legit wondering why relationships are ending easily.",https://www.reddit.com/r/OffMyChestPH/comments/x3qtkv/i_dont_get_it/,t2_diolbxgp,2022-09-02 11:19:21,64,49
Ang sakit na magwalk out sa isang toxic relationship,"Alam mo ung love mo ung person pero alam mo sa self mo na pag nafall ka ulit sa “promises” nq magbabago siya, uulit nanaman ung cycle ng emotional and verbal (sometimes physical) abuse. I decided not to accept ung pakikipagbalikan nya kasi sobra na kong nasaktan at napagod sa lahat ng effort ko na di naman nya naappreciate. Parang kahit anong gawin ko, mali, nakakainis, hindi enough. Ang sakit marinig

 Anyways di lang kasi ako makatulog kasi baka part of me nagguilty na kahit nageeffort naman sya recently eh ayaw ko parin. Kaso sa time na tintry nya ayusin nag away nanaman kami (take note di pa kami okay) so ano na????

Sobrang totoo pala ung phrase na “sometimes love is not enough” kasi kahit gano mo kamahal ung tao, mapupuno at mapupuno ka rin talaga. Siguro fault ko na rin kasi binottle ko lang pero everytime nagaaway kami before, lagi ko naman cinocommunicate ung frustrations ko pero it always fell on deaf ears.

Anyways sa mga katulad ko na kakaalis lang sa isang magulong relationship. I hope makahanap na tayong Peace pati narin sa partners natin. Sana magkapeace of mind na tayong lahat.

Mag 3 am na pasensya kung sabog ung thoughts. I drank my sleeping medications na pero 2 hours na at di parin ako makatulog hay",https://www.reddit.com/r/OffMyChestPH/comments/170pvyb/ang_sakit_na_magwalk_out_sa_isang_toxic/,t2_bxfzrwrn,2023-10-06 02:48:00,9,2
My Ex bring me to a smalltown in Mindanao and left in destitute.,"Sobrang laki ng pagsisisi ko. Sobrang dependent ako sayo.

&#x200B;

&#x200B;

I trusted the person and want to build a family pero puro panunumbat, lowkey cheating, at mental/physical abuse ung inabutan ko.

  
I know may pagkukulang rin ako due to my upbringing and trauma. Pero hindi ko talaga inakala na ganito ung mangyayari.

&#x200B;

I accepted ur past kahit may FWB ka before our relationship. Pero nung nag trauma dump lang ako sa ibang babae cheating na kaagad, Ung proof na pinost ko sa FB sa akin pa nag backfire.

&#x200B;

Inisip mo nalang sana na nagdala ka tao at pag may-away iiwan mo nlng ng basta2 na parang basura.   
Kung babae cguru ako matagal nakong buntis at nagiisa.   


  
Hindi ko lang ma imagine na mas priority mo pa pala ung happiness mo kesa sa well-being ko. 

  


Now, I barely eat at baon2 sa utang. Sana maisip mo rin situation ko. Pero hindi nako aasa pa.  
Masakit pero pinapatawad na kita. I hope God will guide your path and heal you as well.  


  
PS. Rant lang to wag kayong ano.",https://www.reddit.com/r/OffMyChestPH/comments/15fkm22/my_ex_bring_me_to_a_smalltown_in_mindanao_and/,t2_6lweuhcv,2023-08-02 02:28:22,0,0
Napakaunfair ng buhay,"I just came across a series of posts on tiktok about this girl who had her PHP30,000 dress custom-made by a celebrity designer for the Eras Tour in Japan. Oo, inggit lang talaga ako. I wasn’t able to attend my prom in HS and SHS. I didn’t have a debut either. Handa ko nung 18th bday ko ay sigaw mula sa abusive mother ko at deep-seated fear na anytime bubugbugin na naman ako nito dahil trip niya lang. I’ve never gone out of the country either. My fake peers are all yapping to my face about how they’re vacationing abroad so I couldn’t help but get irked. 

Di ko alam bat ganto ang life hahahah tbh ok lang sana kung mahirap lang talaga kami, ok lang sana. E kaso dinagdagan mo pa ng verbal, physical, mental abuse mula sa sumbaterang nanay na nagpapatira ng kabit niya sa bahay at deadbeat abusive father na walang silbi, tas lahat ng fake peers mo puro kayabangan (I’m a full scholar in a top 2 uni), complete absence of real trusted friends you can rely on or just any semblance of a support system, lahat ng hirap sa buhay nagpapatong patong at parang dinudurog ka na lang. Kapagod.


Edit: to the person/s who downvoted this, nawa’y lahat ng kamalasan ko sa buhay ay mapunta sa iyo. In Jesus’s name. Amen. 🥰",https://www.reddit.com/r/OffMyChestPH/comments/1anafha/napakaunfair_ng_buhay/,t2_hpse5am9s,2024-02-10 15:00:38,0,4
Off my chest,"I love my bf so much. Di ko na alam pano ko pa ieexpress sa kanya online haha. Lahat na yata ng way ng pagsabi ng I love you nasabi ko na. Di ko na rin maexpress kung gano ko sya namiss. Kada mababakante ako sa mga tasks ko naaalala ko sya at namimiss. Pano kasi sobrang sweet. Di sya cheesy pero sweet sya in a realistic way. Soft spoken pa at walang vices/ di nagmumura. 

Pag naiinis or nagagalit ako parang ako pa naguguilty kasi di nya naman deserve 😭. Last time nagcomplain ako na feeling ko nakukulangan ako sa attention since nagaadjust sya ngayon sa new work so naiba sched ng calls namin. He assured me agad tas he took me out for dinner and sinamahan nya rin ako manood ng theater show na gusto ko 🥹💖 nagluto pa sya ng packed lunch namin bago kami magmeet. 

May times na feeling ko bagong magjowa lang kami kahit 3+ yrs na. Siguro dahil ldr na rin

Pano ko naman di mamimiss kung ganyan? Ksksjsjsksksksks


Ps

I Came from a somehow verbally abusive household. Dati may physical abuse din pero nabawasan na as we got older. This affects my relationship now. Ayoko talaga ng nagmumura or sumisigaw pero may times na nagagawa ko sya. I dont wanna be like my dad in my relationship. Super saya ko na hindi ganun bf ko. Pero may fear na what if maging ganun din sya pag tumanda? kasi di naman daw ganun dad ko bago sila ikasal ni mama. Scary. Lagi ako may fear na ganun. Or lagi ako nagaanticipate ng extreme reactions dahil ganun ako lumaki. Oa kasi sa bahay namin while my bf and his family are very chill lang. These are things that im trying to make adjustments for and Im glad he understands and help me through it 🥹",https://www.reddit.com/r/OffMyChestPH/comments/180ow8j/off_my_chest/,t2_8rjmo41j,2023-11-22 03:17:22,2,1
Idk how to cope with this,"
I (m19) a good son and a student. Like every parents could ever dream off. But still im not perfect human being. For background . So my aunty (F50) she got no kids just mainly her life revolves around helping our family and being a corporate slave for god knows since when she started being one. As we all expected from her. Shes really strict and got a high superiority complex attitude. To the point where i have to tell my friends i should be at home by 6 or else my whole family especially my brother whos the golden child.  (M23) i dont really care tbh who happens to be a controlling coward and a manipulator would be calling my ass off. He would mentally abuse by gaslighting me for not being a good son and mainly rebellious by staying late and lying. Well he do the same. For the side note. I go to my friend’s house just to escape from my aunt and mainly the household.He would sometimes physically abuse me for talking back inshort defending myself. Because he always been exaggerating about everything just to make sure he got it all right. I became not really close to all of them. I left my religion and open up to islam. they didnt support me but wanting me to die. I dont really know im so close from ending myself. I felt like i cant find a partner or be in a relationship. If my family would be like this.  They always say that ill be the one taking care of them once they got old and shit. Which i dont really like. I cant live up with this kind of thing. Idk for how long i can endure this because im so close to ending myself.


Note: my parents doesnt care and they always take my brother’s side because hes the golden child.",https://www.reddit.com/r/OffMyChestPH/comments/18jpg9o/idk_how_to_cope_with_this/,t2_7of8hvzts,2023-12-16 19:36:41,1,2
How I ruined my Ex's life for Getting with my Best friend,"**\[LONG POST AHEAD\]**

&#x200B;

First of all, I already know maraming magagalit saakin, perhaps because masyadong harsh ang ginawa ko. TW lang sa mga mambabasa, this post will contain sexual harassment, physical abuse, and religious CULTS.

SO, my first ex boyfriend and I began dating noon high school pa, precisely 8th grade. We dated for almost 4 years until niloko niya ako sa best friend ko. I'll call her ""A"". Noong una, sobrang perfect ng relationship. He was my first boyfriend and akala ko my last. I would say very low maintenance ako that time, tipong kahit hindi niya ako binibigyan ng bulaklak during Anniversary namin or Valentines, presence niya was enough for me. Naintindihan ko rin ang situation niya since noong una palang sinabi na niya saakin ""mahirap lang kami"". This is because Typhoon Yolanda severely affected his family (he grew up in Tacloban ) financially and naghirap sila. Prior to the typhoon his family wasn't financially stable na rin. So mas lumala lang ang situation nila, tapos madami pa sila magkakapatid. This explains why kinailangan niya lumuwas sa Maynila at mag aral. Matalino ang ex ko, like no joke. I studied in a well known private school in Manila, perhaps the whole Philippines pa. So to be a scholar there was a big deal. He excelled in everything, ma-pa sports or academics, which explains why na in love ako sakanya. I didn't give a single F kung mahirap siya, I fell in love with his intelligence, passion and ambition for success.

Fast forward to my 12th year of HS (4 years later),  biglang nagiba ang ugali niya when he entered college (he was a year above my grade level so nauna siya mag kolehiyo.). I was so confused and frustrated kasi 3 years consistent ang princess treatment niya saakin. He got physically abusive to the extent na wala na sa lugar. Pinapahiya niya ako in public, tipong sisigawan ako sa harap ng maraming tao. The first time he abused me was when sinampal niya ako. And not like yung mahina na sampal, but yung tipong FULL FORCE na sampal. Imagine, I am a 5'2 female and he's a 5'8 male na slightly malaman ang physique -- not to mention main sport pa niya in HS was volleyball. Sa sobrang lakas ng sampal niya I fell to the ground and nagka pasa ako sa face for one week. For most girls, the first thing they would do is makipaghiwalay, diba? Kaso, t4nga ako that time. He apologized and comforted me after this incident and nagsinungaling ako sa parents ko na natamaan ako ng bola sa mukha during intrams. I let it go because he apologized profusely and nangako na it would never happen again. But of course, it DID happen again. Multiple times in fact. I was 18 years old at the time pa.

Months later, I received a long message from him, stating na gusto na niya mag ""repent"" sa mga ""sins"" niya saakin. Nakipag break siya saakin. He joined a church, which I later found out was a cult pala. Sa cult na ito may ""quota"" sila, like how many people they could recruit to their church. They would get praised pag na reach nila ito. Dinamay pa niya ako sa kulto niya aaaah! And as expected, it was a living hell. In this Church you were monitored most of the time, dating was prohibited without the approval of the pastors and you had to take an oath na kailangan mo ibigay ang life mo sa church (ang reasoning nila is because Jesus did the same for God). Despite being in the church though, patago kami gumagawa ng indecent acts. The slightest physical intimacy was ABSOLUTELY prohibited but ginagawa pa rin namin sa likod ng mga sisters/brothers/pastors. Not gonna lie, at some point I was genuinely committed to serving the Lord, but it was so difficult for me to stay ""holy"" when my ex would pressure me to do indecent acts with him. Sobrang hypocritical niya, yung ip-pressure niya ako makipag talik pero the next day he would be preaching about staying holy until marriage. Like what the F! And yes, technically break na nga kami but I thought wala lang yon because he still treated me like his girlfriend.

Bob0 kasi ako, akala ko kami pa. Kaso, he started showing interest kay ""A"" and completely disregarded me. He began pursuing ""A"". *For context*, ""A"" was my best friend sa church. She was sweet, intelligent and kind. My ex met ""A"" through me and naging bff din sila because they go to the same University apparently. When my ex began pursuing her yung money na hinihiram niya saakin (but hindi naman binabayaran) ginagastos niya kay ""A"" for flowers and gifts. The audacity. Although, habang nililigawan pa niya si ""A"" saakin pa rin siya pumupunta, perhaps because of the uncertainty. As a T4nga, hinayaan ko lang. I thought if I treated him better pipiliin niya ako. Umabot pa sa punto na  nagmakaawa ako na ako nalang. *Wa epek*. When pinayagan na siya ng pastors to pursue ""A"" he ghosted me completely and avoided me in Church. Sa harap ko pa siya nag ""Will you be my Girlfriend?"" kay ""A"" at a special Church event. P0ta!  After niya ako paasahin, gawing sugar mommy and Fbuddy????

**Ito na ang exciting part**, I had so many mix emotions like heartbreak, frustration and anger. Mostly anger. Because I felt used and manipulated. So, sinabi ko kay ""A"" everything, that we were doing indecent acts, na ginamit niya ako, na kami pa when we entered the church and LEFT the Church. When I left the Church I gave myself some time off and decided to forget everything nalang. UNTIL narinig ko na my ex completely twisted the story and pinagkalat sa Church na I was the one pressuring him (huh?). Sa sobrang nandilim ang paningin ko I decided plotting a plan how I could completely ruin his life. Since pilit nag mamabait other sisters/brothers ko sa Church I would frequently message them, acting all buddy buddy, pretending na I am completely oblivious sa mga pinagsasabi nila behind my back. Praise the Gods my OG akong friend sa church (who eventually left din) na chinismis saakin na my ex sexually harassed ""A"". Hinalikan siya ng walang consent ni ""A"" and also pressured her frequently to do indecent acts. Their relationship went downhill from their because nag sumbong si ""A"" sa pastors. HA! I put this information to good use and pinagkalat sa University niya of what he did to ME and ""A"" (without uncovering our names). I anonymously posted sa Freedom Wall ng University niya and name dropped him. Like, name, batch and course pa. I exposed how he was an abuser, predator and manipulator. Inexpose ko rin ang darkest secret niya, na nanonood siya ng child hentai (which is technically child p, diba?). Nahuli ko sa gallery niya na he had hentai vids and pics of sexualized versions of child anime characters (like yung mga white blood cells sa Cells at Work anime). Alam ko, na b0b0 ako for letting this slide, but he reasoned na they were just drawings. Huh? Anyways, when the post gained enough attention I deleted it to cover my tracks. A week later, my ex's friend (who eventually became my friend na rin) informed me na my ex was being completely alienated in campus hehe. Receiving dirty looks, anonymous threats, and getting bullied almost. A month later nagpost siya sa FB na he felt unsafe sa campus and had to drop out and needed financial support from his ""brothers and sisters"" in Church. I know ang sama, but sobrang saya ko when I read that post. The thought na I had ruined his reputation sa University niya, relationship and Church ... sensational.

Also, if you're thinking about his family, I also took care of it. I told them everything via messenger na ginawa niya saakin and they were on my side. Sabi saakin ng sis ng ex ko (close ko rin) binugbog ang  ex ko ng father niya when he came home for Christmas sa Tacloban for being ""kahihiyan"" and for ruining his future. THANKS TITO ILY!

&#x200B;

PS. Also, I know dapat I should have been the matured one and walked away nalang para walang gulo. Sabi nga nila, God forgives even the greatest sinners. Unfortunately, for my ex, hindi ako Diyos. Thanks for reading!",https://www.reddit.com/r/OffMyChestPH/comments/14q6c9t/how_i_ruined_my_exs_life_for_getting_with_my_best/,t2_rvthn8oc,2023-07-04 13:50:16,147,34
Mahirap ma abused ng babae sa Pilipinas,"My ex (now colleague) still harasses me kahit na ilang beses na akong nag plead na layuan na nya at tigilan na nya ko. Ilang beses akong nagmamakaawa pero hindi nya marespeto yun. Lagi nya kong hinarass sa chat/text at in person. We broke up for almost 6 months and she still thinks na kami pa rin until now. Guarding me with my every move. 

She's confronting or harassing me because:

1. Nagmamakaawa siya na maging kami ulit
2. She keeps saying na ako yung sinungaling at manipulative. 
3. Manunumbat siya sa lahat ng nagawa nya for me
4. Tinatakot nya ko na mag suicide siya pag di ko siya kinausap. 

I've been enduring that cycle repeatedly week for 6 months. Masakit lang sa part ko na she's making things up para mag mukhang victim and the fact na nagmakaawa na ko sa kanya na to stop confronting me everytime may relapse sya. Tbh, sobrang draining sa mental health and I can't seek for help Kasi I'm a guy and ang hirap i prove na I am verbally, physically and psychologically abused. Ang proof ko lang yung conversations namin. I don't know where to go or what to do. I can't quit.",https://www.reddit.com/r/OffMyChestPH/comments/1aspoy9/mahirap_ma_abused_ng_babae_sa_pilipinas/,t2_njba2z0oa,2024-02-17 09:28:39,67,31
I HATE MYSELF,"F(16) I am feeling SO SO GUILTY right now. I impulsively 'pitik' (without any second thoughts, as if my hand acted on its own due to my emotions) my mother slightly at the back of her head after I was offended by what she said. She said, 'nananakit ka na ah' and kinda punched me on my shoulder. Her words HURT me, knowing that my father physically abused her before. I just want to KMS I FEEL SO GUILTY

But she also hurts us when she gets angry. I hate how I am becoming like them. I'm literally trying hard to control myself when I'm feeling overwelming emotions because I usually hurt myself but this time I JUST CANT.... : (

edit: i wont be surprise if she give me silent trestment again... ill wait till week til she acts as if notjing ever happened",https://www.reddit.com/r/OffMyChestPH/comments/15qxsmh/i_hate_myself/,t2_f4i0hagq2,2023-08-14 23:25:15,8,1
My mom’s friend raped me,"

I was raped when I was 18 by my mom's friend, and when I was 20, I told my mom about it. My mom has been my trauma since I was a kid; she has physically and verbally abused me since I was a child because I think she  despise my father so much. So back to the topic I told her na I was raped nung 20 na ako pero ewan ko di nya ata ako pinaniwalaan and now I’m 23 and I accidentally open her account kase nagbakasyon sya dito sa condo namen ng husband ko and unang una kong nakita na magka chat pa din sila nung lalake na nang rape saken, all this time pala di nya ko talaga pinaniwalaan and super sakt for me kase pinatawad ko na sya ng buong buo sa lahat ng pambubugbog nya saken dati and I even support her financially until today kase may sakt sya pero kaht naman nung wala pa syang saket lahat lahat ng kinikita ko sa modeling and work ko napupunta sa kanila nagtitiis ako dito sa manila just for them ng mga kapated ko sa province, She never treated me as her daughter pala talaga lalo na siguro kung wala akont nabbigay na pera sa kanya . Sobrang saket talaga lalo na nasa kanya trauma ko , dahil lang talaga sa kapated ko kaya di ko sya kina cut off sa buhay ko naawa ako sa baby brother ko which is 9 yrs old pa lang kc nakikita ko din minsan na verbally abuse sya, gusto ko na ngang kuhain un pero di naman ako mananalo sa batas kase sya pa din nanay and half sister lang ako. Growing up without a father is really hard pero mas mahirap na lumakeng may abusive mom like her.",https://www.reddit.com/r/OffMyChestPH/comments/18yfndk/my_moms_friend_raped_me/,t2_umv32oti,2024-01-04 23:23:35,105,0
I hate how co-GenZs friends reacted and looked down on my dream about being a good mother/housewife,"Idk if this is a right sub pero nakakainis hahahaha. 

I really don’t get the amount of hate I got from my friends when I told them na I want to be a housewife, be a good mother figure and create a cozy family pag napag-uusapan yung ganap sa sarili or plans in future sa catch up. Napatungan pa ulit when my friend screenshot yung repost ko sa tiktok which is vid about family, dating, marriage na nakacollage ganon. Ako naman medyo matagal ako mag check ng gc and grabe na flood na nung nakita ko. I know it’s supposed to be a joke to jump with but I was hurt. They be like, “Can’t relate”, “Hirap magka-anak teh”, “Yung pinaiyak ka sa nursing tas magiging nanay ka lang”, “Si **** puro repost ng ganyan.” 

Medyo na-off lang ako kasi I thought I’m already in supportive friend group since I cut off my old friend group last year. Ano bang meron? Ano bang masama sa pagiging housewife? Funny how most of them are self-proclaimed feminist but doesn’t tend to support their co-female dream, I mean I’m not being forced naman eh, I don’t get the hate ba’t pinagtatawanan eh choice ko yun. I want it. I WANT IT SO BAD.

I grew up in chaotic family, I don’t have a father figure, I was raised by my alcoholic and physically abuser mother (she died early) then passed on to my grandparents. I always envy people who have a complete family simula bata ako. May pangarap rin naman ako to be a nurse, I’m doing great sa academics but having a complete and happy family talaga pinakadream ko. Minsan natatakot ako kasi baka matulad ako sa mother ko, iniiyakan ko yun pag nag o-overthink ako sa future pero I know to myself na I will try my best to treat them like how ng grandparents treated me. I want to have children na mababatayan ko so they wouldn’t feel lonely. I want a loving husband. I want to be a supportive and loving mother/partner. 

Hayyy. It’s just so hard to expressed feelings like this nowadays kasi napupuno ng back flash. Please mind your own dream. If you think yours is superior, good for you but walang madaling pangarap. If you don’t wanna get married, have children, that’s fine but please don’t judge people who want to create one.",https://www.reddit.com/r/OffMyChestPH/comments/1ak4c8s/i_hate_how_cogenzs_friends_reacted_and_looked/,t2_t2o6wc46i,2024-02-06 15:33:46,78,36
Not sure anymore,"I’m in my mid-20’s already, and sobrang dami kong narealize from life to dating and everything in between.


Sometimes, I do question myself if I’m not enough for someone. I've had at least three exes, all of whom were short-lived.

1st ex (college days): 11 months lang kami, this was a mutual breakup because nagiging toxic na ang relationship to the point na I was mentally and physically abused.

2nd ex (dated him 3 years after my 1st relationship): 11 months lang din kami because he ghosted me, and then I asked him the night before our 1st anniversary, and he said he just liked the idea of having someone in his life, but he didn’t really love me at all.

3rd ex (the most recent one): it took me again another 3 years for me to try dating. We were in the talking stage for like 6 months, and then he courted me, and it felt like everything was right, not until he broke up with me because he doesn’t feel like continuing our relationship anymore. So we dated for a month, officially.


I even came to a point where I questioned myself and thought negatively. I am not actively looking for love,  and then when we really start dating, they really leave me at the most inconvenient time of my life. Yes, naisip ko na rin yan na baka hanggang gantsilyo lang din talaga ako until pagtanda, and also self-aware naman ako na I have my flaws or negative traits tao lang rin naman ako. But for now, susuko na ako.",https://www.reddit.com/r/OffMyChestPH/comments/1bmds33/not_sure_anymore/,t2_my6jqx73h,2024-03-24 14:03:30,3,0
