title,body,link,author,created,upvotes,num_comments
It's my first time hearing my partner sing her heart out after 2 months,"Mahaba haba to, your choice if babasahin mo :)

I'm 22M and my partner's 21F, we're both living with my parents. Everything's all great, it felt like I'm living the dream. Parehong may savings, nabibili namin lahat ng mga gusto namin, and of course, nakakatulong din kami sa bills dito sa bahay. She was 19yrs old when we decided na mag live in na, given the fact na sobrang abusive sakanya ng mga tao sa bahay nila (verbal and physical abuse), nagka trauma and depression siya that time so I told her na whatever her decision, my family and I will welcome her sa house namin. We both earn 30k monthly since nasa parehong company lang kami.. 

But then, March 28, we lost our baby. She was 3 months pregnant at that time. She wanted to quit her job so I let her be, she needed time to grieve, to breathe, and to heal. I know I do too but, she's my first priority. It's very heart breaking BUT we can always make another one. That's when she started to be quiet. No words. No reactions. Barely eating. Ni hindi kami nag uusap ng matino, just pure presence is all that we have that time. Hindi siya lumalabas ng bahay. Hindi niya rin kinakausap mga friends niya and kahit sino dito sa bahay. She ignored us for 2 months. Some may say that she's unfair and that she never thought of how I would feel sa ginagawa niya. Na hindi lang siya ang nawalan.

Pero kahit na hindi siya nagsasalita, or kahit na hindi niya ako kinakausap.. Palagi niya akong inaalagaan. Nauuna siyang gumising sakin ng 7PM para gawan ako ng breakfast (gy shift ako), after that, papainitan niya ako ng tubig kasi hindi ako nakakaligo pag hindi maligamgam yung tubig. Pag break ko, may snacks na nakahanda sa table ko, and then pag lunch ko naman, hinahatiran niya ako ng niluto niya for me. Lahat ng foods na ginagawa niya for me, laging may sticky notes sa ilalim ng pinggan: ""Thank you so much"" ""I appreciate you"" ""Wait for me"" ""I hope it's spicy enough for you, di ko tinikman kasi baka it's too spicy for me"" ""Hipon, your favorite!"" ""With every bit of fiber in my body, I love you"", iilan lang yan sa mga nakalagay palagi sa note, never siyang nakalimot na iremind ako na kahit ganon siya sa ngayon, mahal na mahal niya ako't inaalala niya ako. 

Kanina after shift, habang naliligo siya, bigla akong naiyak kasi narinig ko siyang kumakanta. After 2 months. Paglabas niya ng CR, nagtataka siya kung bakit ako umiiyak. Niyakap ko lang siya ng mahigpit. She thanked me again and told me how much she loves me. While smiling. God, I love her so much.



EDIT:

Big thanks to all of you! Bago ko pala ipost to, nagsabi muna ako sakanya if pwede ko bang ishare yung pinagdaanan namin. Pinakita ko sakanya yung mga comments niyo kaya natuwa naman siya 😄

If y'all are interested to know how we started, I created a long ass story - https://www.reddit.com/r/OffMyChestPH/comments/143comr/how_i_got_lucky_i_guess_haha/?utm_source=share&utm_medium=android_app&utm_name=androidcss&utm_term=1&utm_content=share_button",https://www.reddit.com/r/OffMyChestPH/comments/143438n/its_my_first_time_hearing_my_partner_sing_her/,t2_cw3t5eqts,2023-06-07 13:13:02,755,85
I'm a bad at everything,"I believe I have not been a good father or husband. My wife was physically abusive towards me, which led to our separation. I am now married to a woman from Thailand, but I still carry guilt about the past. Despite this, I continue to provide my former family with $5000 per month, continuous, nonstop, just like before. I reside in a third-world country in Southeast Asia. Still, i think i'm bad at everything. Or, that's my former wife told me. Deep inside, i think this is unfair to my new family. Maybe i'm wrong. I don't know...",https://www.reddit.com/r/OffMyChestPH/comments/1bqc4zw/im_a_bad_at_everything/,t2_wg3838pxc,2024-03-29 08:57:29,0,0
Abused,"Help your girlie out there, need ko lumipat urgently. It's been years na din and I'm very vocal sa physical abuse na ginagawa ng tatay ko ever since. And tonight was the worse, I don't know bat ako pinag-iinitan lately and I won't regret any impulsive  decision that I will made today. 

Just a minutes ago, binugbog ako ng tatay ko and was I was also hit below my head. Ramdam ko ang sakit sa katawan until now and I feel na magkakapasa to, I will take pics and magpapa medical agad ako tomorrow just in case na mag-file ako ng kaso. Do you know where can I get medical for this? Sa Parañaque po near sucat. 

Also I need to move out urgently, and he's making me stress throughout my childhood and until now and inaabuso physically and emotionally. Di ko maigalaw ng maayos ang likod ko ngayon. 

I need peace. And I will move out. 

Do you also know a place where can I rent for 2000? Alabang sana near festival. Di ko alam kung kakayanin ko pa tumagal dito. And I also let my friends know about this matter just in case something happened to me tonight. 

Di ako magaling mag kwento, pero sana maintindihan niyo. ",https://www.reddit.com/r/OffMyChestPH/comments/1b3r2qu/abused/,t2_jbmennajw,2024-03-01 18:25:33,13,8
It’s good that people are starting to know more about NARCISSISTS kasi tangina ng mga hayop nato,"Una sa lahat kung feeling mo you’re dealing with someone who is a narcissist. malignant man or covert, mapakaibigan o magulang, kakilala o katrabaho. Kabahan ka na and PLEASE Do GREY ROCK METHOD or if kaya, CUT. THEM. OFF.

Di yan mag babago dahil karamihan sa mga yan mga sociopath at walang empathy. Kunwari mag babago pero yung totoo, they can't dahil wala namang mga totoong personality tong mga to kung hindi suck all the life out of people in their lives. Lahat ng tao sa buhay nila they see only as an object o supply who will benefit them. Wala silang pake kung masaktan ka nila. They dont care about you. Worst is, pag sumabog ka pa dahil sa kahayupan na ginagawa nila sayo, imamanipulate ka pa nila na ikaw yung may kasalanan. ANG GAGO DI BA. Worst, baka umabot pa sa PHYSICAL ABUSE YAN dahil lahat sila may tendencies. 

Salamat sa ibang reddit users dito na nakatulong sakin makita the signs kasi tong mga to they have a pattern. they are not as smart as they think they are. SAVE YOURSELF,Talk to your friends, people you trust, watch nyo yung IG reels ni [narcabusecoach](https://www.instagram.com/narcabusecoach/#) [\_stronger\_than\_before\_coach/](https://www.instagram.com/_stronger_than_before_coach/) [mentalhealnesss/](https://www.instagram.com/mentalhealnesss/) [healing\_out.loud/](https://www.instagram.com/healing_out.loud/) or better, ask your therapists. Wala ng pagasa mga tanginang yan.

Wala namang konsepto yan ng change kasi they are always the victims in their own stories, always the one being wronged. Pati sarili nilang mga kasinungalingan pinaniniwalaan nila.Dont give them any ounce of your empathy. See them for who they are. Selfish, Manipulative, lovebomber, cheating ass, and gaslighter who will do anything to control you and protect themselves and their pathetic lives.",https://www.reddit.com/r/OffMyChestPH/comments/12rpjbv/its_good_that_people_are_starting_to_know_more/,t2_w88hlv9e,2023-04-19 19:08:20,153,69
"My co-parent is a huge fucking piece of shit, and it took me three years to fully realize it.","Before I got into a relationship with my co-parent, I dated two other men who cheated on me and physically abused me. Though he didn't cheat on me, we still didn't work out because of his retroactive jealousy issues (my body count was a little higher than his), which then made him verbally abusive towards me. The emotional abuse got so bad that I resorted to self-harm, and all of this happened to me while I was in my first trimester of pregnancy. He also treated me like shit for getting pregnant and encouraged me to abort my son many times because it's bad for his career (as if he had any lol), and went as far as accusing me of making pikot because he comes from a political dynasty. After our failed engagement, I stayed away from dating because his words really cut deep, and I have completely lost my confidence in putting myself out there. During this time, I kept on blaming myself for all the shit he put me through, thinking that I deserved it because I chose to keep our son. I even told all my friends that he was the best partner I've ever had because unlike the others, he didn't cheat or physically harm me.

Thinking about it now, it was so fucking disgusting of me to rationalize what he did. I was a 22 year old girl then who was lost and suddenly plunged into parenthood, and instead of being kinder, he put me through so much. He shouted at me a lot in my own house, then called off our engagement on the sole reason that his brods think I'm a gold digger (idk where this came from bc he was basically unemployed for three months and I shouldered all his expenses then).

I got extra triggered today because he visited my home to meet my son, and he had the audacity to tell me I was not a good person. What a fucking piece of shit, I solely took care of my son for the past three years we were separated whilst he was busy chasing empty career promises of his brods. While he's sleeping sound, I was up taking care of my son then heading to work without sleep for 3 fucking years. Tapos ako pa yung hindi good person? Hahaha putang ina mo, T***. I hope you get what's coming to you, gago ka. Matapos ko lang 'tong masters ko, gago tatanggalin na talaga kita sa buhay namin ng anak ko.

I think what further solidified my long overdue anger is that I currently have a suitor now who is exerting so much effort for me, and is treating me so well. Despite his demanding schdule at work and in grad school, he visits me in a heartbeat when I need emotional support. Whatever free time he has, whether it be an hour or a day, he does his best to allot most of it for me. He treated me to nice dinners for no reason aside missing me. He really showed me that all my life, I settled for the bare minimum. Salamat na lang at hindi na ulit mangyayari 'yon, because I finally know what it's like to be loved. Whether we work out or not, I'm glad to have finally known my worth.

So TL;DR version: Tangina ng ex kong verbally abusive pati brods nyang makakapal ang mukha, and also that abuse isn't always cheating or physically beating. Often, it comes in the form of verbal and emotional abuse. Eitherway, we shouldn't settle for any when there are billions of people who are willing to give us so much more love.",https://www.reddit.com/r/OffMyChestPH/comments/1azyi8l/my_coparent_is_a_huge_fucking_piece_of_shit_and/,t2_ulxerfe3z,2024-02-26 04:49:00,7,0
(28F) Napakahirap growing up with an abusive father.,"The violent and sudden angry outbursts I witnessed since I was a child, yung mom ko battered wife due to his paranoia (napaka seloso), nakatikim kaming magkakapatid ng physical abuse kahit walang dahilan para ikagalit niya. Noon inisip ko tuwing ma tri-trigerred siya maging violent na sana mas mabuti pa walang ama kaysa ganoon, noong nilayasan namin siya ilang beses hindi na sana nakipag reconcile mom ko everytime na susuyin niya kami for the sake of not being called ""a broken family"". Eh di sana happy kami na wala siya sa buhay namin, may freedom from emotional harm at wala ng source of misery.

Mahirap especially as a babae ma re-realize mo na kaya pala na a-attract mo ay yung mga cheaters, uncaring, heartless partners kasi deep inside your subconscious yun ang alam mong ""love"" growing up. 

Yun lang, life ain't good atm.",https://www.reddit.com/r/OffMyChestPH/comments/1ap29h5/28f_napakahirap_growing_up_with_an_abusive_father/,t2_sdzz5jhhq,2024-02-12 23:14:56,2,0
I'm a child of seperated parents.,"My so called parents doesn't really care about me anymore and I'm on my won fending for myself.

Been deprived with lots of things growing up, my half siblings getting things more than me. Me needing to settle sa mga handme downs from my relatives.

Not being able to go to college because my siblings needed to study more.

Developing depression at 14, Got raped many times, Got physically abused by my own Dad, My mom being verbally abusive.

I'm so tired of life itself. It's funny that I'm afraid of death but I wanna die.

Crying my hearts out at the comshop lols My Dad bought my sister a new phone, while me who has a hand me down phone thats so beat up he couldn't even get it fixed for me, and now it died he doesn't even care about it.

Does god hate me? I can't even review for my upcoming exam because of my phone dying, I wanna get that scholarship.

To people whom in a relationship out there, if you know to yourselves that you guys will not last please don't bring a child in this world you'll guys will neglect in the end, Because it's a real struggle for children like me.",https://www.reddit.com/r/OffMyChestPH/comments/1bt2jtp/im_a_child_of_seperated_parents/,t2_r9ubyaiw1,2024-04-01 20:34:17,4,0
Ang hirap magmahal ng magulang na nananakit pag nagalit.,"-TW: physical abuse- 

Hello, quite personal rant here. I just find it hard processing what I feel rn. My Dad kasi has a tendecy na maging physically abusive pag sobrang nagalit. He also has a short temper din. Before, back in 2021, we had a huge argument (I was 19/20 noon) and it ended up w him getting physical (dragged me back into the house by the arm; strangled me in attempt to shut me up). Looking back, I know I had a sharp tongue. Pero it was all pent up, all the frustration and anger I felt towards him just exploded at that time. Having him around the house when he gets back home from work (which is every 2 months; he works abroad) is like walking on eggshells. Things were said and done. I was young still, and I did not know how to process how I felt. I still don’t now but I try not to go head-to-head w him anymore. 

Pagkamagagalit na sya, at feeling ng Mom ko mamimisikal na sya, she tries to interfere. She would put herself in between me and my Dad, or tell both of us to stop. Walang ibang magawa si Mommy kasi baka siya naman ang saktan, o di kaya magmukmok si Dad at isipin wala syang kakampi. My Mom just tries to stay in between.

After the first time he got physical w me, I thought na mali yon. Na hindi ko responsibilidad ang reactions nya pag magagalit sya. My Mom said na he only got physical because I did that to him, ang managot etc. For a very long time, I believed this. Initially, I did not. I believed that no matter how angry you are, you wouldn’t get physical w anyone. Especially family. 

Pero ngayon, we just had an argument recently. Noong una hindi naman talaga sya ang may problema ako, sa Mom ko lang. But apparently, naapektuhan daw sya kasi di kami naguusap. Ang Dad ko, pag mangsisita, parang laging on a high horse. The way he talks nakakatick off talaga. I think that was what set me off, kasi ganon ang pagsita nya sakin habang nakain ako magisa. Di ko napigilan (at mali ko yon) na sabihin na bakit naman ganyan sya mangapproach, and that kay Mom ako may problem hindi sa kanya. Suddenly, malaki na ang hugot nya. Bakit daw parang ghost ko lang sila tratuhin, hindi na ako nagkkwento sa kanila, etc. Para saan pa para magkwento, kung ang comment nya lagi sobrang nakaka-off? When I went to Graphika noon, nangamusta. Sabi ko ok lang, tinanong may entrance fee raw ba. Di na lang ako sumagot kasi alam ko mag c-comment syang “Mahal naman.” or makikita mong ij-judge ka nya sa facial reactions nya. What do you call comments like that? Sly comments or unnecessary side comments? Something like that. Laging may kuda na sobrang unnecessary. Nandoon sya sa generation na naninita ng pagbabago sa physical appearance (esp weight) at mga financial decisions ng iba. 

Siguro kaya malayo na rin loob ko sa kanya. Gets naman na nagt-try sya, sabi ng Mom ko. Bigyan lang daw ng time na magadjust kasi nga madalas namang wala sya dito sa lupa at laging nasa dagat for years already. Okay, pero hanggang kailan ang adjustment? Isang dekada na mahigit na ganyan ang set up namin, wala talaga. 

Ang hirap mo mahalin Dad. As a provider, thank you nandyan ka. Pero bilang tatay, nahihirapan akong mahalin ka. Hindi ko alam kung manifestation ba to ng trauma ko sayo. Pagpinapalo mo mga aso natin kasi sobrang ingay, naalala ko pagiging namimisikal mo. Hindi ka naman nagbago. All this time, I thought I was over what had happened between us before. Pero hindi, ang hirap mo pakisamahan. Sana hindi ka na lang naganak kung may anger issues ka. Sorry.",https://www.reddit.com/r/OffMyChestPH/comments/1azlhhu/ang_hirap_magmahal_ng_magulang_na_nananakit_pag/,t2_uus7wfyf,2024-02-25 19:09:52,1,0
I think I hate my younger sister,"Long rant ahead.

Tldr: I can't endure my physically, verbally, financially abusive 3rd grade sister anymore.

I'm already fed up. Gusto kong isurrender na lang namin siya sa dswd. Pagod na rin akong pilitin parents namin na ipaconsult siya pedia. Hindi ko na talaga kaya. Pasaway din ako at ng brother ko noon but it's bearable like normal kids are, our sister is literally hell. 

We already did several methods. Kahit pagsabihan nang mabuti, pangit pa rin gawain. Our parents does gentle parenting on her, however they are strict too at pinapagalitan siya when necessary. My brother and I naman are very strict with her naman, nauutusan pa namin siya minsan. Me and my brother grew up decently, I don't think parenting method ng parents namin ang problema. I think yung sister talaga namin. 

Physically abusive siya. She once hit my brother with a wooden block on his face, his nose bled pero nakarecover in a few days. She also threw scissors at me tapos inakmaan pa akong saksakin ng kutsilyo buti nakailag ako. Kahit small jokes lang like di masarap ulam mo. Kapag nagtatabi yung parents namin o malapit ako sa tatay namin, nagwawala siya. Suntok at sipa inaabot naming lahat. Kapag nasa labas sila ng nanay ko at di niya nabili gusto niya o nairita lang siya, ganun din, sinasaktan niya nanay namin kahit maraming tao. 

Verbally abusive. Lahat na siguro ng mura nasabi niya sa amin, kahit may ibang tao. Kapag nag-aaway o harutan lang kami, minsan sinasabi niya ""ah patay na mama niya (referring to my grandma"" sakin. Sometimes she even wishes mawala isa sa amin kung kanino man siya galit. 

SHE'S A FINANCIAL BURDEN. Last week, nahuli siya ni nanay/teacher niya na nagpapasulat sa classmate niya, binibigyan pa niya pera yawa. Kami na nga gumagawa assigment niya minsan kasi nagmamakaawa na nanay ko. Yesterday, pumunta si nanay sa school nila kasi since grade 1 (grade 3 na siya) laging may nawawalang gamit. Halos araw-araw kasi kaming bumibili ng lapis o ballpen niya. Minsan colors, gunting, at ruler. Sabi raw ng teacher, nahuli daw niyang pinipilahan ng classmates niya, namimigay daw ng pera (I assume pati gamit na). Her baon ranges from 50-150, depende sa kanyang s@lt!k (sorry for the word). Hindi pa kasama roon meryenda niya lunch at pag-uwi. Minsan hindi na kaya ng nanay ko kaya pinagbigyan niya minsan, may times na nahihighblood at nahihilo na lang siya. Daig pa niya college student na brother namin. Eh 5 minutes walk lang school niya, madalas laging hatid sundo. Kasama pa nanay pumasok, siya na nga nagpaligo, nagdamit, nagsuklay, etc. Pati pagtapon ng basura hindi niya magawa, ang dumi lagi ng ilalim ng sofa at higaan nila nanay. Kapag nagsosolo siya maligo sobrang sayang niya sa tubig at shampoo. Minsan nababasa na kusina na namin, akala mo may nagleak na pipe. 

Pag-uwi ko kanina from a trip, kalahati na lang yung 1 LITER shampoo na kakabili ko lang last week. Isang araw lang akong nawala. Last time I checked around 50 ml lang bawas nun kasi di kami masyado nagshashampoo sa bahay. Nagalit pa ako kasi I suspected my brother na binaon niya sa gala niya, pero hindi raw siya since may binili naman akong sarili niyang shampoo (I forgot sorry aken bro). Tnginnaaaa. Kaya kinabahan na ako.

I inspected my sister's bag, ayaw niyang ibigay. Nakipag-agawan pa talaga ako. I saw the brand new ruler broken, half na lang siya, and five bottles of my Victoria's Secret perfume which costs around 10k each. I received them as gifts from relatives and treasure them. My brother and I uses them since my parents don't like them. Pati yung pabango ng nanay ko, kung saan-saan niya iniispray. Hindi naman niya ginagamit sa sarili niya.

Madalas din namin siya mahuli ng brother ko na kumakalkal sa kwarto namin, di namin nalolock minsan o kaya nasa bahay lang naman kami. Coloring materials, wallet, pabango, damit, make-up (ginawa niyang pangkulay) madalas mawala. May sariling gamit naman siya pero kumukuha pa rin. Makasarili din siya sa pagkain. Di bale nang masira huwag lang mapunta sa iba (kahit kapamilya niya). O di kaya magpabili tapos hindi uubusin. Feeling ko hindi na ito kleptomania kundi GREED. Grabe. Sobrang sakit niya sa bulsa.

Hindi sa materialistic ako, very sentimental lang talaga sa mga gamit since galing sila sa importanteng tao at important occasions po. Hindi rin naman kami ganun kayaman para magwaldas siya ng pera. Our parents even had to loan for us to survive tapos ganito siya. I don't know what to do with her anymore. Nabibigay naman namin basic needs niya. Minsan pati wants if she behaved. 

I remember noong mga 3 years old pa siya, she would break all of my picture frames. Ipapakita pa niya sa akin tapos ibabagsak  niya mismo sa harapan ko. I even buy her pretty dresses when I'm out of town, but she don't seem to appreciate it kahit siya pumili noong nagvideocall kami nila nanay. One time I bought her an ukay jacket when I went to Baguio, I did not notice there was a broken sleeve loops kaya I bought her other clothes. I felt bad for her and I wanted her to have pretty clothes, only to end up disappointed because she only used them once and just dump them somewhere.

As a panganay I want to break down so bad. If my late grandma and parents didn't care for her, ibibigay ko na siya sa dswd or bahay ampunan. Kunti na lang masasampal ko na talaga siya hoping na magising siya sa katotohanan. Yung ibang bata hindi naman ganito di ko alam bakit siya ganyan.",https://www.reddit.com/r/OffMyChestPH/comments/1buy93r/i_think_i_hate_my_younger_sister/,t2_jao0ut8w0,2024-04-04 01:15:48,139,70
My ex bf who contacts me when he wants to fck ,"My ex bf contacts me everytime he wants to do it. I was with him for almost 4 years he was my 1st bf but I got tired of him always physically abusing me. Bruises were everywhere in my body. Namamaga talaga everytime he abuse me. I remember way back 2022 kamamatay lang ng grandmother ko and I am at the stage of grieving so yung attitude ko nun complicated I decided to go to his apartment for comfort and may konting misunderstanding lang samin then he just decided to hit me so hard because he said he was so tired of my attitude during that time sira yung bed frame niya then kinuha niya yung part nung nasira hinampas sakin. My body was so sore I could barely move I had to stay on his apartment for a couple of weeks to heal myself because I don't want his image to be ruined in my family.

Fast forward 2024

We already broke up because of other issue then now he always call me everytime he wants to do it cant stop myself from seeing him I also have my mistakes but he always tell me na he loves me and he is sorry for everything but ayaw niya na daw pero di niya daw ako kaya iletgo.. Do you really hurt someone you love? I am broken and confused.
",https://www.reddit.com/r/OffMyChestPH/comments/1b9r4hr/my_ex_bf_who_contacts_me_when_he_wants_to_fck/,t2_vqcdbucyo,2024-03-08 23:44:37,1,3
BINUBUGBOG SIMULA BATA,"TW: PHYSICAL ABUSE 

Hindi kami naguusap ng kapatid ko dahil nabasa ko kung ano anong sinasabi niya sakin. Hindi ko siya cinonfront basta di ko pinapansin. 

Pag kaharap tong tatay namin nagiging mabait, pero pag nakatalikod demonyo na. Nagwala ba naman kahapon at binato mga gamit pati electric fan nung waa pa tatay namin.

Lumabas ako ng bahay para bumili, pag balik ko binugbog na ko. Nakasigaw sya agad habang ako sinasabi kong kalmahan nya lang. Yung step mother ko habang binubugbog ako ng tatay ko eh tinatakoan bunganga ko. Ending nadamay sya sa inis ko at sinigawan ko siya, sabi niya sakin ""Kaya ka nabubugbog eh"". 

Wala na kong ibang mapupuntahan. Ang dami ko pang gustong sabihin pero lagi akong nauunderestimate. Tangina for context 2nd yr college na ko, F 20. Simula bata binubugbog ako.

Sakit ng katawan ko, puro pasa. Dugo dugo labi ko. Nadislocate pa panga ko. ",https://www.reddit.com/r/OffMyChestPH/comments/18fn12y/binubugbog_simula_bata/,t2_tki4pmxa,2023-12-11 13:15:48,2,3
