title,body,link,author,created,upvotes,num_comments
I was physically abused my boyfriend (now my ex),"I’m 23 F and was physically abused by my ex last Feb 13. It was really bad, I was in pain all over my body and I had severe pain on head and scalp because of the punching and hair pulling I received. I couldn’t sleep the night after it happened because even with soft pillows masakit pa din. I had spent my Valentine’s Day in the hospital to get checked. I went to my usual doctor but she refused to see me after knowing my situation. She refused because she doesn’t want to get involved if ever magsampa ako ng kaso sa ex ko. I told her I’m not planning to and I just wanted to get checked kasi masakit talaga buong katawan ko but she still refused to get me checked and instead referred me to a general surgeon. There, I was interviewed again by another secretary and was asked why I was referred to their clinic. I gave her the referral and told her I wanted to get checked because I was physically abused. After hearing that, she proceeded to ask questions personal questions as to why I was physically abused. And not only her, even the surgeon asked me personal stuff. Idk if it’s part of their job to ask but it was really uncomfortable for me. I remember crying in the cr right after the consultation. I feel so embarrassed, so ashamed of the situation I’m in. I feel like people are judging me for being physically abused. The way people are treating me felt like it was my fault that I got myself physically abused. I was asked to get a ct scan of my brain because of head trauma injury. I was using my insurance so i went to the hmo cashier with the doctor’s referral. While processing, the cashier asked loudly why I had to get a brain plain bec apparently it was expensive and they wouldn’t easily approve it. There was a line behind me and i was embarrassed to say it out loud so iasked if i could write it instead. I wrote what my doctor wrote in his diagnosis, head trauma injury due to physical abuse.  The cashier seemed confused and asked me, “what do you mean by physical abuse?” She then told me to write a full incident report, time date and what has happened to me. So, I wrote there in detail what happened to me so that she’ll process na my form and I could get a ct scan na. Is this really part of the protocol? Do the patient really have to do this? Because it was really uncomfortable for my part. I was physically in pain and it doesn’t help that they’re also stressing me out mentally, making me recall everything that happened just so it would be approved by my insurance. It’s so fucking stressful for the patient. Don’t get me wrong, I’m grateful man na i get to go to the hospital to get treated but i didnt expect it to be this stressful. I even chose to go to this hospital, my university’s hospital, because I thought it would be more efficient than going to a public hospital. If only I knew na I would be rejected by my doctor, will be bombarded by personal questions, judged for being physically abused, and then forced to recall what happened to me, then I would’ve just stayed home na lang even though sakit na kaayo akong lawas. I’m supposed to go back to the doctor today, but idk man, i dont feel like getting up and going back. I’m still in pain tho, masakit pa din igalaw ang katawon ko but agwantahon lang guro nako ni than go back. ",https://www.reddit.com/r/OffMyChestPH/comments/1asugn0/i_was_physically_abused_my_boyfriend_now_my_ex/,t2_uird8mdk,2024-02-17 13:35:13,45,41
why do Filipino famillies resort to physical abuse and humiliation whenever their child makes a mistake?,"I recently crashed my mom’s car around 1am cus I was going to another town to find something to eat. While it was raining hard I was driving casually with my highbeam turned on, suddenly I hit an “school-zone” signage pretty hard and it caused for the front of the car to be shattered. Regardless, I waited for my mom to get back from work so I can tell her ASAP. When she got back I told her directly that I recked her car and said all my apologies and told her I was willing to accept all consequences. She suddenly slapped me so hard that I fell to the floor. She probably bruised my whole body from smacking me with a broom stick for 1 hour straight and after that she had enough. While I was inside my room I overheard her talking to all of her friends and our relatives on how I am such a disappointment and basically degraded me to her friends.",https://www.reddit.com/r/OffMyChestPH/comments/17mlwmo/why_do_filipino_famillies_resort_to_physical/,t2_63lybacdt,2023-11-03 11:28:58,69,81
I actually dont know you anymore (PHYSICAL ABUSE!),"Hello guys, i am 22F dating a 23M, currently nauna ako grumaduate sakanya and working already and pagraduate palang siya this june i think. Nag start mag messed up yung relationship namin nung grumaduate ako. 
Lagi niyang sinasabe na sobrang selfish ko para unahin sarili ko dahil umuwi ang inay galing sa Japan for just 5days para lang sa baccalaureate mass at graduation day ko. Pinakilala ko siya samin that time, welcome na welcome siya noon at tuwang tuwa ang nanay ko dahil nga may pagka gwapo at natutuwa din ang nanay sa pagkekwento ng mga nangyayari saamin. 

Habang pauwi na ang inay noon, may biglaang yakag din ang fam ni boyfie, sa manila ocean park at gustong gusto niya ako makasama nun dahil nga nagtampo sakin dahil sobra akong naaging busy nung mga araw na yon. Sinabe ng nanay ko na maaga daw ang flight nya 9am palang at nasa airport na kami. Don nag start lahat. Nung nasa ocean park na kami, ako yung nahihiyang lumapit sa mgaa kamag anak niya parang feeling ko di ako belong at dahil nga first time ko na kasama pamilya niya, nahihiya ako. (Introverted po ako) at gusto niya sumusunod ako sa trip niya, naiinis na siya sakin kasi di ako sumasabay sa lakad nila dahil gusto ko ako nasa hulihan ng pamilya. Tapos nung mga time na yon nahalata na ng lahat na galit yung boyfriend ko sakin, at nahihiya na din ako lalo dahil sinabihan akong pabebe ng kanyang kapatid. Aaminin kong may pagkakamali din naman ako na gusto ko nasa hulihan ako dahil pakiramdam ko hindi naman ako ganun kaimportante sa lakad nila, at lumala pa yun nung paalis na at kakain sa vikings dahil sabi ko gusto ko na umuwi at ayoko na makaistorbo pero pinipilit ako ng pamilya niya na mag stay at kumain dahil sayang naman daw at graduation ko nga, makakain at makapag celebrate man lang daw. Pero ayoko na, dahil sobrang hiyang hiya na ako at feeling ko iiyak nalang ako kapag andon lang kami. Considering yung jowa ko na hindi na ako tinitignan at nagagalit na din saakin. Despite ng nangyari, sinamahan ako ng jowa ko sa moa sa sea side, akala ko magkakaayos kami non pero sinabihan niya lang ako 'magbreak na tayo ha tangina ang selfish mo'. Wala akong alam sa manila, dahil taga laguna kami pareho at never akong lumalakad doon, battery ko nun 30 percent nalang at mas pinili ko na umiyak sa seaside at contakin ang kaibigan ko kaysa makauwi. Nawala na din yung jowa ko sa paningin ko at girap na hirap ako makahinga nung mga oras na yon, pero binalikan niya ako after isang oras ata. Umuwi na kami. Sinabi ko lahat sa nanay ko mga nangyari at inamin din ng nanay ko na sinabe niya lang na maaga ang flight nya kasi nakikita niya akong masaya sa lalaking yon. Binalikan niya din ako nagmakaawa siya non ako namang si tanga, oo lang..

Fast forward nakahanap na ako ng trabaho, nakapag work na din ako at nagkanda leche leche din side ng fam niya. Yung ate niya na sinabihan akong pabebe, nag kautang utang at yung mga pinapadala sakanila ay sinarili lang non. Ramdam ko yung lungkot at galit ng boyfriend ko dahil patapos na siya sa pag aaral at wala man lang perang mailabas. Sinisi niya ako sa mga nangyare at sinabihan din ako ng kung ano ano, sa totoo lang dito ako nag start na ayoko na siyang replyan dahil hindi din biro sakin ang mga nangyayari sa work ko pero iniisip ko pa din na magbabago siya, iniisip ko pa din na magiging okay ang lahat at gusto ko pa din siyang maksama.

Ff ule, nung nakausap nya tatay niya need na niya mag OJT sa manila dahil aviation siya at iilan lang ang pwede nyang applyan at lahat ng yon ay nasa manila, madalas kaming nag aaway nung mga oras na yon dahil pa din sa hindi niya ako maintindihan kung gano ako nasstress sa work ko at gusto niya na palagi din syang lambingin dahil nga daw yung sitwasyon nila sa pera ay di biro. Sinabi ko sakanya noon na, maganda na buhay mo jan nakakakain ka ng dalawang beses sa isang araw dahil nung andito siya minsan ay di pa makakain dito sa laguna dahil nga lugmok na sila sa utang. At one time noon, nakita ko na naggpost yung palagi niiyang kinakainan sa lunch time nya na restobar sa pasay, may kasama siyang babae at halata mong may gusto siya don. Sobrang galit ko sakanya at hiningi ko din password ng mga acct nya nung oras na gusto niya din magbalikan kami. Nakita ko don na mukhang naglalandian na sila sa ig, at hinatian pa nila ng pamasahe para makauwi after non at tinatanong niya pa kung nakauwi na siya. Ang sakit hanggang ngayon inaalala ko pero wala akong magawa, gusto ko pa din siya. At feeling ko naguilty din siya dahil nakikipag ayos siya sakin non. Nalaman din ito ng magulang ko sa sobrang iyak ko nun dito samin, kinwento ko lahat na minumura niya din ako at mukhang ginagago na ako sa mga nangyayare. Pero mali din kasi approach sakin ng magulang ko kaya sobrang nagalit ako sakanila lalo ang lola ko, sinabi niya sakin straight up na ganto ""Pineperahan ka lang nyan, tigilan mo na yan ha"" sakit s pakiramdam kasi feeling ko sobrang pangit ko, na aabot sa point na peperahan lang ako ng tao. Pero iniisip ko hindi, hindi dahil noon naman ay kahit pamasahe never akong pinagbayad ng boyfriend ko. Siguro nga noon, kasi payat pa ako nun at nastress na ako nitong nagwwork na ko tumaba na ng sobra baka kaya nga ganon. 

Nung December 24, umuwi sya samin nag away pa din kami non dahil gusto ko ngang umuwi na siya at bakit kailangan niya pang itanong yon dahil natural gusto ko na siyanf kasama, ang tagal na naming di nagkita simula nung umalis siya dito. Halos 3months din. Sobrang inis ko non dahil binlock niya ako sa lahat gawa ng sinabihan ko siya na 'tatanong mo pa eh gusto ko ngang kasama ka' at di ko na siya makontak kahit saan, tapos biglang magtetext uuwi na daw siya. Pinaghawak nya ako ng gamit niya, sobrang galit ko non dahil nag ayos ako nun at hindi man lang din siya ngumiti nung mga oras na nagkita kami. Iniwan niya ako sa terminal non papunta sa bahay nila dahil nagalit ako, sinabe ko na di man lang nya ako kinausap the whole time tapos pinagbuhat pa ng gamit nya at di man lang nya ako tinabihan sa jeep habang bumabyahe kami. 

Pinuntahan ko sa bahay at sinundan dahil, ngayon na nga lang kami magkikita nagaway pa at iniisip ko baka di na kami magkita dahil pupunta siya sa mga kamag anak niya. Pinagbuksan nya ako ng pinto pero, galit din siya at gusto niyang lumayas na ako, sinasabe nya na ang pangit ng ugali ko at never ko siyang naintindihan sobrang selfish ko na tao. Binalibag nya yung bag na dala ko noon, nasira pa yung palamuti na nakasabit sa bag ko dahil sa pwersa nya tinapon niya sa labas yon ng bahay nila at nagmamadali akong kunin dahil pakiramdam ko sasarahn nya ako ng pinto at di ko na siya makakausap, nagalit din ako pagbalik ko sakanya at sinabeng 'wala kang karapatan ihagis bag ko sa kung saan pano kung may nabasag dito kaya mong palitan?'' tas sinabi nya saken na' eh ikaw? Andito ka pa din sinasabe ko na ngang umalis kana' sinigawan ko siya at minura, sa sobrang frustrated ko sinusuntok ko yung braso niya, nagalit din siya at sinampal niya ako ng dalawang beses. Umiyak nalang ako at lumuhod sakanya, sabi ko 'tama na ayoko na ng away please' umalis siya at pumunta sa kwarto niya nilock niya ang pinto. Pero di pa din ako naawat, gusto ko pa din magbati kami, nagkabati kami non pero ang bigat sa pakiramdam.

Ngayon, sabado ng holy week di ko alam pero mukhang malabo na magkaayos kami. Pumunta ako nung tuesday nag overnight hanggang wednesday ng hapon, dahil nga sobrang miss ko na din siya. Kaso nakaligpit na din lahat ng gamit sakanila dahil lilipat na sila ng apartment, at nakikita nyang naiinip lang ako sa bahay nila dahil wala kaming ginagawa, sabi ko 6pm ako uuwi pero napaaga dahil sabe nya 5 nalang daw kasi nga ramdam niya ang inip ko, sinabihan nya ako na pumunta pa ng sabado dahil gusto nya ako makita one last time bago siya umuwi, di din ako umoo kasi feeling ko mapapacheck up yung aso ko dahil nagluluga ang tenga at di na nakakatulog sa gabi. Paguwi ko, sinabihan ako ng uncle ko na magsama kaming magpacheck up ng aso inabot ng 6k yung bill ko at ang cut off ko per kinsenas ay 8k lang, sobrang sakit sa bulsa nung mga oras na yon dahil magbbday na din ako at nailabas ko din ang frustration ko sa bf ko nung time na yon. Akala ko maiintindihan niya yung sinabe ko na 350 nalang nasa wallet ko at di pa nag sstart ang work ko ay baka wala akong budget na, tapos nung biyernes santo sinasabi nya na uuwi daw siya ng maaga kinabukasan at sabi ko ay okay po love, tas tinanong nya ko kung masaya daw ako sabi ko okay lang why? At sabi nya naman ay 'cause me useless' tas naiisip ko na kaya siya naggaganon dahil nga gusto niya ako makita ule kaya nagpapaka dramatic ang atake. Brinush off ko siya at sinabe ko na 'walang.mapapala yang kakaganyan mo isipin mo byernes santo at wala naman akong sinabeng di ako masaya eh sabi ko okay lang di masaya di malungkot kasi nga wala namang ganap ngayon eh byernes santo malamang' nagalit siya binlock niya ako sa lahat tangina ito nanaman. Sobrang inis ko sakanya kung ano ano den pinagsasabe ko sa text non para lang makuha atensyon niya na gusto ko dwn intindihin nya ko. Pero kanina pinuntahan ko siya sa kanila kahit walang wala na ako. Napunta sa pisikalan at ang masaklap don tinatawanan nya ako dahil mukha lang daw akong baboy na galit. Sobrang sakit, kinalmot ko siya non at sinakal ko din sa leeg sa sobrang inis ko. Siya din nag start na magsisigaw gustong gusto niya akong saktan kitang kita ko sa mata niya, at isinisigaw nya dahil sinabi nya saken na di na daw siya magiging ganong tao na nanakit. Pero minomock nya ako non naka suntok na yung fist niya sabay gagawing palakpak at tatawanan ako dahil umiilag ako. Nung time na sinabihan nya na ako na para akong baboy na galit don siya dahil binabaon ko yung kuko ko habang sinasakal ko siya. Papunta na siya sa suntok at sumigaw ako non, inawat kami ng parents nya at tinatawanan niya ako dahil umiilag ako. Sinabe nya non na 'di kita sinasaktan diyan ikaw ang nananakit tignan mo oh mga pagkakalmot nyan tangina, umuwi ka na sinasabe ko sayo ha' ewan ko.

 Hanggang ngayon ang sakit isipin kasi alam mong di na talaga maayos lahat at kahit maayos man, alam kong di na ako safe sa mga mangyayare lalo magpapatuloy pa. Di ko na kilala yung taong minahal ko ng todo, di ko din alam kung infatuated lang ba ako dahil first time ko naramdaman mga bagay bagay sakanya kaya hanggang ngayon masakit sa loob ko. Totoo ba na pag nakita mo yung ganyang ugali ng tao ay ganyan talaga sila at di na magbabago? Kung kaya niyo naman ako bigyan ng facts sa kung bakit ganito parang feeling ko may mali pa din sakin na gusto ko p din siya kahit may abuse na nangyayari. Hindi madali yung mga nangyaare ngyon dahil kahit mgulang ko pakiramdam ko di ko kakampi sa mga bagay bagay. Nahihirapan na ako.
",https://www.reddit.com/r/OffMyChestPH/comments/1brl965/i_actually_dont_know_you_anymore_physical_abuse/,t2_6f4wx8zsm,2024-03-31 00:01:05,0,2
Tired of being Physically Abused ,"Growing up, not once in my childhood days till my teenager life na nakaramdam ng Gentleness (Aside sa care ng Late Lola ko sa side ng Papa ko).

Ayun, based sa Title, buong buhay ko I have been physically abused especially ng Trauma provider na Father ko. Normally yung mga bata makukulit talaga and you needed a lot of patience to deal with them. Pero ako, even minor mistakes hampas agad, hahambalusin ng kung ano mahawakan mapa bakal, kahoy, kung ano man yan, minsan iuuntog ka na lang sa pader (Take note, I was 9 years old back then).

Kasi nga ganun daw sila pinalaki, so dapat kami din 'di daw dapat namin maranasan mga pinagdaanan nila'. Well thank you for giving me all the pain I felt growing up, na minsan gusto ko na lang nun sabihin kay lord na kunin na ako.

But still, buti di naranasan ng bunso namin yung Physical Abuse growing up, kasi pinaranas mo naman masira Family natin. Congrats, you've earned your place in Hell.",https://www.reddit.com/r/OffMyChestPH/comments/1bs3fd0/tired_of_being_physically_abused/,t2_x4yg79yyo,2024-03-31 14:07:35,2,1
"The girl I like has a girlfriend, and her girlfriend was physically abusing her.","The girl I like has a girlfriend, and her girlfriend was physically abusing her. She's also my friend from school, and I feel inlove with her. And yes I'm les. Nung 2021 kasi, nagkaroon sya ng gf na kaklase rin namin, it was fine with me, I'm actually happy for them. Not until magkwento sakin yung friend ko na gusto ko pa rin until now na sinasaktan daw sya ng gf nya physically kapag nagagalit yung gf nya, and nabanggit nya rin na yung gf nya ay pinagtatawanan sya sa harap ng mga kaibigan ng gf nya pag umiiyak sya. And habang kinukwento nya sakin to sobrang tumatayo yung balahibo ko to the point na hindi ko na alam kung anong sasabihin ko, I can't say naman na hiwalayan nya na kasi baka isipin nyang sinabi ko yon for my benefit, and first time ko lang din makaencounter ng ganong situation, kaya super hindi ko alam kung anong pwede kong sabihin para matulungan ko sya or dapat bang tulungan ko sya since friend ko naman sya eh. Hindi ko rin masabing hiwalayan nya kasi wala naman ako sa posisyon para sabihin sakanya yon and I know kung gano nya kamahal gf nya kaya tinitiis nya lahat ng bugbog sakanya. Ayaw nya ring may ibang makaalam sa family nilang dalawa. Any tips kung anong pwedeng sabihin or gawin or dapat ba wag na akong makielam since relationship naman nilang dalawa yon? 

to add lang din, nagkaroon pala yung gf nya ng bf sa work na pamilyadong tao, and ayaw nya ipakita sa friend ko yung cp nya kasi nga tinatago nya pero sya sa friend ko, kontrolado nya lahat ng social media nya na kahit mga kaklase nya for acad purposes ay pinagbabawalan nya makipag usap sa friend ko. Kahit ako hindi ko na rin sya nakakausap, nakwento nya lang sakin nung time na nanghiram sya ng book for acads din.",https://www.reddit.com/r/OffMyChestPH/comments/10dhbeu/the_girl_i_like_has_a_girlfriend_and_her/,t2_vh4zj41l,2023-01-16 23:26:14,6,3
Na survive ko ang physical at emotional abuse today,"3 sampal at katakot takot na threats dahil sa walang humpay na pag iyak ko, sampalin ka ba naman eh. 

Para akong mababaliw kanina, hinihila, sinisiko, pinipilit mag salita, tinutulak. Para akong pinalong aso sa pag iyak  na naka suksok sa sulok tas pag hinahawakan lalong lumalakas ang iyak dahil nakakatakot na bawat hawak sayo may hagupit na kapalit. 

Hindi ko akalain na magagawa sakin ng SO (now ex) ko to. First time kong masaktan sa relationship at trauma is real. Dahil lang sa di ko masunod ang gusto nya kahit at risk ang health ko. 

Tinapos ko na at sana huling encounter na namin sa isa't Isa. Naiiyak ako pag naiisip ko yung ginawa nya. Mahal nya daw ako pero bakit ganun? Pag mamahal pa ba yun kung ganoon? Relieved lang ako dahil naka survive ako.",https://www.reddit.com/r/OffMyChestPH/comments/11onrq9/na_survive_ko_ang_physical_at_emotional_abuse/,t2_vr5ufi9p,2023-03-12 00:04:29,9,0
Namatay na yung tita ko who physically & emotionally abused me & my sister nung highschool kami pero wala akong naramdaman nung nawala sya.,"Napatawad ko na sya. Nakahingi pa nga sya ng tawad 2 months bago sya namatay. Sabi ko, wala na yun tita. Kalimutan mo na yun.  Totoong napatawad ko na sya pero traumatized pa rin ako pag may mga bagay na nakakapang trigger sa akin ng mga bad memories na iyon.

Unexpected ang death nya. Nasa Canada na ko ngayon. Nung nabalitaan ko yon, iyak ng iyak mama ko. Pero ako, wala. Blanko lang. Of course hindi ako masaya sa nangyari pero hindi rin naman ako nalungkot at naapektuhan.

I feel bad for feeling this way.

7 years din kaming nasa puder nya. May mga good memories naman pero bilang lang. Pag lang naka mood sya pag may pera sya that time. Pag wala, ayun, Princess Sarah at Ms. Minchin na ang atake.

Hindi ko masabi to sa mama ko kasi alam kong masasaktan sya. Kapatid nya yun at mahal nya. Kahit may nagawang ganun ang tita ko, sobrang buti ng mama ko at pinatawad nya.

Sabi ng mama kahit ano raw nagawang masama sa amin, wag na wag daw kaming hihiling ng ikakasama ng iba.

Gusto ko lang din sabihin na proud ako na sya ang mama ko. <3",https://www.reddit.com/r/OffMyChestPH/comments/19987qx/namatay_na_yung_tita_ko_who_physically/,t2_knsfqyyap,2024-01-18 05:24:41,283,0
Sudden thought of leaving my bf of 5 years,"OFF MY CHEST, bahala na kayo ano sasabihin nyo sakin o i wish nyo ko mauntog. 

We met 201- , senior high school. Best friends kami until 201-, nung nagka inlaban haha. (We were teens that time, 20’s na kami ngayon: M/F couple) Until now going strong. If you will know our story, ang solid ng foundation ng relasyon namin, legal on both sides up to the very extended families (ex. 2nd cousins and farther), have a close circle of friends, and super compatible ng ugali namin. 

But there’s one thing i cannot take, he’s very emotionally/verbally abusive. He call me names/below the belt insults, name it. Pag galit sya o inis sya sakin. Actually nag lessen na ngayong tumatanda na kami, dati? I call s*icide hotline almost every night crying dahil sa mga words nya. Umabot na din kami sa physical abuse years ago. He’s hurting me every time galit sya. 

Now, wala nang physical abuse, nag lessen na ang verbal abuse. But nung nag away kami and pinag mumura nanaman ako. Di kami nag usap for a while, nag chat sya and all caps mura ang chat tas wala na ulit. All of a sudden I wanted to leave him. There’s something holding me back, baka impulsive move lang. pero grabe yung urge ko ngayon. 

Hindi ko na alam. If tatanungin nyo ko kung mahal ko sya, oo. Pero grabe gusto ko na syang iwan. ",https://www.reddit.com/r/OffMyChestPH/comments/1c0k74p/sudden_thought_of_leaving_my_bf_of_5_years/,t2_onvht66od,2024-04-10 20:19:45,14,22
Hindi ko aalagaan parents ko pag tumanda sila,"Eto na naman, nasigawan nanaman. Hindi sila physically abusive pero grabe yung mga salita, mapanakit. Lagi na lang ako yung may kasalanan. Lagi na lang ako yung mali. Putangina talaga sana pinalaglag nyo na lang ako",https://www.reddit.com/r/OffMyChestPH/comments/1b3oax1/hindi_ko_aalagaan_parents_ko_pag_tumanda_sila/,t2_cwrf2ame,2024-03-01 15:15:18,103,63
My Mom failed us.💔,"It’s breaks my heart while my younger brother told me this “ Ate it’s either one of us will die, if ako man u take care of yourself ok? “ Papalabasin ng mom ko yung kuya mamaya galing sa kulungan. 
Pina arrest namin kahapon kasi sinaktan niya younger brother. I was physically abuse by my brother since high school pa ako. Hindi ko na talaga natiis. Pero sobrang love siya ng mama ko na kahit adik siya uubosin lahat ng pera niya gooo parin siya ng goo. My mom failed us since then pa pero sanay na ako na tanggap ko na pero grabe ang sakit parin talaga.",https://www.reddit.com/r/OffMyChestPH/comments/12942ex/my_mom_failed_us/,t2_l6rt645x,2023-04-02 08:21:43,670,118
My boyfriend cheated on me,"Grabe ano totoo pala talaga yung mga nababasa ko sa tiktoks na super green flag nung guy tapos biglang magchecheat. Yung ex-boyfriend ko lagi akong pinupuntahan kahit wala na siyang money. Legal kami sa family niya and may anak pa kami na cat na kamamatay lang, lagi akong pinag-sstay sa house nila, and every time na may away kami pinupuntahan niya ako agad. Recently lang parang ayaw na niya ayusin mga away namin and I found out na he’s cheating behind my back with his workmate. Nabasa ko sa instagram and deleted convos nila nung girl. I confronted him about it and he physically abused me. Now, I am planning to take actions legally and he’a threatening me na he will k*ll himself. 


",https://www.reddit.com/r/OffMyChestPH/comments/1bwfj42/my_boyfriend_cheated_on_me/,t2_q3uf8t0i,2024-04-05 19:21:26,259,76
THREW OUT MY ABUSIVE EX,"Left my physically abusive, lying, cheating, manipulating ex on an island. Left him with nothing but dog food (because he has 0 money, I financed him for a year). 

I have zero remorse, I feel happy.",https://www.reddit.com/r/OffMyChestPH/comments/vrw5sf/threw_out_my_abusive_ex/,t2_n71vkca4,2022-07-05 19:59:13,334,73
Viral Video of a Woman Hitting her Partner,"Anyone else here saw that viral video yung kararating palang nung guy sa house nila and sinalubong siya ng sapak at sipa ng partner niya?? It really doesn't sit right with me the way some people made it as joke and laughing at that video 😭 that was physical abuse everyone. Just because babae yung nananakit we're taking it so lightly. :((( Tapos i saw some of my fb friends tagging their girlfriends/wives to that video and one of those tagged wives commented back ""deserve mo yan"" tapos naka haha react yung girl. :((( Yeah maybe we don't know anything about that but to hurt your partner like that?? 

Idk it's been bothering me lang..",https://www.reddit.com/r/OffMyChestPH/comments/187aydy/viral_video_of_a_woman_hitting_her_partner/,t2_t2j0p923,2023-11-30 13:33:38,128,42
