title,body,link,author,created,upvotes
"I don't care if you're a girl, unsolicited pics are unsolicited pics.","So like many of the people on this subreddit, I take nudes. 

I posted mine on r/phgonewild last week, nothing harmful. Some people messaged me about it, some wanting to hookup, the standard fare. Today though, something unusual happened.

I got a message request from a girl. In that message contained a compliment for my picture, but also something else.... A pussy pic. 

Usually, when a guy receives that, it feels titillating. However, this was my first time to receive one without asking for it. That felt so.... annoying. Yes, I'm a horny fucker. I like hooking up. I do ask for pics from women (consensually). If you send me something that I didn't ask for though? Ugh.

I don't care if I'm horny, if I didn't ask for it, I'm not asking for it. Do NOT send someone anything without consent, male, female, NB, or anything else.",https://www.reddit.com/r/alasjuicy/comments/1086ojx/i_dont_care_if_youre_a_girl_unsolicited_pics_are/,t2_uzp1eor9,2023-01-10 18:35:34,127
Unsolicited Dick Pics Enjoyer,"Bago lang ako naging active dito sa AJ. Mostly kasi sa CasualPH at sa AdultingPH lang ako nakatambay.

Pero nung nagcomment ako sa isang post dito about having my DMs open for dick pics... there are guys na nag-dm sa akin and feeling ko may na-unlock ako sa sarili ko tonight.

Sobra akong nahorny. Haha!

Ang sarap sa feeling na binabastos ako with unsolicited dick pics. 🥵

Feeling ko this is my alter ego kasi parang ang weird pakinggan na open ka sa unsolicited dick pics 'di ba? Hahaha.

Pero ayun, if may gustong mag-send... 'wag na magpaalam. Mas nahohorny ako kapag walang consent. Oops!

EDIT: Can't receive messages and accept message requests. Maybe because of my negative karma? Hahaha! Welp. 🤭",https://www.reddit.com/r/alasjuicy/comments/1alc1b8/unsolicited_dick_pics_enjoyer/,t2_9x1nt0ze2,2024-02-08 03:58:45,70
UNSOLICITED DICK PIC,"Hello men of aj!

Eto sakin lang ah. Para sakin lang. Point of view ko. Opinion ko. 

Hindi porke sex pinag uusapan nyo at naghuhubadan na kayo sa chat eh entitled na kayo mag send ng tite. And hindi porke ang previous post ng OP ay naghahanap ng fubu, ay gugulantangin nyo ng mga tite nyo.

Utang na loob. GAANO BA KAHIRAP HUMINGI NG CONSENT?! Tapos ibabato samin ""binigyan naman kita ng heads up"" PUMAYAG BA????

Ako kasi ayoko ng sinesendan ng tite talaga. Nababastos ako. Feeling ko minamaliit ako. Para sakin ah. Yun ung feeling ko. Kung iyayabang mo sakin yan, sa personal mo ipakita. O i-describe mo.

Tandaan, ang utak wala sa bayag. Nasa ulo. Paki gamit ng maayos.",https://www.reddit.com/r/alasjuicy/comments/1851749/unsolicited_dick_pic/,t2_q6lir5af,2023-11-27 19:50:18,84
Anong meron sa unsolicited pics?,"Hello there! So curious lang ako sa sagot niyo as a person who sent pics and a person who received pics specially the unsolicited dck pics. 

What do you usually do with those pics na bigla bigla nalang sinesend sa inyo? Like anong reaction niyo when you received that?

Why do you guys send unsolicited dck pics out of nowhere, like anong reason niyo bat kayo bigla biglang nagsesend ng ganun? And anong gusto niyo reaction ng mga girls pag nakakareceive sila ng mga sinesend niyo?


Kasi for me personally I get speechless and di makapag type, minsan naman irereply ko ""ohhh"" ganun lang kasi pag ""HAHAHA"" parang nakakaoffend naman sa side ng mga boys.",https://www.reddit.com/r/alasjuicy/comments/124sytg/anong_meron_sa_unsolicited_pics/,t2_tbimt3mv,2023-03-28 23:40:43,10
unsolicited poging dck pics,"good afternoon aj peeps! your 20 y/o girl is back. a week ago, i was scrolling through this app and i made a decision na iopen yung mga message requests. I opened some of it esp. mga recent messages before pero there are messages left pa na stucked na from months. I didn't expect to receive lots of unsolicited d pics haha. Im not really sure if i'll call it unsolicited kasi i loved to receive d pics ever since this pandemic happened and masturbated over it. At some point, naging coping mechanism ko 'yon, as well as maging horny if stress, watch guys thru call and such horny things. 

all i can say to these d pics ay mayroon talagang poging tite haha. Dont get me wrong ah  HAHAHAHA. Pogi etits for me is right size, girth and color. Yung by looking at it makes me really horny na haha. Additionally, ang sasarap niyo hahaha. mahapdi kayo sa ekup pag nagkataon HAHAHAHA nginig malala talaga. ayon lang thanks!! 

kung pogi ka este yung etits mo, patingin if true charot HAHAHA. Stay safe y'all and ingat always. be malibog with limitations hihi mwa.",https://www.reddit.com/r/alasjuicy/comments/15lcq1x/unsolicited_poging_dck_pics/,t2_t3ml38tb,2023-08-08 17:09:15,46
Whatchu think of unsolicited dick pics?,"Is it just me or receiving unsolicited dick pics definitely ruins the mood in the midst of sexting? Once or twice is enough to spice things up. More than that is very meh. 

From some guys’ perspective though, they don’t mind receiving hundreds of unsolicited noods from women since they’re known as ‘visual’ creatures. But why is it the other way around for some women? 

How do you explain to your partner that it ruins your ‘mood’ without ruining his high sexual drive?",https://www.reddit.com/r/alasjuicy/comments/196doj4/whatchu_think_of_unsolicited_dick_pics/,t2_6716ujqc,2024-01-14 19:15:29,9
‘Di ko talaga gets ‘yung pagsesend ng unsolicited nude pics. Kayo ba?,"As the title says, ‘di ko gets ‘yung pagsesend ng unsolicited nude (dick) pics. Like do you greet someone ba outside by waving your dick or showing your pussy right away? Hahahahaha.

People fail to realize that the tool you have is not enough to impress someone lalo na performance over matter kasi ang labanan na ngayon, lapagan mo ng CV ganon hahahaha jk.

For people na nagsesend right away ng nude pics, bakit? I’m really curious why do you think it’s a good way to get the attention of somebody.",https://www.reddit.com/r/alasjuicy/comments/16rh1yf/di_ko_talaga_gets_yung_pagsesend_ng_unsolicited/,t2_pnxy1sh0,2023-09-25 11:18:15,8
To guys who love sending unsolicited dick pics,"This doesn't apply to all guys, I'm not generalizing. Just to some. Kapag natamaan ilag nalang.   
This happened to me a lot and most of my girl friends and as we discuss it, bakit nga ba? 

&#x200B;

Bakit ba gigil na gigil yung ibang mga lalaki na mag send ng dick pics? I mean, start pa lang ng conversation mag tatanong agad *""Gusto mo makita titi ko""* or yung iba, hindi pa nga nag hi or hello, boom. Dick pic agad. May kasama pang tanong, *""malaki ba?*"".  


Coming from a female's perspective, ang tanong ko lang, ano bang expect niyo na reaction namin? 

*""Ang laki naman, ang sarap""*   
*""Wow""*  
*""Thank you, kailangang kailangan ko yan ngayon, nakaka inspire naman""*  


If those words are what you expected, madi-disappoint lang kayo.   


I understand naman na may girls talaga na gusto makipag exchange ng nudes, pero yung out of nowhere mag tatanong ng ganun or magsesend ng dick pic. I don't know what you guys expect girls to react. Tapos kapag hindi pinansin, or iniba ang topic, kala mo mga pa-sad boy.   


I'm just really sick of guys na proud na proud sa titi nila eh hindi naman lahat ng girls attracted sa itsura nun in the first place, paano pa kaya sa titi ng strangers na hindi naman namin kilala.  One minute the conversation was just about asking how your day was, the next, may pa surprise na. Yung iba pang dick pics, susme, OA sa pag ka zoom in.   


For ego boost? Para ba maka pang akit? Magyaya ng sex? 

Eh sa totoo lang nakaka turn off kaya yun, unless girls na mismo ang mag ask, go, pero kung SFW ang usap, or start pa lang ng convo magse-send agad tapos ang caption *""Gusto mo? Malaki to""*.  

We can just block people like that, I know. Pero nakaka sawa lang paulit ulit na hindi magets ng ibang guys na most girls don't like unsolicited dick pics. Some don't even want dick pics at all.   


Kung nakikita lang nila yung facial reaction naming mga girls pag nakakakita ng unwanted dick pics baka yung ego nila to the floor na.   


Anyway yun lang. I know girls send unsolicited nudes too but my point is guys because this is coming from my experiences and point of view. 

To those guys: 

Ask before you send your nudes. If it's okay, go. If not, don't push it.   
In the end, hindi yan maa-appreciate kapag pinilit. Baka automatic block or worse, baka malait ka pa in your face. Tapos topic ka na sa GC ng barkada.",https://www.reddit.com/r/alasjuicy/comments/ygwylu/to_guys_who_love_sending_unsolicited_dick_pics/,t2_tsuqumra,2022-10-30 06:30:29,39
Goodbye doktora 2.0,"Hello. Since marami akong nakuhang message regarding to what exactly happened with u/drromanthicc and why she deleted her account. Here are some of the reasons:

1. Since she’s bi, “girls” are sending her nudes, some unsolicited and some are not, which is honestly very welcome naman talaga sa kanya. However, there are multiple instances na yung mga “girls” pala na yun are guys pretending to be a girl. Kunwari nagsesend ng nudes nila to share or to rate yun pala they are just trying to convince dra to send one back.

2. Guys pretending to be girls na nakikipagchat or kinakaibihan siya. Tapos magsesend ng selfie kunwari nila sabay hirit na “sis, send ka din ng face pic mo”.

3. Unsolicited dick pics na napakarami. 

4. Maraming kupal and bastos na lalaki kapag di napagbibigyan or pinapansin. 

5. Random people trying to doxx her. Scary to think that people can almost identify your real identity just based on description.  Some are even blackmailing her into sending them nudes kung hindi ikakalat nila sa mga kakilala. 

Ingat po tayong lahat lalo na sa mga babae dito. I shared this para din po maging aware yung iba sa iba’t ibang modus na ginagawa ng mga reddit user.",https://www.reddit.com/r/alasjuicy/comments/1aphf1m/goodbye_doktora_20/,t2_tgpwmt45c,2024-02-13 09:43:44,95
"This is Alasjuicy, not PHR4R.","May rule change na, pinagsabihan na mga tao in the comments, and even the name says AlasJuicy.

Pero bakit ganun? A lot of people still treat this as r/PHR4R? This is a place where you share scintillating stories and ask for good advice about sex. This is NOT a hub where going to find your next sexual conquest is key. 

Yes, you may converse with people off here, and you may strike conversations up. Sex can happen if you're lucky,  but if that's the first thing on your mind when striking up a convo, please reconsider your choices. 

Also, please stop sending unsolicited pics to women, guys.",https://www.reddit.com/r/alasjuicy/comments/zwxoti/this_is_alasjuicy_not_phr4r/,t2_uzp1eor9,2022-12-28 10:24:57,159
P.S.A,"STOP FUCKING SENDING UNSOLICITED DICK PICS. 

Incase some of you havent noticed,  SOME people go here JUST to post and share experiences.

READ THE FUCKING ROOM HOLY SHIT",https://www.reddit.com/r/alasjuicy/comments/17ligbg/psa/,t2_3vrars5zq,2023-11-02 02:15:00,19
I love getting social media attention from guys,"Yes, tama pagkakabasa ninyo sa title. I love getting male attention and validation.

So i have this Tiktok account where i post thirst trap for fun when i am feeling myself. I like to film myself while wearing some seductice/risque clothing and somehow i enjoy it especially kapag nakaka receive ako ng feedback from guys. Yung mga comments na sinasabi nila kung gaano daw kaganda yung katawan ko especially my ass and thighs lol, hanggang sa umabot nga ng 10k followers yung tiktok account ko from posting thirst traps.

These past weeks I've been getting a lot of messages from my social media accounts na naka link sa tiktok ko especially sa IG and most of them are really dirty and perverted messages, unsolicited dick pics and also some couple of indecent proposals from them.

I like this setup yung tipong hanggang pantasya lang sila sa akin :P gusto ko man sila i-entertain lahat pero hindi ko talaga magawa kasi sobrang daming messages talaga ang narereceive ko araw araw. Siguro pag umabot ng 100k followers yung tiktok account ko baka mag drop nalang ako sa school at gumawa nalang ng ONLYFANS account HAHAHAHHAHA JK.",https://www.reddit.com/r/alasjuicy/comments/11se41j/i_love_getting_social_media_attention_from_guys/,t2_w3uc20nw,2023-03-16 08:11:11,173
no means no,"When I made this new Reddit account, I wondered how long it would take for someone to send me an unsolicited dick pic. Five days, people. I did not even express any need for sex during the last five days.

I clearly said no, yet this guy flooded my chatbox with his junk asking for a dickrate. I kindly (and later on, bluntly) asked him to stop and find someone else who is interested, while educating him to ask consent first (I don't want to block and report him right away — I want to try educating him first kasi baka may ibang girls pa siyang maharass after me). Idk if his brain crawled its way down to his dick because he clearly ignored me and kept on showing his post-deed dick.

Showing off your thing will not make me horny. Actually, doing it without my permission is a big turn off kahit pa grabe ang pent-up lust ko or kahit ideal junk pa pinapakita mo. Yes, I'm openminded and my libido is beyond average, pero I'm not that desperate to entertain some random guy just because I've seen his dick. There's a reason why I've been enduring this unbearable dry spell for three years and only had one partner before that. I am not interested in casual hookups or online R18+ landian. Nandito ako sa Reddit para tumambay, magbasa, magkwento at makipag-usap kapag feel ko — not to find someone to hook up with. And I'm sure there are girls out there who are just like me.

Many girls have already complained about this issue so many times. Yet, there are still some guys who can't comprehend a simple no. Why don't some people get it? Sending unsolicited dick pic is not a shortcut to someone else's pants. It's just plain harassment and disrespect especially when the other party directly said no.

CONSENT IS IMPORTANT. NO MEANS NO. Openly talking about sexual stuff is definitely not a sexual innuendo or invitation.

Wag niyo ipagpilitan sarili niyo sa taong ayaw sa inyo. Hindi niyo ikakagwapo yan.",https://www.reddit.com/r/alasjuicy/comments/vtwu1w/no_means_no/,t2_pivwm4hi,2022-07-08 08:00:34,206
Please pasintabi at common decency naman,"If unsolicited ang dick pic, wag niyo nang isend. May mga iba na may trigger at trauma dun. May mga iba specific na ngang nakalagay sa post, sinusuway pa rin. Di lang po ito sa NSFW na bagay, be mindful at aware naman po tayo sa mga post ng iba at respetuhin natin iyon huhu. Nasuka ako nang de oras nung may nagsend parang bumalik si trauma. Yun lang, if ever ask consent na lang po. Thank you.",https://www.reddit.com/r/alasjuicy/comments/16gt6xz/please_pasintabi_at_common_decency_naman/,t2_oyc4oe1p,2023-09-12 22:42:14,26
"Like Mother, Like Daughter","Hii Guys! Quick Story time lang hahaha medj  matagal na to and want ko lang ikwento here. So dati kasi ako lang may cellphone dito sa amin kasi mahal pa naman cellphone dati. Dahil ako lang may cellphone noon minsan nakikionline si mama sa akin kasi magbabasa siya ng mga messages niya sa facebook, nakakausap niya mga classmates niya nung high school and relatives namin sa province. So ito nga, diba sa messenger may message request don. Binuksan ko out of curiosity ang message requests niya kasi may mga messages and nagulat ako sa nakita kong mga messages sa kanya. Sa pagkakatanda ko, hindi niya pa naoopen mga yon kasi di siya techy para kalukutin ang mga messages plus nakabold pa ang letters so meaning unread pa siya at ako una makakakita. Upon opening the conversations, napansin ko parang mga afam halos lahat ng name ng nagmemessage sa kanya. When I opened each conversations bumungad sa akin ang mga Unsolicited Dick Pics nila which was sent to my mom. Ang lalaki pala talaga ng ari ng nga afam no? hahaha. Pero after non dinelete ko mga messages para di na niya makita.  

So sa mga di ko inaasahang pagkakataon, ako naman ngayon nakakatanggap ng Unsolicited Dick Pics sa messenger, ig, twitter, and here sa reddit. Wala naman nagiging problem sakin kasi siguro ginugusto ko ren na manyakin ako like sendan ng ganon and stuffs at some point kasi nahohorny and entertained ako sa ginawa nila which was namimiss ko sa ex bf ko yung ganon mga bagay.",https://www.reddit.com/r/alasjuicy/comments/135dpyr/like_mother_like_daughter/,t2_t3ml38tb,2023-05-02 14:57:35,40
i love showing pics of my dick but not without consent,"As the caption suggests, I love showing my cock to people who genuinely want to see it. I post sometimes on various dick subreddits but majority of the times that results in unwanted traffic and occasional shaming, which believe me nobody likes. So I am formally asking here if anybody wants to see my cock?? I am not thrusting you guys with unsolicited dick pics, I am asking if anyone's interested to or are intrigued by this post, then do DM me.. I am straight so I do prefer women but guys are welcome too if they just wanna see dick and nothing else.. Thanks for reading my post and if you get offended or irritated by it then I genuinely apologize. It's just people always complain about getting unsolicited dick pics so I wanna do it right..",https://www.reddit.com/r/alasjuicy/comments/zxv6r7/i_love_showing_pics_of_my_dick_but_not_without/,t2_cp6s2jo0,2022-12-29 12:06:23,10
"caught by my sis, last part","hello, everyone! i finally got confronted by my sis but it wasn't like how i expected it to be 🥹 HAAHAHAHA she jokingly sobbed because she was traumatized daw 😭 di niya raw matanggap na i've turned into this version of me because we were raised in a very conservative household. tawang tawa ako sa reaction niya, i should have taken a vid but i forgot!! kaya daw pala lagi ko kinoclose ang windows when i'm alone 😔 she even highlighted na bakit daw may curved tt siyang nakita 😭😭😭 we're very close so the convo was light and funny, may dramatic sobbing pa siya while ranting to me ashjahahahsj inubo ako sa kakatawa but i'm thankful that it went well 🤞🏻


i forgot to add!! she said that why am i doing it for free, ang dami raw alter acc sa twtr pero yung sa'kin libre lang 😭 (sabi q na e, may talent talaga aq sa thirst trapping ehem) 

ps. i just realized that the last phrase i typed might be mistaken as i'm advertising. hindi po aq magsesell ahdhajahagga naur naur naur!!!! at pls wth, don't send unsolicited dck pics 😠 ",https://www.reddit.com/r/alasjuicy/comments/1ayy6ln/caught_by_my_sis_last_part/,t2_s065c49ch,2024-02-25 00:11:08,35
LET'S EXCHANGE PICS??,"So many dudes here would ask you to send your photo tas pag hindi ka trip they will just block you or send you a picture of themselves wearing a facemask kahit malinaw naman sa usapan na you will exchange pictures. AFAIK exchanging pics for hook ups means you'll show your face kasi nga hook up lang yun e and you want to make sure na you vibe each other. I don't know if I'm overreacting but it's so frustrating everytime it happens. Lol anyway happy dilig to everyone!!

EDIT - PLEASE STOP SENDING ME YOUR PHOTOS AND UNSOLICITED DICK PIC MAY NAHANAP NA AKO",https://www.reddit.com/r/alasjuicy/comments/138t5qf/lets_exchange_pics/,t2_8x0li52yo,2023-05-06 00:04:27,34
The different types of AJ guys you'll encounter,"I think within the past year, I've talked to an ample amount of guys here in AJ that I've come to identify specific attitudes haha but this is off of my experience lang. feel free to share your experiences!

1. **the ""straight to the point dtf?"" guy** - wala ng intro-intro, just dead center on their goal. good thing is transparent kausap and they're not here to waste time lol


2. **the ""friendly/nice"" guy** - casual talks with momentary harutan but i didn't realize we've been talking for months on end. we're basically besties ngl 


3. **the ""slr"" guy** - he's so nice to talk to pero hindi kayo nagtatagpo for some reason. it's either 2 mins apart or 2-3 business days, there is no in between.


4. **the ""overlyprotective may kausap ka pang iba?"" guy** - we've only been talking for awhile but he's so clingy and protective about anything and everything. asking who's the guy on my DMs and comments lol


5. **the ""dick pic"" guy** - constantly sends unsolicited dick pics along with their unsolicited advice on how I should act as woman


6. **the ""started off strong but it turns out you're a douchebag""** - our conversation felt promising and we're heading onto the right direction but you kept bugging me about stupid questions only to end up mansplaining it all


7. **the ""tito from foreign country"" guy** - i've encountered this lots of times na they want us to stay constants until they go home sa Philippines and that's for X (sometimes indefinite) amount of time.


8. **the ""hand pic"" guy - best guy. no words!**

there are others pa pero these are the ones that I usually encounter haha

BONUS: the ""we should do porn together but I'll get mad if you don't agree"" guy",https://www.reddit.com/r/alasjuicy/comments/13lkt46/the_different_types_of_aj_guys_youll_encounter/,t2_hbmbyr21,2023-05-19 12:22:52,27
From a girl to a girl: Do you like creampies?,"Because that's me. I'm THAT girl.   


*To be fair and perfectly leveled with you all (especially the creeps who sends me unsolicited dick pics on the daily), I'm NOT addicted to sex or to the kink. I'm a pretty strict gal when it comes to those I've been blessed to receive their sperm and I make sure that everyone is safe and clean.*

But, that being said...

Condoms just don't cut it for me. Never been a fan of hot latex going in and out of my vagina. I need that raw, throbbing skin pummeling against my insides. Veiny dicks are a plus, too! It makes me feel the pulses when I'm being loaded with lots of hot cum. 

And I like all the types too, the thick and slimy all the way down to the dripping mess when there's too much to handle. I'm a fairly smol girl so I like my raw dicks on the average spectrum, just enough to stretch my labias and make me feel his angry cock wanting to breed me.  


Any gal here that prefers the al naturel way of sex? What are your best raw encounters?",https://www.reddit.com/r/alasjuicy/comments/12sy47r/from_a_girl_to_a_girl_do_you_like_creampies/,t2_sz9l63vl,2023-04-20 21:08:57,157
Frustrated virgin or takot lang talaga?,"
F21 here, a virgin as the title says. Have you ever been in stage of your life where you are frustrated whether to do it or not? I mean, minsan occupied ako if ibibigay ko na ba yung virginity ko, or should I hold on to it? Like, yung isang taong type ko naman, sabi ko bigay ko na v card ko sa kanya (kasi daks sya mare) kaso nung gagawin na, beh, sabi ko stop😭 HSHAHSHSHAHA ta's nafu-frustrate ako kaloka na gusto ko hinahard fuck ako, anong feeling ng fina-fuck ganorn HDHSHSHSHAHA my god. Siguro peer pressure? Kasi may nasi-share sila about sex life nila and ako hanggang momol lang? HSHAHSHAHAHAH help kaloka. 

(I know virginity is a social constructivism but you can't blame me, lolo at lola nagpalaki sakin so with a touch of conservatism tayer hahahahah.)

EDIT: omg u guys, I'm not looking for ONS/FUBU/FWB/hook ups hahaha that's the scariest thing for me. I go gaha over pregnancy scare kahit virgin pa ako pano pa kung meron na experience? HAHAHAHA please stop sending hook up invites or unsolicited dick pic",https://www.reddit.com/r/alasjuicy/comments/168payv/frustrated_virgin_or_takot_lang_talaga/,t2_aqausqo22,2023-09-03 14:14:42,43
Slut-shaming,"I saw a reel sa ig about this guy sa isang podcast talking to a girl saying (non-verbatim) ""you have degree right? So may choice ka to work and earn decent money pero you still chose to sell your nudes and make money out of it kahit na di kana karespe-respeto?"" Men watch online porn and still attack women who make money out of their nudes just because they cannot have it for free. Porket hilig hilig niyo mgsend ng unsolicited dick pics for free. Eh kung binenta niyo yan edi ngkapera pa kayo hahaha eme. Tigil niyo na kakaslut-shame pls. 2023 na.",https://www.reddit.com/r/alasjuicy/comments/152g99k/slutshaming/,t2_dy3ikutd,2023-07-18 06:32:44,26
