title,body,link,author,created,upvotes
Pervert Commuter's Diary Pt. 1,"Malibog akong tao, btw I'm a guy on my late 20's. I think bata pa lang medyo bastos na talaga takbo ng utak ko. Nung 6 y/o pa lang ako nanghihipo na ako ng legs or pwet ng mga dumadaan sa tapat namin pero ang napanood ko lang na sex is yung sa mga aso sa tapat namin.  
  
I grew up sa conservative na family and church pastor yung tito ko so laking church din ako, naging church musician so naayos yung moral compass ko kahit papaano and it helped me suppress my libog. Pero nasa loob parin yung kulo ko.  
  
I love commuting, actually I do have a car pero I still choose to commute going to work. Di lang dahil makakapahinga ka habang nasa byahe, or makakatipid ka, I love it kasi nalalabas ko kabastusan ko sa katawan. Eto na nga, I love groping, actually common to sa japan, they call it ""Chikan"" and did a lot of porn with this concept (I never loved watching them tbh).   
  
What I do is dinidikit ko tite ko sa ass or sides ng mga babae during siksikan, either sa Bus, minibus, train, etc. Yes, for sure may mag sasabi na harassment yan or etc., I know it very well. You see, malilibog din yung mga babae and di naman sa bragging ako, pero I have the looks din. I can't even count how many encounters I had while commuting na nag rereciprocate din yung girl and I THINK they were asking for more.  
  
For me, the best feeling is sakto yung height namin (me being slightly tall, I'm a bit taller than average filipino height btw), and the girl have this juicy ass and she wears a light trouser. Damn, the feeling na nakalapat yung tite mo sa gitna ng ass ni girl and the fact na stanger kayo sa isat-isa and madaming pwedeng makakita, best feeling for me, it feels like you're melting, tbh mas masarap pa siya pag nilalabasan ako. I specially love the trending sort of korean trouser that girls love to wear these days, and the leggings as well kasi mas makikita mo pag pinagpala sa cake si girl.   
  
I also love corporate cuties/milfs na naka slacks tapos kitang kita mo curve ng ass nila, as you can tell, I'm an ass guy. They are the one whose also always reciprocate. I love doing this so much, I would even pay someone to it with me.  
  
After having said that, I'd love to share one of my memorable encounters. I do 2 rides just to get home, one train then one bus. If I'm not satisfied with my journey and kahit malapit na ako sa bahay, sasakay parin ako opposite pauwi, yung alam kong maraming sumasakay. This is the case to the one I'll be sharing.  
  
Pag baba ko ng bus and malapit na sa bahay, not feeling satisfied feels like na kulang yung araw ko. So I decided na mag extra trip and saw one minibus na usually napupuno, pag sakay ko palang, tayu-an na pero hindi pa siksikan. I had sight-on dito sa milf with glasses na nakasandal sa vertical railings. Hindi punuan pero comfortable for me enough to do my thing.   
  
So eto na nga, unti unti akong dumikit kay ate then nung mejo bumilis yung takbo namin, dinikit ko na nga. Inayos ko pa yung etits ko, kasi nung tumigas, naka curve down. I think she good with it naman, she actually looked at me for a moment and looked down sa kung ano mang nakatutok sa ass nya. Then she just continued looking at her phone, that's for me is a sign na goods tayo. Looking back, I'm not sure if she enjoyed it. Sometimes kasi I would know if the girl enjoyed it. There's one time na hinahagod pa ng girl using her ass yung length ng tite ko.   
  
Then, biglang napuno yung minibus and I had to reposition away from her kasi pinapausog ng konduktor to have more space for other passengers. Then may pumwesto in-between us ni ate so no chance na kami to continue, tapos wala din girl sa other side ko na type ko.   
  
So go with it nalang ako kahit sayang na pamasahe ko, then when I'm deciding na bumaba na and umiwi nalang, my attention was caught by the two woman na nakaupo sa harap ko, they look decent, kind of wearing their office uniforms, they're both good looking, not slim enought for my taste din.   
Magkasama sila and looks like going home from work din. Then napansin ko yung isa (the one who looks younger and morena) looking at my crotch. Nakabakat pa pala yung tite ko na matigas parin. I caught her multiple times glancing at my cock while talking with her friend. That makes me very horny and my cock got harder din and it makes me did one of the most daring things I did in my commuting journey.   
  
Me standing up in front of her, I slid one of my legs in-between her legs up to her crotch. Shit, sobrang nakaka-kaba yung feeling pero nung pag tingin ko kay ate, nag katinginan kami and she's a bit suprised pero no negative reaction from her naman and she just continued talking with her friend. Looks like goods kami ni ate.   
  
So sa libog ko, diniin ko pa gently yung tuhod ko sa loob ng hita nya. I even tried move her legs side to side na parang binubuka ko na yung hita nya, no resistance or whatever, she even let me buka her legs a bit para mas madali ako maka penetrate. Damn the look on her face, kita mo na libog na rin si ate. Her cheeks are a bit rosy na. While doing this for a while then so I realized na, all that time na doing it with the milf with glasses, nanonood pala siya.   
  
Kaya pala yung tingin nya sa tite ko, iba. Habang binabaybay ng minibus yung daan, inuuntog ko ng inuuntog yung tuhod ko sa pepe ni ate. Sinasabayan ko yung roughness ng byahe sa pag tuhog kay ate. At this time, gusto ko nang ikama si ate, gusto ko sana kuhain number niya pero ever since, wala pa akong kinuhang number sa kahit sinong naging encounter ko.   
  
Meron isa, binigay sakin yung fb nya pero walang nangyari, tho I sent her an unsolicited dick pic hahaha. Meron naman isa, hiningi ko palang name, sabi nya ""May pamilya na ako"" haha. Anyways, umuwi na ako and feeling satisfied naman. Happy din si junior. ",https://www.reddit.com/r/alasjuicy/comments/177i71t/pervert_commuters_diary_pt_1/,t2_9vpskj0b0,2023-10-14 13:22:26,0
A Guide for Virgin Men: The 10 things I learned from Hooking up,"#Nutrobbers: What Does He Know? Does He Know Things?? Let's Find Out!


Hello there! 

^General ^Kenobi

First of all I am not a self-proclaimed sex guru or fuccboi, fact is, I'm still in the noob side of the chart. This post will serve as a guide from the things that I learned from my experiences. 

Ever since I started writing my stories here I had several guys asking me on what to do and how do I do it. The answer to both questions is... I still don't know. It was all luck I guess and a little bit sense of humour.

I was virgin for the majority of my life and that is nothing to be ashamed of. I had no one when I started out. I'm not saying I could be your Hitch (From the movie Hitch) or that disgusting piece of trash, PUA. No no no. This will only just give you an idea and everthing else will be up to you.

#1. Women don't owe you sex


This is the most important lesson that I could tell you. Being nice doesn't give you a free pass for sex. Oh no, Women are not Starbucks. You don't get let them stamp your ""Nice Guy Card"" from all the nice things that you did and when you get all the required stamps they'd sleep with you. No. They'd sleep with you if they want to. So it's all a matter of how interesting you can be or how funny you are.

Especially on R4Rs. Don't get mad if women doesn't want to sleep with you. They don't owe their puday to you.

#2. Wash your Putotoy


*A smelly cock*

*Doesn't get suckie-suck*

Please. Wash your putotoy. Wash it with soap and body wash. Apply lotion as well so it'll still be mabango after school or work. Even if you're not going to have sex still wash it make it a part of your routine.

#3. Shave your Pubes

Now, this may differ to a lot pf people but I still included it since most that I've been with wants it shaved. Unlike no. 2, just shave when you're expecting sex.

It's better to shave because it looks clean **big, and inviting**

It's like you're telling the girl

""Hey you can put your mouth in""

So do shave, unless you partner expressively said that she doesn't want you to.

So here's a tip. If yours is a jungle that can explored, trim it with a scissor. Be careful tho, you might cut your dick *haha* Hello sa mga growers and maliit putotoy diyan eto advantage natin. lol. But seriously tho, trim it first para easy shave. After trimming apply shaving cream, if none, body wash or shampoo will do. Do it slowly.

#4. Wear a Condom


Raw Sex is cool but safe from unwantedpregnancyorSTDs is cooler.

Even if your partner doesn't want you to (Provided that she's a stranger) still wear a condom. It's not about trust issues but prevention.

#5. WAG KA MUNANG MAG JAKOL


If you have a scheduled sexy time, don't jerk off. Hinay muna sa ""Hot Latina Sweet Ass"" sa search bar sa pornhub.

Because if you're a chronic masturbator chances are you won't cum or you'll get soft mid sex. Yes this happened to me several times now until a partner said that I should've not jerked off. I tried it and BOI! Not only did I cum and it felt really REALLY good.

#6. Do push-ups


This is a bit of hypocrisy since I myself don't do push-ups.

*But Nutrobbers, why should I do push ups?*

I hear you audience and here's why.

Imagine it's a Sunday night and you're doing the missionary position because it's the right thing to do on a Sunday but wait! Hol'up! Your arms are getting weaker as time goes on. They're starting to shake and you hear your partner ""Are you okay?"" and you said ""Of course I am because I am man!"" and then *snap* your arms failed you and you fell on your partner resulting to a headbutt.

This situation may or may not be from an experience.


But yeah, do push ups plus it'll lessen your manboobs as well. No more lamas for you.


#7. Don't be too Manyakis

Be a gentle manyakis. Don't be too eager. You might make things uncomfortable. 

Like one redditor said

>Can guys be a perfect blend of chill, respeto, and bastos

-Username omitted

Just take your time. If she's in the mood then she's in the mood.


#8. Unsolicited Dick Pics

*If you want love*

*Lower your expectations a lot*

*You might think your dick is a gift I promise it's not*

- Bo Burnham

Just fucking don't. They'll ask for it if they want it.


#9. Don't ask for Nudes randomly.

This is in connection with no. 7

Asking for nudes should be done organically. You don't say ""Snd nuds"" in the middle of the conversation. 

Also a tip for the women. If you're talking through TELEGRAM (the app and not literally the written correspondence). There's a feature called ""Self-Destructing Photo"" (also on video), so set your nudes on timer. This will make you feel safe. If the dude is a douche then you can file for case against him under RA 9995.

#10. It's better to talk first for days before hooking-up


I can't stress this enough.

This is for your safety.

By talking to them first you can determine as to whether or not they're real or not. There is a chance that they're catfishing you and will rob you...or worse...CUT YOUR PUTOTOY. Yes I have this irrational fear of putotoy cutting.

also if the girl is for real then this will make this easier and will make you guys comfortable with each other.



I can only tell as of the moment since I'm still learning as well. It's not the ten commandments so you can still do whatever the fuck you want.

Feel free to add some more (women as well. Give us tips). Let's help each other for a better experience.



**EDIT**

I received several messages from men and I am grateful, but please, don't ask me what ""techniques"" I use to pick up women. 


First, I don't have a technique. All hook ups I had are from good communication and connection. 


Second, I am not from PUA so don't treat me as a pick up artist.


Third, all are from phr4r. That's it. There's no secret kantutan subreddit. 



I can only give you tips on how to better communicate and the rest is up to you. ",https://www.reddit.com/r/alasjuicy/comments/aklpi2/a_guide_for_virgin_men_the_10_things_i_learned/,t2_2ajn0gm1,2019-01-28 17:00:46,138
A MalasJuicy Story,"Preface: Please excuse my writing coz It's been a really loooong while since I last wrote a short story. I used to keep a journal a few years back but I got caught up in major life changes that I started to write less and less. Like other people, I write to contemplate, to reflect, to try and understand myself. I haven't been able to do that, hence, this ""Alas!"" (not so juicy) story.

So, here goes...

On lazy days, I would idly switch between reading goosebumps-inducing gross stories on Reddit, and, swiping left/right on potential hookups on various dating apps/websites like Tinder and OKC. One day I realized that Tinder is saturated with mostly... boring and unoriginal fuckbois (some even have Barney Stinson quotes on their profile). I mean, I'm okay with men who enjoy casual sex but not ones who only want to pump and dump. Don't get me wrong, I'm not looking for my soulmate (if s/he does exist), I just want someone who wouldn't treat me like some piece of meat. Thus, I searched Reddit for alternatives to Tinder and... Voila! PHR4R.

A few dozen failed and succesful attempts later, my curiosity and hunger for this basic human need is still not satisfied. 

Due to a recent event I would rather not get into, I am determined (read: hell-bent) on finding the best lay of my life. 

And so I decided to create this throwaway account to post quite a lust-fuelled personal ad (which I already deleted) on r4r. It went along the lines of ""I'm looking for a guy who would fuck me into oblivion"". Well, you guessed it, the post was well-received. Some guys slid into my DMs with unsolicited dick pics (ugh), while others sent elaborate essays explaining why they're my best choice and of course, there are ones who were very confident in their ""great"" fucking skills. Yes, I know I'm not celebrity levels of hot but I know I'm fuckable enough to be choosy. LOL.

Fast forward to Day 5/6 of the search, still no one. I'm starting to lose hope. To be honest, I didn't even know what I was looking for. An interesting guy with a decent face, I guess. Then I got this message from a 1-day old reddit user. I should have recognized this as a red flag, but I didn't care to check his profile at the time. 

We started chatting on Telegram. He interested me with his equally laid-back and enthusiatic approach. That same day, he was trying to convince me to come to his place so we could finally have a ""good time"". He even asked me to remove the ""STILL LOOKING"" tag on my post and make an update announcing that I've already found the one who would fuck me into oblivion. He even said something like ""Haha wala kasi silang game, ako na makakauna sayo.""

In retrospect, we didn't really have that much in common. I'm already tired of filtering applications and just allowed myself to be reckless. We exchanged photos. He said he liked my eyes and he looked okay to me (he has a toned ass and biceps which I like). He lured me into his lair with more flattery (another red flag), some weed and Andok's roast chicken. He also told me I can stay over if we finished late (we're from opposite sides of the metro) so I brought clothes (stupid, I know).

We agreed to meet the following day. At 6 in the morning he messaged me confirming if I'm still pushing through. I assured him that I'm not backing out. I went on with my tasks, he checked up on me almost hourly. By the end of the day, I left the office and booked a ride to his place.

Upon my arrival, we made a detour to a sari-sari store to buy some alcohol (note that he informed me that he doesn't drink coz it's bad for his training). He got Tanduay Ice (I hate that shit), I got beer. We bought some cigarettes too. 

A few steps from the house he suddenly faced me and said (not verbatim) ""I haven't been completely honest with you, kaka-break ko lang, mga 1 week ago."" I was like ""Okay. So you didn't tell me coz you think I'd back out?"". I was genuinely fine with that, as long as he shows me a good time. He then mentioned ""you can leave after we finish, maage pa naman"". I was still okay with that even though he could've told me earlier so that I didn't have to bring my clothes.

When we entered the house he introduced me to the maid, then we sat in this dimly-lit living room. After we both smoked a few sticks and barely finished one bottle each, he handed me a box of condoms and asked if it's okay with me to have sex on the floor (third red flag I ignored). I was like ""WHAT?!? NO."" We settled the issue with him putting this single bed foam mattress inside his ""room"" (which is inside another room).

I could see that he was restless and just wanted to get it over with. So did I. I was feeling somewhat uncomfortable at this point and thought I was too far in to back out. I sipped some more beer then I said ""Okay, let's do it."" 

We were standing at the door to his ""room"" when he turned on the lights. Surprise! I quickly surveyed the room and here is what I saw: a dirty-looking sink, a moldy toilet and a shower cubicle the size of one telephone booth -- all out in the open. I thought to myself, ""Wait, is this a fucking bathroom?"" Well, yeah. Large enough to fit one mattress in the middle. I don't understand why I didn't run out the door right then and there. I guess I didn't give a shit anymore.

I said, ""lights off, please"". The sight of that room turns me off as much as seeing Duterte kissing that poor woman in South Korea. I used the flashlight on my phone so it's not too dark.

We laid on the bed. Foreplay, which was only around a minute, consists of: sloppy kissing, some boob grabbing, hasty undressing and 5 seconds of finger fucking. The actual intercourse was less than 10 minutes. He fucked me with his semi-boner in missionary position while his salty sweat dripped on my face. How titilating. 

After he nut, he had the nerve to say, ""to be honest dude that's not even a boner! I didn't get a full hard-on because of the alak."" I know, man. I know what a boner is. 

He left me in the ""room"" to clean up. When I got out, his friend (who owned the house) was there and they were already smoking weed. I said ""Hi"", sat on the couch, took a few hits and then texted a friend. No way am I staying over. 

While I waited for my friend's reply, I tried to talk to him about what happened. He just kept saying ""It's all good, man. No point in talking about it. What's done is done."" I actually agree, but get this: I came there hoping to be (or at least tried to be) fucked into oblivion. I walked in on his pity party instead.

I would have been more sympathetic towards him if he'd just come clean. He lied to me about a lot of things. Not having Andok's roast chicken for dinner was just the tip of the iceberg.

When I was about to leave, he offered me a box of mac 'n cheese I could take home as A TOKEN. I laughed and said ""No, thanks."" I bid my goodbyes and left.

Guys, if you ever plan on scoring some rebound sex a week after a break up, please be more considerate of other people. You're not the only one who goes through shit.

Badtrip, pare.

TL;DR: I hooked up with a broken-hearted boy, turns out his dick was broken too
",https://www.reddit.com/r/alasjuicy/comments/8spjj2/a_malasjuicy_story/,t2_1jd9gykj,2018-06-21 14:15:03,72
