title,body,link,author,created,upvotes
The start of something new,"I was gonna write about my first time with a guy. But, I had a really hot experience recently, and couldn't resist writing about it.


By now, I'm pretty confident about my gender identity and sexualty. I present myself as masculine and straight-acting (if that's even a word), but I'm openly bisexual. I am physically attracted to masculine men and feminine women. But, I've only ever been emotionally attracted to women.


A couple of months ago, I found myself single, horny and alone. My last (exclusive) fuck buddy had dropped the dreaded three-word, eight-letter bomb, a few months prior, as he emptied his load inside my spent hole– and I had to cut him off.


I was supposed to meet up with a girl from Tinder, but she flaked at the last minute. It was frustrating to say the least. I briefly considered contacting the previous guy, ultimately decided against it.


I downloaded Grindr, posted a headless photo of me wearing only a jock strap, and waited. It was a long arduous hour, filled with unsolicited dick pics, overly choosy men (as am I), and jejes with horrid grammar. I almost gave up and was about to log out when ""Hey"" contacted me.


He had his back turned, and the photo was taken from a distance. But I could see his muscular legs, and he seemed pogi (I like to think I have a sixth sense for this). Plus, he was only 300 meters away. So, I took the bait.


""Fun?"" He had asked.


""Sure. Pic?"" came my reply. It was almost clockwork. My profile had the GGSS ""No pic no reply"" tag but I was bored and horny so alright.


""Got a place?""


""Yeah,"" I was rather annoyed he didn't send a pic. 


""Can I come over? I really need a good fuck right now.""


""Sure, send a pic.""


Then, he did. He was out of my league– chinito, gwapo, and with the body of an athlete who stopped working out for a month (macho with a small layer of fat). I sent some photos back. I wasn't bad looking myself but I was more twinkish than macho, at that time.


At this point, I was feeling sleepy, and figured he'd probably flake on me anyway so I bade him good night.


""Wait,"" he said, ""You said you were bored and horny?""


""I am. But I'm a bit sleepy na e. Body hurts from gym. Maybe tom?"" I put my phone down and brewed some tea as part of my nightly ritual. 


My phone vibrated a few times and I saw a string of messages from him.


""Promise?""


""I really need a good fuck now.""


""I'll make you feel good.""


""Please?""


""Heyyyy""


In fairness, I felt really gwapo reading those messages. 


""Tara."" So, we met up outside my village and I picked him up with my car.


Tangina ang gwapo niya. HAHAHA He looked like a cross between Xian Lim and Ian Veneracion. He was wearing a blue shirt and basketball shorts. He gave a shy smile, as he boarded my car.


We drove in silence back to my house. It was always awkward when with a new guy/girl– moreso with this really cute guy. As I parked, I turned to him and asked, ""Oks ka lang?"" I felt like a mere mortal beside this guy. 


He nodded and replied, ""Yeah. I like your smile."" He put his hand over mine. Tangina. Ito normally linyahan ko sa girls e. I turned off the engine, leaned towards him, and kissed him.


""Kala ko antok ka?"" He teased with a dimpled smile.


""You woke me up e,"" I placed my hand on his crotch. I felt his cock getting hard. ""Tara na.""


I was really nervous, and struggled in opening the door with my keys. When I finally did, he pushed me in, shut the door, grabbed my face, and kissed me hard.


Fuck. Ang pogi ko. He kissed really well. But, having learned from a pro for my first time, and having twelve years of practice, I was not going down without a fight. 


I spun us around and pushed him against the door. I ran my fingers down his short hair, and took his lower lip between my lips. I sucked and kissed, and brushed my tongue against his. I slid my hands across his back, to his arms, chest and stomach, feeling every inch of his body. 


The thing I like about the male body is how hard it is. Female bodies are nice and soft– but a man's body has a way of making you feel warm, safe and small. I moaned as his large hands roamed my body.


""You are so fucking hot,"" he whispered to my ear, before taking my earlobe between his teeth. I held onto his shoulders, as I moaned and arched my back. I pushed him away, and took him by the hand.


""Let's go up."" I led him up to my room, and pushed him on the bed. I mounted him, looked him in the eyes, as I took my shirt off and said, ""Ang sarap mo."" 


I ground on his dick as I slid my hands beneath his shirt and groped his chest. I couldn't get enough how strong his body felt. He practically tore his shirt off, grabbed me by my cheeks, and pulled me down for a kiss. His hands slid down my back and into my boxers. He squeezed my ass as we kissed, before getting me naked.


Tangina. Ang hot niya. Ang sarap niyang halikan. Gigil na gigil kami sa isa't isa. I moved my lips to his cheeks, down to his neck (I loved his perfume), and chest.


I took his left nipple between my teeth and flicked my tongue against it. He moaned and pushed my head harder against his chest, ""Sige pa, dedein mo ako, baby.""


So, I did. I used to smoke before transitioning to vape, and then completely giving up the bad habit(s). Looking back, I was never addicted to tobacco or nicotine. I just needed something in my mouth– and my partners' bodies helped fill that void.


I lightly sucked around his areola, with occasional flicks to his nipple. I loved how hard his nipple was and how fast his heart beat against his chest. I felt his dick straining against my shoulder/arm as I moved to his other nipple. I pressed my body against his dick, making him push up and moan. 


He took me by the face and pulled me for another tender kiss. I traced his chiseled jaw with my licks and kisses before kissing my way down to his neck, shoulder (ang sarap ng pawis niya), chest, down to his abs.


As I reached his crotch, I looked up at him before giving a heavy lick across his shaft. He arched his back and moaned, ""Tangina ang sarap mo."" I grabbed his boxers by my teeth and pulled down. As I did, my cheek pressed against his abs. The lower his shorts went, the harder and thicker his cock felt across my cheek. It felt so warm. I nuzzled my cheek against it before planting a light kiss.  He shifted his weight so he could take his boxers totally off.


I kissed around his thigh and sucked. He gasped , ""Huwag dyan, nakikiliti ako!"" As I licked his inner thigh, my tongue brushed against his heavy balls.


I loved that he trimmed. I shifted my lips to his balls and sucked. My nose was pressed against his dick. He moaned and cussed under his breath. He grabbed onto my head, trying to force me to take his dick. 


But, I'm no one's bitch, and I didn't budge. I wanted him to beg, writhe, and cry for me. Something about a grown man, more handsome and stronger than me, turning weak and pliable to my touch gets me horned up.


When he finally did, I kissed my way from his balls to his shaft. It was around 6"" long, and had the right amount of thickness (maybe slightly wider than the girth of a tissue roll carton). It had an upward curve and a nice mushroom head.


If I had to describe his dick in a word, it'd be ""gorgeous."" It had the perfect balance of squishiness and hardness. The thing I love about penises is that they filled the void smoking left in my lips' need for suction (that eating pussy could never do). Don't get me wrong. Eating pussy is nice is if I wanted to lick, nibble, and dive– but nothing can top sucking cock, bobbing my head up and down a hard shaft, brushing my tongue on the underside of his head, and gagging on it as it enters my throat.


He bucked and flailed as I made love to his dick, whispering obscenities and admiration at my skill. I guided his hands onto my head, and he got the cue. He grasped at my hair, and began to bob my head up and down to meet his thrusts.


He went on for a while before pulling me up for another kiss. We locked eyes once more and kissed like long-time lovers. I pushed a strand of his hair back, and brushed his cheek with my knuckles before falling into him, and taking his lips. He wrapped his arms around me and rolled me on my back, so his weight was on me. I loved how he felt on top of me as he kissed my neck, my cheeks and my nose.


My hands fell on his shoulders as he worshipped my body. I rubbed his back and tugged on his hair, while he thrusted his dick against mine. We were around the same size, and his dick felt so right over mine. I moaned at the sensation and wrapped my legs around him.


I rutted my dick against his and whispered how horny he's making me. ""Fuck me like one of your girls, daddy,"" I told him. It was a guess– but I think he was bi like me.


He pinned me by my hands and hissed at my ear. ""Ang sarap sarap mo, baby. Gusto mo ba dick ko?""


""Yes, daddy,"" I replied, ""Please give it to me.""


He found the condom and lube on my side table and equipped himself. I whimpered as he fingered me. It has been so long since my hole was breached by another.


""Masakit?"" He asked with concern, ""Ok ka lang?""


I cupped his face with my hands and kissed him, ""Virgin ako, daddy. Please be gentle."" The last time I bottomed was four months ago.


I could tell that that turned him on since his dick throbbed against my leg. He kissed me tenderly while loosening my hole. He rolled us over so I was on top.


Looking me in the eyes, he positioned me on top of his dick, ""Tell me if it hurts, baby.""


Shit. I love this talk. I liked the fact that I was the one being coaxed and comforted– things I normally did. I leaned in for a kiss as my hole opened up for his cock. 


His dick felt so big inside me that I had to pause. He gave me a gentle kiss and said, ""You're doing so good, baby. Ang init-init ng butas mo. Don't rush. We have all the night.""


Ang hot talaga nitong si gago. I relaxed myself as I lowered myself some more. I was halfway down on his cock when I decided to move up and down. He moaned in appreciation but didn't really move, yet, as he waited for my signal. What a gentleman. When I felt like I was ready, I lowered myself all the way down.


We both moaned as I felt his thighs touch my butt. He cupped each asscheek with a hand, looked up at me (I nodded), and pulled me up– before promptly pulling me down his shaft. I arched my back, let out a gasp, and fell on his chest at the sensation.


I watched his eyes roll back as he claimed my hole as his, using my body to pleasure himself. We kissed as he fucked me. Personally, I wasn't a fan of getting fucked. With men, I just prefer to suck cock. But, this guy was pretty good.


He sat up and locked me in an embrace, without removing his dick from my hole. He then laid me down gently before promptly fucking the shit out of me. He pulled my legs over his shoulders and looked at me with a manic glint on his eyes.


""Masarap ba? Ang sikip-sikip mo! Kung di ka lang hayok kanina, maniniwala na akog virgin ka e!""


I laughed before pulling his face for another kiss. ""For this dick, daddy, I'll be your virgin and whore."" That was his cue to fuck me harder– with longer strokes than ever, pulling all the way back, pushing all the way in.


Eventually, he pulled out. I felt so empty. He pushed me forward on all fours. There was mirror beside my bed, and I realized what he wanted. He applied more lube as he entered me from behind. He was so big, I arched my back. I watched myself mewl, moan, writhe at the feeling of him inside me. His eyes locked at mine in the mirror while he enjoyed the show.


He pulled all the way out before thrusting all the way in. I fell forward, overwhelmed, and held onto the sheets. He grabbed my hips and began pulling me back to meet his thrusts. I relaxed my hole as he thrusted, and squeezed as he pulled out. He let out grunts and groans.


Watching him roll his eyes back while he fucked me, or glare as he focused on not coming was so fucking hot. He pushed me all the way down, closed my legs, and leaned on top of me. Fuck ang sarap niya talaga. 


He turned my face to kiss him. I couldn't move as his hands were on mine. His fingers squeezed mine and I squeezed back, moaning at every movement. I was in ectasy. All that mattered was he was leaning on top me, kissing my neck, his dick fucking my hole. Soon , his thrusts became faster and harder. His breathes became harsher and more frantic. He bit on my neck and I was his eyes roll back, through the mirror.


""Buntisin mo ako, daddy!"" I yelled. That did it. He let out one last thrust before collapsing on top of me. We stayed that way for a long time. Soon, we rolled over so I was on his chest.


He took off the condom and tied it before tossing it on the bin beside the bed. He planted a kiss on my forehead, ""Thanks, I needed that."" We made out a few more minutes before he spooned me.


He got hard again, and I sucked him off. I let him cum in my mouth, and he kissed me like he didn't care. That was when I knew I'd found my new fuck buddy.


Eventually, we cleaned up, got dressed, and exchanged numbers. That was the best sex either of us had in a long time, and we agreed to meet the next night. I dropped him off, and had a very good sleep.


More stories coming soon. ;)",https://www.reddit.com/r/alasjuicy/comments/c7n3ku/the_start_of_something_new/,t2_baqfr5d,2019-07-01 10:43:58,34
A Sudden Weekend Workshop,"**^(Note:)** ^(This is going to be a two-part series because I feel I have typed enough for today, and that we only have a certain tolerance for a lengthy block of written work. I do apologize in advance if this will come off as a cliffhanger, but I promise to compensate on the next part.) 

For many that I have been with, fucking a teacher is already a kink, but I have never imagined practicing the profession while having sex. Most of my partners tend to be the one in control, and I do enjoy being a submissive after a long day of taking in charge. But as Margaret Fuller would say, *nature will provide an exception to every rule*. Steve is one of those random exceptions. 

I first met Steve while I was mindlessly scrolling through phr4r. He had a really engaging ad, and I just had to reply. I wasn’t really looking for another hookup, but I thought *sayang naman* if I let go of chatting with someone who has a promising personality. More often than not, being able to sustain a good conversation is still better than mindless sex.

What is special about Steve is his aptitude to keep things rolling with a dash of humor. For one, we could shift the dialogue from a ridiculously funny experience to a commentary about Evangelical Christianity and then to something naughtier. Things never got boring, and I am fond of teasing and testing his patience. 

There was even a point when I, partly curious to the limits of his spontaneity, had asked him to send a video of him dancing. I was really just tripping that time, and wasn't really expecting anything. Or maybe I was hoping for something sultry; we had been sharing some of our kinks after all. But the guy, bless his heart, made an effort of replying with a vigorous ocho-ocho. 

He was something else. 

I had other non-exclusive fuck buddies, but I actively maintained Steve in my tele for his humor and decency. He never sent an unsolicited dick pic nor demanded for my nudes. For some unknown reason, that made me want to tease him more. Like I wanted to coax this guy to ask me out for a fuck. Maybe I just had a kink for corrupting people who show strong mental resolve, or maybe I was simply curious to see how far a person who is just beginning in the hookup culture would go. But I kept on teasing. Of course, I could have propositioned something direct, but it is more challenging to have it organically come out from him. It has become a mental game I play with myself.

But he did not respond to the stimulation. In fact, he purposely ignored them. Late replied to me that he needed to focus on law school and other stuff. Okay. Maybe some other time then. Anyway, I was still invested in other pursuits. Sakto I had another hookup scheduled at the end of the week. 

So Friday came, and I was looking forward to destress and have my pussy pounded. I timed out early, texted my housemate that I would not be coming home for the night, and made sure all assessments were checked and turned it. It was pouring that night, so I took a cab to Cubao

Only to find out that I got stood up.

It is very frustrating to be ghosted. Hyping myself the entire week, sowing seeds of kindness to entitled students since I thought I am going to be seeded as well, spending effort to show up presentable and on time…only to be blocked on the day I was preparing for. I was pretty much livid. 

So I spent the next few hours stewing in Books and Borders when Steve texted,

""'sup?"" 

I guess he was trying to be cool, but it was bad timing. It came off as if I did not even deserve the whole ""what's up?"" and it amplified the feeling of being ghosted. Incensed, I replied with a lackluster ""K."" Man, I was pissed. 

He probably sensed that I was in a bad mood because the next thing that came in were series of apologies. *Sorry na.* 

Maybe an apology was what I needed that night because I softened and my teacher rationality kicked in: *Hey, it wasn't this guy's fault. You're misplacing your anger.* So I told him the context. Maybe talking to him would cheer him up.

""Tara, let's fuck,"" he said. I had to do a double look since it is out of character. It was plain and assertive. No followed-up joke or sugarcoating. Surprising. It was something I wanted to hear from him, but this was so sudden. And I wasn't really expecting any action now...but hey, that would *cheer me up*.

Not letting go of the opportunity, I asked him where he lived. Up north, he said. Like beyond QC north. The idea was preposterous, but I was already doing Math and Geography in my head. *How would I travel? How much would it cost me? What’s my back up plan if things go south?* Oh the things I will do for a fuck. A fuck that has no guarantees if it's going to be good or bad.

To add to the conundrum, the rain intensified, and maybe that was God's way of saying, ""Uwi ka na, Anna. Spare this guy the trouble."" Maybe Steve and I were not supposed to meet. Maybe I was not worthy to be immortalized as the teacher who ticked one of his bucket list. Maybe I needed that fare for something more important. 

*But hey*, an inner voice reminded, *the guy had a great personality*. If it didn’t work out, maybe we can laugh about it together. 

So I texted him that I'll be taking Grab and I’ll see him in an hour. Maybe he can share the bill with me? It did not faze him. Instead, he asked me if I do blowjobs.

*Of course I do, silly. Just you wait.* 

This isn't meant to brag, ha? It is just that during the time that I was still promiscuous, I had this *fetish-but-self-justified-as-a-social-experiment* practice of tasting my hookup's cum. Ew for some, but I never shirked away from the responsibility of Science. So blowjobs are really on the table. I even kept tabs in my mind on who had the best tasting one. Steve’s fairly okay naman, but we’ll get more to that later. 

After an obscenely expensive grab ride, I arrived at his condo. It was still raining, but he took the effort of waiting at the driveway with a ready umbrella. Sakto naman face value, but more importantly mukhang cuddly. Oks manoks.

We went up, ordered fast food, and talked about things in general. We ranted, shared some fries, and talked some more. I asked if he was living alone, and he said his mom would visit occasionally. I looked around and studied the flat’s personality: kept but not curated. Functional. Reasonably cluttered. No Ted Bundy bells suggesting I ought to run. Okay.

I asked if I could shower. He gave me -in his own words- his *fuccboi* shirt. It was a gray V-neck which has a breast pocket similar to what white-sneakered shoes fuckboys would wear on a casual hot day. I chuckled at the term, and then at the thought of someone who was fairly new at sex owning a fuccboi shirt. Irony? Or a foreshadowing perhaps?

I went to the shower, marveled at the array of hygiene products, and thanked the Lord for a selection of toiletries. It’s not every day that I get to choose between Palmolive Pink and Dove (?) at a hookup's place. I couldn’t remember the last option to be honest. But Steve definitely takes care of himself and doesn’t confine himself with limited choices brought by fragile masculinity.

When I got dressed, that’s the only time it dawned on me that he only gave me a T-shirt. *Does he want me to come out with only this? Do I still need to wear my teacher pants?* I decided to venture out with nothing but the shirt and my panties on. He was like, *Oh okay. Let’s just continue this upstairs*. If he liked or was mortified by what he saw, he didn’t let on. 

The loft upstairs was dark, but it got MOOD LIGHTS. Steve was the only guy I met who thought of lighting. It was really a nice touch, because it sets the tone of the next events to come. Like, we were done with bantering, lezzgo to business.

So we kissed, and he started to become so hungry for more. I like aggressive kissing. It turns me on. Steve was doing just that, and I was starting to want to make his kisses linger. I was teasing him with my tongue. My hands goading on his back and shoulders. Him on top.

BUT IT WAS GOING TOO FAST

Like really too fast because the next thing I knew was that I was still in the mood for kissing and he was already starting to take my panties off and spread my legs for entry. Startled, I swatted his hands away. Now it was his turn to be shocked. 

“You’re going too fast.” I frowned. “You have to take things slow.”

I think I accidentally used my teacher voice that time because he gave a look of a boy being reprimanded. I thought it was going to be over. But Steve, as I have said, was an exception. He rose through that embarrassment and used it as a learning experience. 

That kinda motivated me to play teacher. ;)",https://www.reddit.com/r/alasjuicy/comments/mbi2h1/a_sudden_weekend_workshop/,t2_4aqjg5rb,2021-03-24 00:05:59,28
