title,body,link,author,created,upvotes
"to the person who used the ""Amber Heard strategy"" against me.","How the f are you?


I heard you had a kid from the guy you replaced me with.
Dun parin pala kayo sa barong-barong na gusto mo bilhin ko mula sa family mo.

Too bad your lawyer told you to quit your varsity version of amber heard tactics against me kasi walang makikita ang medico legal na ebidensya na biktima ka ng intimate partner violence.
Mukhang matinding karma ang inabot mo sa paninira mo sa akin at sa pag sinungaling mo sa abogado mo.

In short false domestic abuse accusation.

Palibhasa babae ka so lahat ng family mo napaniwala mo sa story-telling-a-lie mo, and lahat sila still wanted to kill me.

Kaway kaway sa ""religious police"" weekend-warriors niyo that was able to ""track"" my whereabouts but couldn't trace where i really was.

Too bad they didn't read Tom Clancy novels about Jack Ryan and John Clark.(still better characters than Jason Bourne or Alias)

Sana na-enjoy mo ung halaga ng pera na para dapat bayad sa mahal na upa at mahal na kuryente.

By now ubos na yun loko.

Good luck sa pagpapalaki ng anak mo na di naman kaya tustusan ng tatay na inasawa mo.

After you left, sunod-sunod naman ang mga lucky strikes ko, i was promoted sa company na pinagtrabahuhan ko, and nung lumipat ako ng company aba mas malaki sahod at mas mataas na posisyon pa ang binigay sakin.

So, feel mo naisahan mo ko?

Think again.",https://www.reddit.com/r/OffMyChestPH/comments/wvxcnf/to_the_person_who_used_the_amber_heard_strategy/,t2_771k2zek,2022-08-24 03:15:19,2
what is this behavior?!,"so, mom spotted a brown 🐍. my dad recently watched a bunch of informative videos on youtube usually about wars and dangerous animals, snakes included, that it made me pray it doesn't trigger his inner violence. neither of them surprisingly freaked out. they were chill. dad even told mom to leave it be. mom only talked to the snek, ordered it to go look money for us, and such; she was also impressed that the noodle only stared at her, seemingly listening to everything she has to say to the point she labelled them as a sign of prosperity for us.

a little insert. it might seem strange, but it's normal for my family to talk to animals. my mom talks to her plants on the daily. i remember i was talking to one of her plants because i poured spoiled milk on their leaves (it was an accident >.>), so i had to clean them with water (it was also a secret deed, nobody shan't know). mom caught me speaking, beamed at the idea given i was situated near her plants and pouring water all over them then asked if i had talked to them (aka my siblings). she encouraged me and said more stuff to which i didn't reply because i had no idea what to say, i wasn't expecting to get caught. back to the topic:

i HAD to run outside to see it. the revelation, gosh, they were SO cute?! they were LITERALLY staring at us back. (here comes my thought of wishing i could domesticate them.) dad was also there, he was enticed. i think they got scared that they slithered away when i came, they must have felt cornered. my mom was smiling. she seemed happy. my dad was also chill with it. seriously, i'm just,, aAAAAAHHHHHH I'M SOFT

i know this probably means nothing, but it meant a lot to me. we have a long history of 🐍. as far as i know, mom is usually scared and alarmed around snakes. dad would also run to mom's aid then \*you know what na\*. so, yeah, i just feel so good today like that really happened, my heart. ❤",https://www.reddit.com/r/OffMyChestPH/comments/xaimot/what_is_this_behavior/,t2_nb23z8dy,2022-09-10 15:03:08,6
