title,body,link,author,created,upvotes
This one's for the boys,"I have talked with several women here on reddit and I have heard the same complaints about men both here on reddit, dating apps, and even Omegle, and that is - ""men rush"".

I think women of AJ can back me up on this but, there's no built-in ""on and off"" button for women's libido. You don't just whip your tool and she'd automatically drool over us. By doing so, would only reflect on our character rather than our sexual prowess.

I feel sad that few men appreciates the art of conversation nowadays and just want to go straight to the point. That rarely work. The dance of HU, FWB, ONS, and even finding a potential partner requires patience, empathy, sensitivity, and most of all, humanity. You don't whip your tool out on a bar just to woo the ladies, you don't jump the gun when you appraoch a lady, why would virtual interaction be different?

Listen, understand, respect, class... I think women dig men with manners and humor more than men with long tools and Adonis like physique. Unsolicited dick pics rarely get you laid. Jumping the guns in just a few conversation will only tend to push the girl away as your intention is clear. 

I know we have atrong libidos, let's not try to look desperate just to satisfy our urges. You're afraid of their impression? Be yourself. If they can't accept that or you're not their type, respect the decision, thank them for theie time, and move on to the next one. Afraid of sounding dull or boring? Read more, learn more, there's so many things under the sun to talk about... why limit your discussion to sex? You just want release your libido without all these jazz? Why not consider paying for one or watching p*rn and pop one off?

Remember sex without substance is just jerking off with a partner. Sex is meant to be enjoyed, it's means to be appreciated, it's meant to be an adventure and discovery... it should never be vanilla or one sided. It should never be shallow. It's too good for that.

Also, please stay away from minors. I've seen and heard some men dig teenagers. Remember 18 is a gray area... under that and you're definitely looking for trouble and this should be a warning for any man reading this and is thinking of fulfilling their Loli fantasies. Once we found out, I'll definitely hunt you down and bring you to justice (and I know the gentlemen of AJ are with me in this witch hunt).

It's time boys become men, and men become gentlemen. Keep it classy guys!

- end of sermon -",https://www.reddit.com/r/alasjuicy/comments/16uoikf/this_ones_for_the_boys/,t2_j116ttfeo,2023-09-29 03:06:07,206
It's a big no no no no.,Seriously guys don't send unsolicited dick pics :) Hindi ko kailangan yan. Buti sana kung nagtanong muna bago isend :)))) And P.S I'm not inviting anyone to do it with me nagtanong lang po ako about sa hymen ko hehe yun lang po godbless ulet :)))),https://www.reddit.com/r/alasjuicy/comments/j5xf4s/its_a_big_no_no_no_no/,t2_8auy7u0j,2020-10-06 10:51:54,47
Bakit di ka nakakahanap ng fwb/fubu?,"Dahil bored ako, list down ko lang yung mga alam kong rason kung bakit kadalasan sa mga guys ay:
-hindi nakakahanap ng fwb/fubu
-hindi na ulit minimeet after ng 1st meet-up
-gino-ghost ng kausap

Disclaimer: These are all based on MY experiences and observations during my hoe phase.

    1. Di ka marunong magbasa. Kulang ka sa comprehension. 
-posted one time sa isang sub na maglagay ng isang word which I included sa post kung talagang nabasa nga nang buo post ko. Sa estimate ko, 80% ng nag-dm sa akin ay HINDI NAGBASA. Makakita lang ng F4M post birada na agad. 
-pag ang hanap ay constant kausap, constant dapat. Pag ang hanap ay conversationalist, madaldap dapat dahil malamang sa malamang yung kausap mo e introvert. 

    2. Isa kang sadboi
-paawa effect para makakantot. Yung tipong 2years na daw last sex nya kaya nagpapaawa na need na daw nya makakantot. Pwe. 

    3. Unsolicited nsfw pics
-hindi porke G sa nsfw topics ang girls ay lagi mo na sya sesendan ng nsfw pics. One time, pinadalhan ako ng stolen pic ng girl workmate nya na nakaupo at kita na guhit ng pwet dahil low waist pants nya. MATIC TURN OFF. 

    4. Feeling jowa ka
-matic turn off agad sakin pag d ako agad nakareply then sasabihan ako na ""ay busy na?"" ""anong ginagawa mo kanina bat di ka nagrereply?"" etc. May buhay din po ako at nagiging abala minsan. At wala ka na don kung ano man ginawa ko 🙃

    5. Masyado Kang nagmamadali
-bes, alam kong kantot na kantot ka na pero wag ka naman pahalata masyado na gusto mo na maka-iyot. We also need to know the person bago I-meet. 

    6. Hindi ka masarap ka-sex
-Para to sa mga failed meetups. Yung sobrang galing mo sa chat tapos sa sa actual di mo man lang Napa-cum si girl?? Then mag-aask ng exclusivity? HELL NO.

    7. Di marunong tumupad sa usapan/ dos and donts
-lalo na kung condom is a must. Tapos pupunta ka sa motel ng walang condom?  Pakyu. 

    8. Hindi kayo match ng vibes
-yes, tanggapin na natin na di lahat makaka-vibes natin kahit sa sex. Kaya much better na stop na habang maaga pa. 

Again, lahat to based lang sa experiences ko. I'm not speaking on behalf of girls na nandito. 

Feel free to share kung may ma-add pa kayo. 😉",https://www.reddit.com/r/alasjuicy/comments/yi5h3y/bakit_di_ka_nakakahanap_ng_fwbfubu/,t2_rzfrw42a,2022-10-31 16:55:17,62
A regular sized hotdog?,"
I woke up at around 9 in the morning and my mother told me to have my breakfast already. Kami dalawa ng kapatid ko ginising nya kasi kami nalang dalawa hindi pa nakakain. Hotdogs pala na chicken flavor and regular size yung ulam namin and may beef patties. 

I don't know what the hell happened to me but a hook up partner of mine crossed my mind. It's actually been almost a year since we had our encounter and naalala ko siya dahil sa ulam namin. Don't get me wrong but mas malaki pa yung regular sized hotdog kesa sa d!ck nya 😭 

Istg, uwing uwi ako nung time na yon 😭 I was having a second thought if isuck ko ba or nah but yeah, I sucked him haha expecting that it'll grow bigger but damn, hindi talaga 😭 that's like one of the worsts encounter I've ever had. Kinda offending on my part. 

He's actually 5'10. You can't blame me for anticipating for a bigger like girthy dick diba? 

Ganun ba talaga kapag matangkad na or? HAHAHA I'm not shaming anyone guys, I just wanna know. I'm a very open person. Medj di ko lang yun nagustuhan kasi he's bragging naman kasi sa chat na ganto ganyan. Well, na disappoint ako sa kanya that time honestly.

Natatawa nalang ako now na naccringe sa encounter na yun 😆 hopefully it won't ever happen again. ",https://www.reddit.com/r/alasjuicy/comments/194pfta/a_regular_sized_hotdog/,t2_qgv8wnbyi,2024-01-12 15:36:26,6
Erection Pole Watchers,"Just a curious question for the ladies, trans, bis, and etc..

Now that r/phladyboners is gone, where do you get your daily dose of poles to watch? And do you really enjoy seeing poles as much as men love seeing tits and holes? Why do men enjoy unsolicited tit pics while opposite sa other gender? What qualities does a pole need to have to be labeled as pleasing to look at?

Ps: This is not an invitation to rate my pole.",https://www.reddit.com/r/alasjuicy/comments/ulptea/erection_pole_watchers/,t2_j2m4aswa,2022-05-09 20:12:26,4
PSA: UNSOLICITED Messages are not allowed in this sub.,"Dear AlasJuicy Readers,

It has come to our attention that some of you have received unsolicited dick pics from some users.

If you are getting such messages or any message for that matter, that makes you uncomfortable please don't hesitate to use the modmail to contact the mods.

We aim to make this sub a place where you can share and discuss juicy topics freely without the fear of getting harassed in any way, shape or form.

Unsolicited messaging is a BANNABLE infringement on the sub rules and regulations, regardless if they are dick pics or just plain creepy messages.

Thank you and have a Juicy rest of the day!",https://www.reddit.com/r/alasjuicy/comments/6s5gss/psa_unsolicited_messages_are_not_allowed_in_this/,t2_ferro,2017-08-07 21:20:27,29
Am I normal? Am I unappreciative? or is something wrong with me?,"Hi everyone, I'm curious! Hope you can help me understand myself?

If you'll take a look on my profile you'll see that I've started sharing my nudes online (here on reddit) and all of them have very ""NSFW-esque"" captions (even going beyond the borders of what we or I can consider ""normal"").

I do this postings because I love delving in my sexual fantasies. It gives me a sense or form of validation, feeling of being wanted or appreciated, and feelings of happiness making someone's dick go up. When it comes to my fantasies, it often revolves around the idea of me, being very submissive to my partner. While my partner is able to provide me with everything and he never did lack on these things,(validation, wantedness, appreciation, etc.) and while I get fucked really good every week and get my fantasies of submission come true to life coz he's a really good dom, I sometimes find myself STILL fantasizing about gangbangs, being throated or double penetrated by another guy(s), etc – there is still this weird feeling that I still want to share myself to other guys so that they can also degrade me, tell me how much they want me or want to fuck me, etc. Whenever I get this feeling, I'll just take a a nude, send it to my partner and sometimes just post it here on Reddit so that guys can slid to my DM's and tell me how they want to fuck me, how much they'd like to fuck me and such (and the list goes on). AND THIS, from the comments I have received so far on my nude posts, all of it, the offensive and the unsolicited dick pics, all of them turns me on and at times, makes me wet.

With all of this going on I'm wondering, AM I EVEN NORMAL PA or AM I TOO HORNY NA? AM I UNAPPRECIATIVE OR WHAT?

Send help please fsgswiebfkd",https://www.reddit.com/r/alasjuicy/comments/13fozoe/am_i_normal_am_i_unappreciative_or_is_something/,t2_n3bckit8,2023-05-12 23:55:52,16
Goodbye,"This Reddit account I’m using has been with me through the major ups and downs. I’ve been to places that I didn’t know I could go to and experience things that I didn’t think I would. 

But lately, I’ve been very down and depressed. Thank you for the people who joined me in this sexual journey, the people who lifted up my confidence, the people who jacked off to my photos, and the ones who sent me unsolicited dick pics. 

It has been two great years but the pressure of acads, personal problems, and this pandemic has taken its toll on me. I will be removing this account and its content permanently. 

Thank you, guys. Peace out! ✌🏽",https://www.reddit.com/r/alasjuicy/comments/n9s5nb/goodbye/,t2_3dxxdvgd,2021-05-11 16:25:35,21
Am I doing something wrong?,"so I have a bestfriend, known her since JHS and still really close today. Recently I’ve started to see her in a more sexual way but I never act on it since she has made it clear back then that she could never see me as more than a friend, and I’m fine with that. Pero it’s just whenever I see her I act up a bit, for context, she’s 5 flat small tits and a round ass, not really my type but there’s something about her that just makes me feel horny. So now when she sends me selfies and stuff for my thoughts I tend to masturbate to them and then regret it very soon. Is what I’m doing wrong and should I stop it?",https://www.reddit.com/r/alasjuicy/comments/upns9b/am_i_doing_something_wrong/,t2_8k29q57w,2022-05-15 02:53:53,2
"Boyfriend keeps on posting thirst traps. As a girlfriend, am i being too unreasonable for being uncomfy and annoyed?","Hi guys! Apologies if I ask this kind of question here but I seriously need insights. This has been bugging me for the longest time already.

My boyfriend and I have been together for 3 years already. Between the two of us, siya talaga yung mas outgoing and social media person. Recently, he started posting topless pics on his soc med accounts and at first, no malice naman. I was just letting him do his own thing: your body your choice, let’s celebrate these bodies kind of thinking. I don’t really mind at first pero these past few weeks, I get uncomfy when I view his socmed accounts and see unsolicited comments from other guys/bis in the internet. Most of his followers are gays/bisexuals and I get uncomfy about this to the point na I actually questioned his sexuality. As a gf, I feel disrespected pero ayoko naman din maging over controlling and manipulative type of gf. 

I tried to tell him about this and he told me na wag nalang daw pansinin and he’s just cool receiving those comments. Hanggang tingin lang naman daw sila and he doesn’t respond naman to those comments. So di ba how can I be offended if okay lang naman pala for him? But I know deep down, I’m getting annoyed and frustrated about this. 

He told me na it’s just his way seeking for validation, expressing himself etc. External validation can be helpful sometimes but idk. He told me he’ll stop posting videos but at the same time, I feel guilty since I don’t want to be the manipulative, jealous girlfriend. I don’t want to stop or put an end to his ‘outlet’.

How can we solve this? Am I being too controlling? Do I need to be more open minded and accept na ganon talaga trip nya? But at the same time, how about my feelings? Aren’t my feelings valid din at the same time? I just want to solve this like a mature adult couple but clearly there’s a friction on how we view things. How can we come up with a compromised setup? Can this still be solved or this just shows that maybe we’re not actually that compatible??? If you’re in my position, what would you do???????",https://www.reddit.com/r/alasjuicy/comments/li4pfr/boyfriend_keeps_on_posting_thirst_traps_as_a/,t2_82et0b99,2021-02-12 13:38:48,13
A Beginner's Guide for Guys on How to Score on r/phr4r,"\[Edit1: Added some tips given by a commenter below!\]

\[Edit2: Newly discovered tip delivered to you fresh from the oven! Okay, so far this post has been up for 18 hours and I've already got 3 indecent proposals from girls in my chat - one even outright sent me her nudes! Didn't reach a meetup agreement with any of them though (so far lol) but I'm amazed at how this post which wasn't at all intended to fish for hookups is making me look pretty good right now. From what I observe, the girls who messaged liked my vibe and imagined that they would get along with me. So tip is if you're not getting anywhere on r4r, try posting a piece about whatever on whichever sub but make the reader know about what kind of personality you have through your stories/words while also giving subtle hints that you're down to get a bit freaky. If they enjoy what they read, they might message you to get to know you more! P.S. What an absolutely wonderful start to a day this is! Haha\]

I'll preface this by stating that I'm surely not the most qualified to write this as there are probably savvier guys who could do a lot better than me, but I'd still like to share the things I learned and how I've improved my r4r game and how maybe you can too.

Why am I sharing when I could keep this all to myself? Ewan, bored at work? Throwaway account karma? Tbh a big reason is sometimes I get so frustrated with our gender whenever I read stories on here about how fucking creepy some of my fellow men have been acting to the point that they've pushed a number of girls away from r4r because of rude and unsatisfying encounters. So ladies, this one's also for you. Iniisip ko rin na if there are higher quality men on that sub, the more likely women are going to recommend it to all their other friends, so here goes..

\[For context, I am your average looking, average height, average BMI, stable job but not rich, lives with my siblings but I have my own car, big 4 grad (eww, ikr??), and generally just a ""good vibes only"" type of person with no major problems or red flags that I'm aware of. I have hooked up with 7 different girls from r4r since I started last March - 2 were multiple encounters and 5 were one night stands and to my understanding, this is already a very successful count especially given the fact na medyo choosy pa ko when it comes to physical appearances. For further context, I'd say I've swapped pics with about 30 or so redditors. Among them, 7 lang yung we were both game, 10 who only I sent a pic but they passed so I didn't bother asking for theirs, another 10 yung they were g for me but I passed after they sent their pic, and siguro another 5 yung we both exchanged pics but we both passed on each other. - all estimated numbers of course but thereabouts.\]

**1. If all you've been doing is constantly messaging the girls whose posts you see on your reddit homepage with already a hundred upvotes and posted more than hours ago, you're in for some hard work and you're basically playing the lottery at that point.**

Those posts you see have already probably received at least a hundred messages and they will most likely not respond to you anymore even if you think you've come up with an eye-catching message. As a social experiment, I made a throwaway just to post as a female wherein all I said was I'm looking to have drinks with someone tonight, not even specifically NSFW. 134 fucking replies in less than 1 hour. Putangina hahaha. I didn't reply to anyone cos I'm already testing my moral compass with this experiment, but I did read through a couple of them and unfortunately majority are just plain sad with how lazy the replies are - ""Hi I'm g"" / ""27M QC here"" / ""tara inom mamaya san tayo"". Hay... More on this later.

6 out of the 7 girls I've hooked up with have been through them replying to my posts. And I have tried messaging them on their posts but now I only do when I've been browsing under the ""New"" section and the post is less than 5 minutes old (anything longer and I already assume I'm the 100th guy to message and thus won't ever be seen). Your best bet would still be by posting an ad yourself!

Side note and rant for the guys: Why are you people upvoting all the F4M posts?? Kung gusto mo mas konti kalaban mo sa nahanap mong post, edi wag mo iupvote para hindi lumabas sa feed ng lahat ng lalaki!

**2. Learn how to stand out from the sea of M4Fs.**

Try having a scroll through r4r and see how many posts titled ""Looking for constant fubu"" or ""let's have some fun tonight"" there are. Sa tingin mo mapapansin yan ng maraming babae? Use your beautiful mind and get those creative juices flowing with a witty or even flaunty title that's exponentially more likely to pique a girl's curiosity. If you've got the resources that you think most girls would be thirsty over (i.e. a desirable job \[doctor, lawyer, etc\], a jacked up body with abs, a BGC/Rockwell condo), go put that shit in title! Anything creative and unique is guaranteed to get more clicks than just another generic title, no matter how gwapo you are or how big you think your dick is.

This also applies to when you're messaging girls who post. Be concise yet substantial and engaging. Unsolicited dick pics are almost always not appreciated, and for crying out loud kung tagged as SFW yung post ng babae, wag ka na mag pursiging magtanong kung may chance bang pwedeng NSFW. Fucking cringe. \[Edit1: And also, pag alam mong hindi ka pasok sa preference, wag nang makipagtawaran. Ano to, Divisoria? Pag sinabi nang 30+ only, wag na magtanong kung pwede ba 25. Kung sinabi nang Metro Manila only, wag ka na mag message if you're from Cebu!\]

**3. Be fucking confident in your tone!**

Okay, this one I'm not 100% sure cos I've never posted anything similar, but I really believe no girls would respond to hookup posts wherein guys say pabebe shit like ""I'm inexperienced so I hope you can teach me more about this stuff"" or ""we can be friends or we can also be fubus if you want"". Be confident and direct with what you want. State your concrete plan on how you'd like to go about the meetup, like example you want to have drinks at this bar first to set the mood first or some shit. If you're a noob at sex, you don't have to state it. Just be your confident self and tsaka mo na problemahin sa kama kung hindi mo na alam gagawin mo. At least may chance na after that night, experienced ka na ;)

**4. Re-post at different times!**

Almost don't wanna put this here since it's technically mej spamming, but no matter how well-written you believe your M4F post is, it's really only good for an hour or two. After that, it's gonna be buried under all the new ones that come after each minute and never to be seen again. If you didn't get any luck with your post, copy what you wrote, delete it, then post again. To keep it at least a little bit classy, I re-post at least 4 hours after and only really only re-use what I wrote about 3 times till I have to write another one for a different day. Ika nga, more entries, more chances of winning!

**5. If you're going to post or message, it's best to use a throwaway account.**

Unless your profile only consists of posts or comments you've made in the past which you think adds to your unique selling proposition, please just use a throwaway especially if your account contains engagement with NSFW subs. Girls would go through your profile before messaging you and one little comment 4 years ago is all it takes for them to second-guess their intention of chatting you. Best to just be a mystery and adjust your play accordingly with the woman you're messaging.

(Bonus tip which would probably get this post downvoted: if you're from Big 4, sorry but you're gonna have to state that fact in your About Me. Yung style ngayon is you put ""if it matters"" right next to it para di ka masyado madownvote LOL. You don't need to put that in your preferences or About You na you're looking for Big4 also if you're not particular naman about it. But the sad truth is, 4 of the 7 of my hookups are from the Big 4 and I'm quite sure they're the type na wouldn't have messaged me if I didn't state na I was from Big 4. Pero please, if hindi ka galing dun, wag ka magsinungaling. Unang convo mo pa lang sa babaeng Big 4, malalaman na kagad niya na you ""be cappin' fr ngl tho"")

That's all I could think of for now. Fellow men, feel free to share if you have any more tips. For women who've made it this far, let me know the accuracy of the points I've shared!",https://www.reddit.com/r/alasjuicy/comments/x33s5d/a_beginners_guide_for_guys_on_how_to_score_on/,t2_s2dtc6jo,2022-09-01 18:12:18,153
